start	end	text
0	9000	Wow, there we go.
9000	15000	Fall into your hand, I commend your spirit.
15000	18000	Oh, my God.
18000	20000	Testing, testing.
20000	25000	Uno, dos, tres, cuatro, cinco, cinco, seis.
25000	31000	I know it's kind of hard just to get off one, two, three.
31000	33000	He asked for a thirteen, yeah?
33000	37000	He drew a thirty-one, so he's trying to hard.
37000	42000	Good morning, good evening, good after.
42000	44000	Below the name.
44000	45000	Okay?
45000	49000	I am none other than Shony Culls and I am playing...
49000	52000	It took me a really long time to be able to screen capture
52000	55000	my legitimate Game Boy Advance that I own.
55000	57000	Oh, it's fantastic.
57000	60000	Really, really fantastic technology.
60000	63000	May or may not, I have just softlocked my PC
63000	67000	and that is why I had such trouble getting on fucking line.
67000	71000	But lo and behold, we are here.
71000	74000	I'm just gonna make sure...
74000	75000	Oh.
75000	77000	Okay, so this...
77000	79000	This thing.
79000	81000	Okay, we're good.
81000	82000	This thing.
86000	87000	Oh my god, oh my god.
87000	89000	I should become an opera singer.
89000	91000	I'm that bloody good.
91000	92000	What's that?
92000	94000	I have smoke up my ass.
94000	96000	Okay, my little reeflings.
96000	99000	Today on the agendination.
99000	100000	Are you doing okay?
100000	104000	Yes, I'm farting up a storm, so alcohol definitely makes you fart more,
104000	106000	if you want to know.
106000	108000	Um...
108000	110000	Uh, what's my sentence?
110000	113000	Um, in four hours time,
113000	115000	we're gonna do a membership stream,
115000	117000	which isn't actually up right now.
117000	119000	Cause...
119000	123000	I maybe didn't put it up yet.
123000	124000	Me?
124000	126000	I've been able to get something up?
126000	129000	Impossible, impossible.
129000	132000	Um...
132000	134000	Wait, what's our name in Zelda gonna be then?
134000	135000	Oh, sorry.
135000	137000	The legend of long.
137000	138000	Wait.
138000	140000	Was it AB?
140000	141000	Uh, right.
141000	142000	Ah.
145000	148000	Oh wait, the in-game character is gonna call us Anon.
148000	150000	No, call us Link.
150000	151000	Link.
151000	153000	We came to town.
153000	155000	We came to save.
156000	159000	Uh, yes, we are doing the forbidden tier list ring.
159000	163000	I am gonna need a kind reefling to send me the Link
163000	166000	and marshmallow, cause I actually don't even have the Link.
166000	168000	Uh, cartoffel of doom.
168000	170000	Thank you very much for coming to member.
170000	173000	Yeah, everyone's need to go and show the number.
173000	174000	Oh!
174000	176000	Why would you never?
176000	177000	Save file.
177000	181000	Do not touch the completely legitimate Nintendo.
181000	183000	Wow.
183000	185000	Damn plane.
185000	187000	The controls are a bit wrong, but...
187000	188000	Wah, I'll read it.
188000	189000	Don't worry if you can't read.
189000	191000	I'll read it for you.
191000	194000	A long, long time ago.
196000	200000	When the world was on the verge of being swallowed by shadow.
205000	212000	A tiny picori appeared from the sky, bringing the hero of men a sword and a golden light.
212000	216000	With wisdom and courage, the hero drove out the darkness.
222000	227000	When peace had been restored, the people enshrined that blade with care.
235000	237000	You've never played Minish Cap?
237000	241000	The funny thing is, Minish Cap is the only Zelda game I've actually played.
244000	246000	Look, it's Zelda!
246000	248000	This is what the entire series is named after.
248000	251000	This little pink pixel here.
251000	255000	The entire series is named after her.
255000	257000	Because everyone...
257000	261000	Ah, made the mistake of thinking that Link is called Zelda as well.
261000	263000	Good morning, meh.
263000	266000	Good morning, meh, meh.
266000	269000	Good morning, Princess Zelda.
269000	272000	Did you sneak out of the castle and come all this way alone?
272000	275000	The moon is so sure to be worried about you.
275000	277000	You know how he gets.
277000	281000	Oh, don't worry about him. He'll be fine. Where's Link?
281000	287000	The whole town is bustling for an annual picori festival.
287000	290000	I thought he and I might go together.
290000	293000	Would you mind? Terribly.
294000	296000	Oh, is that what you're here for?
296000	300000	Well, Link was up late helping me last night and he's still asleep.
300000	303000	But I don't have an errand at the castle.
303000	306000	Yes. Oh, but I do have an errand at the castle.
306000	308000	Yes, that should be fine.
308000	310000	Ah, yes, Legend of Zelda.
310000	313000	Kinks of Weakening, Ike, Void Sword...
313000	315000	Void Sword, sure.
315000	317000	Thank you for the tip. I don't think I was going with Void Sword.
317000	319000	But yes, that should be fine, yes.
319000	323000	Link! Time to get up!
326000	329000	Did I see Nintendo Direct today? No.
329000	332000	Link! Link, I said it's time to get up!
334000	336000	Eh?
336000	338000	Man, I was fapping.
338000	340000	Goddamn, got that morning wooden shit.
341000	343000	I just love these pixel games.
343000	352000	Oh my god, did you know in the VTuber community, someone is making a Legend of Zelda inspired like little fucking Cedar game?
352000	356000	Like, you're at a cafe and shit? I'm gonna be all over that stuff.
356000	358000	Hold on, funding it right now.
359000	360000	Huh?
361000	364000	Oh shit, my freaking tea.
364000	366000	Hey, Link!
366000	371000	Princess, then it lies how I should like to know if you'd like to join her at the festival.
371000	375000	Yeah Link, come on, let's go check out the festival together.
375000	379000	Master Sith already gave me permission to take you.
379000	382000	Well, handed off like a dog.
382000	387000	Yes, after all, the festival only comes once a year. God, have fun.
387000	390000	And while you're there, you can do me a favor.
390000	395000	I just finished making the sword for the minister at Hyrule Castle.
395000	398000	I'd like you to deliver it to him.
401000	405000	You, you accepted the sword.
405000	409000	Make sure you don't lose this extremely important delivery. I won't.
409000	414000	This is the blade that will be presented to the winner of the competition.
414000	419000	Don't lose it. And while the two of you may be childhood friends, remember...
419000	420000	Are you?
420000	423000	Remember, Zelda is the princess of Hyrule.
423000	427000	You watch over her, don't let anything bad happen to her.
427000	432000	Master Smith, quit worrying. I'll be perfectly safe.
432000	436000	Come on, Link, let's go. Check out the festival.
436000	439000	Hold on, let me take a little flip.
440000	442000	Friends owned. Are you joking me?
442000	445000	Do you remember that meme that went really viral?
445000	448000	And it was like, a knight. It was like a princess and a knight
448000	451000	and the princess was getting like booed by the crowd or something.
451000	454000	Now sell it. You can't sell a sword.
454000	457000	Oh, you called me a sell sword, exactly. I got you. 4k.
457000	461000	Check out the festival under her skirt.
461000	464000	Rifle ends. You're feeling it the day you knocked in Ellie's.
464000	468000	Now, if I'm not mistaken, if you're a snowberry,
468000	471000	there should be a membership ASMR going on right now.
471000	473000	Question mark. I have no idea.
473000	476000	I think that's from Aces schedule.
478000	481000	Mercy's off the day. I'm trying to use my autism.
481000	484000	Azura is also off today.
484000	487000	Emmy and Sheebie is on.
487000	491000	Sheebie has a collab and Emmy has a collab
491000	495000	and a day's time with people not in real life.
495000	499000	Thank you, question mark. I can't remember what they're playing today.
499000	502000	That's right. She had to reschedule.
502000	505000	She pushed it to tomorrow. It's delayed.
505000	508000	Oh, probably Aces' call. Alright, okay.
508000	512000	Je comprends, je comprends. Right, let me try and host this honey tea down.
512000	515000	Next week, we're going to write the honey tea plot together,
515000	518000	so I see exactly what you want me to say and I was so fucking excited.
519000	522000	Wow, listen to that music.
522000	525000	This is a Game Boy Advance game.
525000	530000	Oh, listen to that harp, that harmonious.
530000	532000	Wow.
532000	534000	It's so good.
534000	536000	I saw it.
538000	544000	I was going to actually consider making the songs for Jin to be still for this game.
544000	546000	I don't know.
546000	551000	The rules are, if there's any more background music that gets produced,
551000	554000	it has to be a childhood game or a game that I really like.
554000	559000	But Zelda is very peaceful, but I'm not actually sure we have any peaceful concept.
559000	561000	And Jin too.
561000	564000	So far, I don't think anyone is peaceful.
564000	567000	I don't think we have one peaceful person at all.
567000	570000	Azura. Azura is peaceful. She's peaceful.
571000	574000	This would do Azura with a harp.
574000	577000	I maybe should have gone with a harp.
577000	580000	I would be real. I don't even remember all from yesterday.
580000	584000	Turns out chugging a ball. Oh my God, you did not have a football ball.
585000	588000	Strony, what's your opinion on the new Zelda game?
588000	590000	Whatever your opinion is, because I've never played it.
590000	594000	This is the only Legend of Zelda game I have ever had access to and played.
594000	599000	What about Earthbound? I don't know what Earthbound is.
599000	604000	I'm sorry, I'm just getting used to the controls on my...
604000	606000	I'm not going to open this chest because it's got money in it,
606000	609000	and I don't want to waste that opportunity to have that money.
609000	612000	But look how freaking adorable this pixel art is.
612000	615000	Is this not freaking precious?
615000	618000	I'm going to give it to the princess like this.
618000	620000	Yeah, you take that.
620000	622000	Wait, can I do it over the bed?
622000	625000	Hold on. Oh my God, there's two beds for me in the print.
625000	628000	Yeah, you like that. Oh look, I'm making my bed.
628000	631000	Oh look, I need to get all the sheets all smoothed out.
631000	633000	I don't want any creases.
633000	635000	Oh yeah, you like that princess.
635000	638000	I need to practice and I need to get my practice in
638000	640000	for what happens after the festival.
640000	642000	Yeah, teach you that better lesson.
642000	644000	Yo, is that the master sword?
644000	647000	Earthbound is a game...
647000	649000	is a game Ness is from.
649000	652000	Might have seen it in Smash Bros. It's an old Nintendo game.
652000	654000	Oh, come with us.
654000	656000	Making the views.
656000	658000	Link, over here.
658000	660000	Oh, sorry, sorry, Zelda was just pumping.
660000	662000	Sorry, I was just having a cheeky pump.
662000	664000	Right, how's the roll button? Oh, there it is.
664000	667000	Link, hurry, let's go.
667000	670000	You moan in like every sentence.
670000	672000	Is that how you normally talk?
672000	674000	Over here. Come on, hurry up.
674000	676000	Whoa, whoa, whoa, whoa.
676000	677000	Princess, what's going on here?
677000	679000	Well, here we are.
679000	681000	I'm trying to play.
681000	684000	Princess, princess, it's first thing in the morning, hen.
684000	686000	Wah!
693000	696000	Here we are, Link. Doesn't this look fun?
696000	699000	Come on, let's look around.
699000	702000	Wow, look all the free colors.
702000	705000	I'm getting stimulated.
705000	708000	Welcome to the PCORI Festival.
708000	712000	They say that every 100 years, the PCORI comma high rule.
712000	714000	And this is the 100th year to the day
714000	717000	since the last time the PCORI were here.
719000	722000	Wah, hello, princess.
722000	724000	Link, here's the storyteller here.
724000	727000	We should stop and listen to...
727000	729000	I wonder what's over there.
729000	732000	Jeez, you got ADHD, princess.
732000	734000	You don't need a little stimulant.
734000	735000	I can stimulate you.
735000	737000	So the PCORI are real.
737000	739000	My father always told me they were.
739000	741000	Oh, look at that.
741000	742000	I know.
742000	744000	As long as she's happy, that's the main thing.
744000	746000	Hey, wasn't there going to be
746000	749000	a sword fighting tournament at the castle?
749000	751000	I wonder who won this year.
751000	753000	Oh, wow, over here.
755000	757000	Oh, it is this.
757000	759000	Oh, pardon me.
760000	763000	We have a winner.
763000	764000	Oh my.
764000	766000	Oh my, Princess Zelda.
766000	769000	You won the grand prize in her drawing.
769000	772000	Wow, that's totally not rigged against everyone.
772000	776000	You get your choice of any of these wonderful prizes.
776000	778000	What will it be?
778000	782000	First, we have this lovely heart-shaped stone.
782000	784000	Next, we have...
784000	787000	This magnificent gem.
787000	792000	And finally, there's this tiny shield.
792000	795000	So which one will you like?
795000	796000	Let me guess.
796000	797000	The jewel?
797000	800000	Oh, but this heart-stone is very cute, too.
800000	803000	Choose whichever one you like.
803000	805000	This shield is so adorable.
805000	806000	I heard that.
806000	808000	She likes a small tiny.
808000	810000	I think I'll take it.
813000	815000	Following Strony around the convention
815000	817000	late to the school arts alley.
817000	818000	What?
818000	820000	I'm looking for Rebecca art.
820000	821000	What? Why?
821000	823000	Why would you want that ugly thing?
823000	825000	What about the heart-stone?
825000	826000	It's cute.
826000	829000	Oh, or this giant gem. It's pretty.
829000	831000	Honestly, they're both much nicer
831000	833000	than that nasty little shield thing.
833000	834000	Jeez.
834000	837000	Can I put this in a script?
837000	839000	Nope, I want the shield.
839000	841000	Can I have it?
841000	843000	What a strange princess you are.
843000	844000	Well, okay.
844000	847000	Here's your teeny tiny shield.
851000	853000	Here, I want to give you a present.
853000	856000	It'll match the size of your...
856000	858000	Doesn't the shield suit you perfectly?
858000	859000	Like...
862000	864000	Give you a small shield.
864000	866000	Hold the button to protect yourself.
866000	868000	It is a little embarrassing though.
868000	869000	It's so tiny.
869000	872000	What the heck is going on here?
874000	876000	Oh, he's stutting on him.
876000	878000	Yep, just as I thought.
878000	879000	You look great.
879000	880000	Now, if anything happens,
880000	882000	you can protect me with that shield.
882000	884000	Oh, I almost forgot.
884000	887000	We have to take Master Smith's sword to the castle.
887000	888000	Let's go, Link.
888000	890000	How do I do this?
890000	891000	What?
893000	895000	I will protect you, my lady.
895000	897000	My lady, come, come, my lady.
897000	898000	You must sugar fly.
898000	899000	My bunny, my heady.
899000	900000	That's not the words.
900000	901000	Oh, what the fuck?
901000	902000	Sorry.
905000	908000	This game explains your first outing on Patreon.
908000	909000	Come on, Link.
909000	911000	Let's hurry to the castle.
912000	914000	Wa-wa-wa-wa-wa.
916000	917000	Bonk.
917000	918000	Oh!
918000	919000	Hey!
919000	920000	Ouch!
921000	924000	Not to be the business scrub...
924000	925000	Business scrub.
925000	926000	That's me.
926000	928000	Business scrub.
928000	929000	Wait, that is the same.
929000	931000	It must be the business scrub.
931000	934000	I heard the soldiers talking about it.
934000	936000	They were just saying a dicky scrub
936000	939000	had been hassled in all the passages by...
939000	941000	Link, do something about it.
941000	943000	Otherwise, we can't get to the castle.
943000	945000	If only we had some way to defend ourselves
945000	947000	against those nuts of his.
947000	948000	Wait, what?
950000	952000	It's too early in the morning.
952000	954000	It's too early.
955000	957000	Please forgive me, sir.
957000	959000	I heard that was a festival
959000	961000	and I came to town helping my...
961000	963000	to hawk my words.
963000	966000	Unfortunately, we scrubs have a tendency
966000	968000	to spit nuts as we speak.
968000	970000	Everyone's got scared and ran away
970000	972000	and no one would buy anything.
972000	974000	This is a terrible place to do business.
974000	976000	I'm going back to my cave.
979000	982000	I actually feel a little sorry for that business scrub.
982000	984000	But that net hurt!
985000	987000	Oh well, he won't be hassling anyone now.
987000	989000	We better hurry to the castle.
990000	992000	Wow.
1001000	1003000	I'm getting Australia overload.
1019000	1021000	That's kind of the part of the plan, you know?
1021000	1023000	You see, we've not executed the plan yet
1023000	1025000	but there's many ways to main break them.
1040000	1042000	I'm sorry, Link, but I'd better go.
1042000	1044000	I have to prepare for the ceremony.
1044000	1046000	I had a good time at the festival.
1046000	1048000	Thanks for coming with me.
1050000	1052000	Since you're here, Link,
1052000	1054000	why didn't you join us for the award ceremony?
1054000	1056000	No point in going home, old chap.
1056000	1058000	Just join us.
1058000	1060000	Why not? You're here anyway.
1060000	1062000	Oh, look, it's me and the boy, Potho.
1064000	1066000	I do know about that sword, Link.
1066000	1068000	It is called the PCORI BLADE
1068000	1070000	and it looks much evil.
1070000	1072000	What?
1072000	1074000	And it locks much evil away in that chest.
1074000	1076000	Sorry, it's a bit early in the morning
1076000	1078000	to be talking about Gothic architecture.
1078000	1081000	The PCORI BLADE is sacred among the people of Hyrule.
1081000	1083000	The legend has it that, long ago,
1083000	1085000	the PCORI gave us this blade.
1085000	1087000	Whoever wins the competition
1087000	1090000	earns the honor of touching the sacred blade.
1090000	1093000	Would you let me touch your sacred blade?
1095000	1097000	Whoa, big daddy in the horse.
1097000	1099000	Fuck's it, he's truly twice the size of his elder.
1102000	1105000	Let the award ceremony commence.
1105000	1108000	Avati, champion of the competition,
1108000	1110000	you may approach the blade.
1112000	1114000	Was that Conqueror's Bad Ferdy?
1114000	1116000	It absolutely was.
1119000	1121000	King Chonk of Hyrule.
1124000	1127000	To think things would go this well,
1127000	1130000	the PCORI BLADE and the bone chests
1130000	1133000	spoken of the Hyrllian Reborn.
1133000	1136000	This chest must hold that which I seek.
1136000	1139000	I relieve you of its contents now.
1150000	1152000	Do not interfere with that.
1152000	1154000	Me?
1154000	1158000	As Victor, I earned this right to approach the PCORI BLADE.
1158000	1161000	I've been waiting for this moment.
1162000	1165000	I don't know why Scottish people are evil, but...
1165000	1168000	Oh wait, maybe they'd be British, like English.
1168000	1170000	I've been waiting for this moment.
1170000	1172000	Okay, okay, sorry.
1177000	1179000	Protecta Zelda?
1179000	1181000	Eh, yeah, no, let's do it.
1183000	1184000	Wait, what's the British voice?
1184000	1185000	Who are you?
1185000	1186000	Why are you doing this?
1186000	1187000	Oh wait, that's Zelda.
1187000	1189000	Who are you? Why are you doing this?
1190000	1193000	The princess with the mystic aura.
1193000	1196000	The power that was gifted to the people of Hyrule
1196000	1201000	still flows within the veins of that lady.
1201000	1204000	The veins of the ladies of its royal family.
1204000	1205000	Interesting.
1205000	1209000	If I leave you now, you will only cause me trouble later.
1209000	1211000	That will never do.
1213000	1215000	To stone with you!
1216000	1217000	Run now!
1217000	1219000	Ah, Zelda now!
1223000	1226000	All who stand in my way shall share this fate.
1226000	1229000	Now to find out what power awaits me in the chest.
1238000	1239000	Ete!
1239000	1243000	There is nothing in there but a rabble of monsters.
1243000	1245000	What's the meaning of this?
1245000	1250000	Well, I know the force and I'm after it's somewhere out there.
1250000	1252000	I'm in no hurry.
1252000	1254000	I can take my time searching for it.
1259000	1261000	Classic British stealing things.
1261000	1262000	Exactly, yes.
1262000	1265000	I thought Star Wars reference too, but I'm probably just...
1265000	1268000	Oh my god, we're in a castello!
1268000	1271000	Oh my god, this is the Borgia Castle, clearly.
1271000	1273000	Wake up, wake up.
1273000	1275000	Put on a little bit of makeup.
1275000	1277000	Oh, we need to make the bed for the maid.
1277000	1278000	Oh, I'm so sorry.
1278000	1279000	Oh, you want to take over?
1279000	1280000	Oh, hold on.
1280000	1283000	Oh shit, I interact with people when you do that.
1284000	1287000	I was gonna hump her, but I interact with people when you do that.
1291000	1292000	Erlink, you're awake.
1292000	1293000	Are you feeling alright?
1293000	1295000	Stand at my side.
1295000	1297000	The king of Hyrule is about to speak.
1298000	1301000	It is as you have all heard.
1301000	1307000	A sorcerer named Vati has cursed my fair Zelda and turned her to stone.
1307000	1312000	If we had the sacred PCORI blade, we likely could have broken the curse.
1312000	1315000	But Vati shattered the blade.
1315000	1318000	However, I have not given up hope.
1318000	1320000	What do you know about the PCORI?
1322000	1325000	Er, the PCORI, not much.
1326000	1327000	Beyond what?
1327000	1329000	Oh fuck, these both have the same voice.
1329000	1335000	Beyond what the fairytales say, they're supposed to be very tiny if I remember correctly.
1336000	1341000	It is the ones from the fairytales, but the PCORI are no mere legend.
1341000	1343000	They are certain exists.
1343000	1347000	No one outside of the royal family knows the truth about them.
1347000	1353000	The PCORI who forged the sacred blade lived deeper than the Minish Wars.
1353000	1359000	They should be able to repair the broken blade and reforge the sword.
1359000	1361000	What?
1361000	1365000	There must be dispatch the soldiers there at once.
1365000	1368000	No, soldiers will not do.
1368000	1372000	The PCORI do not show themselves to anyone but children.
1372000	1378000	Our soldiers could search for days and still fight no cycle.
1379000	1382000	I see.
1382000	1385000	That's the case, then why not send Link?
1385000	1391000	If Link has recovered then yes, I would like to ask him of this.
1391000	1395000	Please, turn my precious Zelda back to normal.
1395000	1400000	The PCORI should know how to create a new sacred sword.
1400000	1406000	It will be a dangerous journey, now that those monsters have been freed.
1406000	1412000	Please, take the sword with you along with the broken PCORI blade.
1416000	1419000	Broken PCORI blade!
1420000	1426000	This is part of the sword needed to be forged with sacred sword. Do not lose it.
1429000	1431000	Smith sword!
1431000	1434000	It's a sharp blade made by your grandfather.
1434000	1435000	Very well then.
1435000	1440000	Very well then. Send the soldiers to search for that in the world.
1444000	1449000	Deep within the Minish Woods you will find the place called Deepwood Shrine.
1449000	1454000	Once, humans and PCORI ship that shrine as a meeting place.
1454000	1459000	I think it would be best if you started your search there.
1460000	1464000	Take this map with you.
1464000	1468000	If you get lost on your way to the forest then please check your map.
1468000	1471000	Just press start and then this stuff.
1471000	1474000	And I've marked it on the location of the forest view.
1474000	1476000	Gluck and be careful.
1477000	1480000	You got the map of Hyrule!
1480000	1482000	Now you'll never get lost.
1483000	1484000	Bottom right.
1484000	1486000	You have to go bottom right, okay?
1486000	1489000	The child will learn to kill. Send the child.
1489000	1492000	The child and yearn for the mines.
1492000	1495000	I am counting on you, Link.
1495000	1498000	Only you can break Barty's curse of free princess.
1500000	1503000	Okay, let's unprofessionally roll out of this castle.
1504000	1507000	I like the game. What's the name of the country?
1510000	1513000	This is based in America? What?
1514000	1516000	The Chales will become a man.
1516000	1517000	Be a man.
1517000	1521000	You must be slipped as the Corsing River.
1521000	1524000	Man, you must just take off that dress.
1524000	1526000	Fire through the mouth.
1526000	1531000	Man, you must just take off that dress.
1531000	1532000	Miss...
1544000	1547000	You're in my way, you're in my way, you're in my way.
1547000	1550000	That's fine. I'll forgive you.
1573000	1581000	Oh, we got coins!
1582000	1586000	You've got one rupee. It's green. Don't spend all in one place.
1586000	1589000	You guys wouldn't spend me all in one place, would you?
1594000	1597000	I've not accidentally left reverb on, have I?
1598000	1600000	One coin, let's go.
1601000	1605000	You guys will have to remind me at the four-hour mark I'm to get off,
1605000	1608000	because we're playing the rest of the game tomorrow.
1608000	1612000	I'm doing the Forbidden Tearless, and I already didn't forget.
1622000	1626000	Yes, I have played this game in childhood a couple of times,
1626000	1629000	so I'm not too terrible.
1629000	1632000	Watch me eat my words in about an hour's time, but...
1632000	1634000	You can't do anything yet.
1634000	1636000	I'm not in one place, but I'm sure you can.
1636000	1638000	You're awesome.
1638000	1640000	Multiple, but multiple, please.
1640000	1643000	I know, I can't believe that I'm not finishing a game in one go.
1643000	1646000	It's absolutely crazy. It's terrible.
1648000	1650000	Help! Help me!
1651000	1652000	Ouch!
1652000	1654000	Want somebody stop him?
1654000	1656000	Ow! Ow! Help! Somebody!
1656000	1658000	Can't anyone hear me?
1658000	1660000	I don't want boys to get these guys.
1664000	1666000	No, it's definitely a guy-hat.
1666000	1668000	There are many hats in the world.
