start	end	text
9307360	9309360	Do you want me to do it again?
9309360	9311360	Do you want me to do it again?
9311360	9313360	Do you want me to do it again?
9313360	9315360	Do you want me to do it again?
9315360	9317360	Do you want me to do it again?
9317360	9319360	Do you want me to do it again?
9319360	9321360	Do you want me to do it again?
9321360	9323360	Do you want me to do it again?
9323360	9325360	Do you want me to do it again?
9325360	9327360	Do you want me to do it again?
9327360	9329360	Do you want me to do it again?
9329360	9331360	Do you want me to do it again?
9331360	9333360	Do you want me to do it again?
9333360	9335360	Do you want me to do it again?
9335360	9337360	Do you want me to do it again?
9337360	9339360	Do you want me to do it again?
9339360	9341360	Do you want me to do it again?
9341360	9343360	Do you want me to do it again?
9343360	9345360	Do you want me to do it again?
9345360	9347360	Do you want me to do it again?
9347360	9349360	Do you want me to do it again?
9349360	9351360	Do you want me to do it again?
9351360	9353360	Do you want me to do it again?
9353360	9355360	Do you want me to do it again?
9355360	9357360	Do you want me to do it again?
9357360	9359360	Do you want me to do it again?
9359360	9361360	Do you want me to do it again?
9361360	9363360	Do you want me to do it again?
9363360	9365360	Do you want me to do it again?
9365360	9367360	Do you want me to do it again?
9367360	9369360	Do you want me to do it again?
9369360	9371360	Do you want me to do it again?
9371360	9373360	Do you want me to do it again?
9373360	9375360	Do you want me to do it again?
9375360	9377360	Do you want me to do it again?
9377360	9379360	Do you want me to do it again?
9379360	9381360	Do you want me to do it again?
9381360	9383360	Do you want me to do it again?
9383360	9385360	Do you want me to do it again?
9385360	9387360	Do you want me to do it again?
9387360	9389360	Do you want me to do it again?
9389360	9391360	Do you want me to do it again?
9391360	9393360	Do you want me to do it again?
9393360	9395360	Do you want me to do it again?
9395360	9397360	Do you want me to do it again?
9397360	9399360	Do you want me to do it again?
9399360	9401360	Do you want me to do it again?
9401360	9405360	....
9406160	9407360	Give me future
9407360	9409360	Give me future
9409360	9411360	Give me future
9411360	9413360	You are too f**king thrown in a border
9413360	9415360	Where my god?
9415360	9417360	Gimli and Beato came flying around the corner
9417360	9421360	I was like ooo
9421360	9423360	I may or may not have forgotten to feed them this morning
9423360	9425360	Eps
9425360	9426400	Have back
9426400	9428400	Have back
9428400	9431720	So, I'm eating leftovers, and I was like,
9431720	9433680	hurry, hurry, hurry, the ruffles are waiting,
9433680	9436320	the ruffles are waiting, and I was pouring cheese,
9436320	9438000	like a wee bit of grated cheese on it,
9438000	9440040	the entire bag fell out on the meal,
9440040	9442280	and I'm like, are you effing kidding me right now?
9442280	9445160	Like the kettle's boiling, cats are body-me-amming.
9446240	9447680	I'm like, oh my god, the poor ruffles
9447680	9449880	are just sitting on this freaking title screen.
9451920	9453800	I didn't understand a single word by a gray,
9453800	9455560	thank you, thank you for agreeing.
9455560	9457600	Right, I'm saying something like that too.
9458720	9462640	Okay, T minus one hour 30,
9462640	9465760	and then part one of Minish Cap is complete.
9467560	9469920	I do have a warm, I've actually got a cola.
9472760	9475960	Love me cola, I do, I do.
9475960	9478800	I was so scared, well, because I was away.
9481600	9484000	Right, we need to check out the shoe shop,
9484000	9486480	because I believe this is where we're heading next.
9486480	9490960	Yes, hello, was that, oh, welcome,
9490960	9493280	welcome to Rem's shoe shop.
9493280	9494880	Lately, whenever I take a nap,
9494880	9496360	all my shoes are done when I wake up,
9496360	9498520	you know, if I can make shoes in my sleep,
9498520	9500400	I must be in the right job.
9500400	9504400	However, things are not as it seems, no, no, no.
9506360	9510120	We're gonna take out, oh yeah, piss.
9510120	9511800	Yeah, I can't reach it.
9511800	9514360	Okay, 70 AM cola, literally.
9517480	9520160	Actually, I can't believe I'm saying this.
9520160	9523280	I have to actually work after I finish the stream.
9523280	9524520	Well, the other stream as well.
9524520	9525880	Wait, is everything open now?
9525880	9526720	No.
9528320	9529400	Okay, it's not open.
9531520	9535640	Oh, right, is the library open now?
9535640	9536800	Question mark.
9538520	9540080	No, that's the school.
9540080	9541400	No, it's not open.
9542360	9547200	There's a little mini-pot up there, oh yeah.
9550080	9553800	Am I supposed to go down and discover the swamp
9553800	9556360	and then come back to the town, possibly?
9557840	9559320	Very probable.
9559320	9561120	So you don't consider streaming work.
9562120	9563720	This ain't work.
9563720	9566240	I thought this ain't work.
9567200	9568040	This is not work.
9568120	9570160	I absolutely, hello.
9570160	9572160	Oh, hello, my brother's at school, okay.
9573680	9577320	Failed the bench delt test or whatever the freaking thing is.
9577320	9580320	I can't remember what it was, but I was laughing my ass off
9580320	9583400	because Lord of the Rings fails the bench delt test.
9586720	9589160	And I was like, oh, it's still a good movie, who cares?
9590440	9593120	I was like, where the heck am I supposed to do it?
9593120	9594640	Right, I think we're just to go to the swamp
9594640	9596920	and discover that we can walk in.
9596920	9599880	The bench delt test, it's like a test
9599880	9604880	and it's like, if two lambs speak to each other,
9605360	9608560	but it's not about a man, then it passes.
9609400	9611400	And it seems like such a small thing,
9611400	9614000	but it never happens in movies
9614000	9616920	because obviously movies have to be centered around the plot.
9616920	9619720	Right, I guess I have to go all the way up and into the thing.
9621640	9623680	So it's quite humorous.
9623680	9625400	Don't take it too seriously.
9625440	9627640	People don't really take it too seriously.
9627640	9630200	It's fucking relax, it's not that serious.
9630200	9632760	Two named women characters talk to each other
9632760	9633800	something other than that.
9633800	9636280	Yeah, yeah, yeah, it's like something funny like that.
9636280	9639760	And it's like, a lot of things fail it, which is hilarious.
9641080	9644000	Oh, whoa, whoa, whoa, wait, double drop.
9644000	9646760	Hello, is the game feeling nice?
9646760	9648360	Is there like more under here?
9649640	9652040	I'll start picking these up if I get a piece.
9653040	9656880	Is the game feeling bad for not giving me them?
9656880	9658480	Good, because it should feel bad.
9660480	9662240	Mummy, can we do a Lord of the Rings watch long?
9662240	9666000	Yes, you're actually doing it with me
9666000	9668280	on Christmas Day and Boxing Day.
9668280	9669640	We're doing Lord of the Rings first,
9669640	9671280	and then we're doing the Hobbit.
9672560	9676160	Just because I am aware that
9676160	9679520	Crumble Time can be a bit sore, a bit not fun.
9679520	9681360	Whoa, blue.
9681360	9684520	Whoa, you got those guys.
9684520	9687680	Wait, I'm cutting the grass, I'm cutting the grass.
9687680	9689040	Oh my God, oh my God,
9689040	9691600	the game's feeling so nice right now, what the heck?
9691600	9693040	I'm cutting the grass, I'm cutting the grass.
9693040	9695200	Hold on, let me cut the grass.
9695200	9698200	You don't understand, I need to cut all the grass right now.
9698200	9699600	I'll grab that shell though.
9701040	9702920	And we're getting money for doing it too.
9702920	9704160	I wasn't kidding when this,
9704160	9706400	this is literally grass cut simulator.
9708000	9710280	Oh my God, there's so many.
9710280	9713640	Hold on, we might actually have to go back to town
9713640	9715600	if it's given me that much.
9720400	9721920	What's in here?
9721920	9725240	A red piece, oh, someone wanted to trade us a red piece.
9725240	9727880	Oh no, but I can't remember the location.
9729840	9734840	Hey, it's me, it's the two-year reefing badge, no it's not.
9735040	9737600	Oh right, cause it's a, sorry, sorry, I was like,
9738440	9741320	I was like, that is impossible,
9741320	9743080	unless we've got time traveling here.
9744280	9745640	We're cutting the grass.
9745640	9748440	I assume if it stops giving us stones,
9748440	9751480	then it stops, right, what's in here?
9752720	9755520	Oh hello, hello, I am Percy,
9755520	9758120	poet literature of Hyrule,
9758120	9759920	and you are Link, sorry I skip that.
9759920	9761400	I travel all over the realm,
9761400	9763360	writing verses wherever I go,
9763360	9765720	but here I am, returning after a long absence,
9765720	9767760	only to find the road blocked.
9767760	9769320	It wouldn't feel like such a waste
9769320	9771680	if I hadn't lost half of my kinstone,
9771680	9773640	where misfortune rains down upon my head
9773640	9774960	at pores and torrents.
9774960	9776800	I think I may have dropped it in the inn
9776800	9778680	I stayed in last night.
9778680	9780280	I see no other course than to put
9780280	9782200	these tragic events to verse.
9782200	9784040	I see stars beyond the rainbow,
9784040	9785920	but I cannot reach them.
9785920	9788200	Through the stone, though the stone out,
9788200	9792120	I lost a small, large wizards placing my heart.
9792120	9795040	Okay, I need to go back to the inn.
9795760	9798320	Is that why it's giving me all these kinstone pieces?
9800200	9803280	Ah, looks like my drop rate's changed,
9803280	9806480	so I think I might have to go trade people.
9809320	9811600	Na, na, na, na, na, na, na, na, na, na, na, na, na.
9811600	9812920	Oh, sorry.
9812920	9815680	Sorry, oh, sorry, sorry, sorry, sorry, pal.
9816880	9819240	Right, we're gonna unlock this route,
9819240	9821920	because that's literally in my way, it's in my way,
9821920	9822920	it's in my way.
9823920	9825640	Please, I need to pick up.
9825640	9826960	Maybe there's a hidden thing.
9826960	9830200	No, it was an old man.
9831640	9833880	All right, drop rate is definitely changed.
9835560	9839040	Oh, oh, we've got a little cutscene moment.
9839040	9840760	Eh, what a strange feeling.
9840760	9843440	I sense something from the castle's direction,
9843440	9844680	or was it just me?
9844680	9846640	Oh, we need to go back to the castle?
9847640	9852600	Oh, Phil from EastEnders, right, let's go.
9856080	9858160	Oh, who's there?
9859320	9862120	Eh, Vati, how did you get in here?
9863120	9865280	I don't know how to do an English voice.
9866960	9869440	Monka, instead of walking the teleport,
9869440	9870920	talk about being lazy.
9871920	9874000	Uh, what are you doing?
9874920	9878960	Eh, given that sloppy toppy, clearly.
9878960	9879800	Jesus.
9881320	9882400	What did he do?
9882400	9883240	Eh?
9885840	9888200	Oh, he infected the...
9888200	9889600	It looks like you're all here.
9889600	9892680	Very well, the king of Hyrule has words for you.
9892680	9895120	You all know the power of the Pokora gave to mankind,
9895120	9895960	do you not?
9895960	9898480	The golden light force of limitless magical power.
9898480	9900280	I want it, it's somewhere here in Hyrule,
9900280	9902040	go now and bring me this power.
9903040	9906640	Waste no time, go forth at once and bring me the light force.
9906640	9910960	Oh no, Vati made the king go crazy.
9910960	9913520	Fling anyone who refuses into the dungeon,
9913520	9915520	him and his family too, oh, North Korea.
9915520	9917600	I will tolerate no disobedience,
9917600	9920360	now search high and low throughout the lands of Hyrule.
9922360	9923440	What do they think?
9923440	9927200	Maybe it's just the wind, but I hope nothing bad has happened.
9927200	9929840	Anyway, we need to look for the next element.
9929840	9931920	The map says it should be around here somewhere.
9932000	9933840	Yes, it must be around here.
9933840	9935160	Pinstone pieces?
9935160	9936000	Nope.
9937160	9941120	Gami is getting poised to attack me and see...
9941120	9942800	Did they just keep flying or did they go...
9942800	9945640	Whoa, you don't even have to do anything to them?
9948360	9949960	Hold on, that's money.
9949960	9952800	Oh wait, I can get a new wallet if I get 80.
9952800	9954800	Hold on, let's see if I can get 80 coins,
9954800	9956600	that might go down quite well.
9957840	9960560	Okay, we're gonna go get a new wallet and trade the people,
9960560	9964240	because there was quite a few trades that I couldn't do.
9965360	9967560	Well, I think I'm not...
9967560	9968640	He's really unruly.
9970480	9972040	So the light force is some kind of treasure,
9972040	9974840	I can get anywhere, the king must be looking for it.
9974840	9975680	Right, not you.
9976600	9977760	You?
9977760	9978600	You.
9980120	9981200	Yes.
9981200	9983240	Can I have this one please?
9983240	9985040	Two pinstones, but carefully together.
9985040	9987040	Hold on, I'm gonna bring my food over
9987040	9989120	because I don't want it to get too cold.
9989120	9991920	Whoa, chest, just a chest, okay, that's fine.
9993400	9996560	Okay, I'm mixing in my stupendous amount of cheese
9996560	9998680	for the pasta, hold here.
9998680	9999680	It's not looking good.
10000960	10003680	Hey, they fit perfectly, I wonder what's gonna happen.
10003680	10004880	I get a chest.
10004880	10006080	Do you trade me?
10006080	10006920	No, you're done.
10006920	10007760	How about you?
10007760	10009280	Everyone still relies here, it's a good thing.
10009280	10012240	My ideal cafe is a place where everyone can just hang out, yeah.
10012240	10013080	How about you?
10014000	10015200	You wanna fuse pinstone?
10015200	10016040	Yeah!
10019200	10020680	Like a four-leaf clover,
10020680	10022680	where did you end up meeting a spaghetti?
10024120	10025120	Whoa, whoa, whoa.
10031560	10033640	That wasn't what we needed.
10035080	10036320	When he said N,
10038720	10040320	oh, the postman!
10040320	10044160	Oh, wait, wait, I'm not a Mr. Postman.
10044160	10048160	Baby, I'm a Mr. Postman.
10048160	10049000	Oh!
10049720	10050560	What's this?
10054920	10056800	I really wish I could do more to help people.
10056800	10059120	Wait, I've got it, I'll ask swiftly
10059120	10061480	to start up a newsletter for adventures.
10061480	10063320	That'll be a great way to create a useful service
10063320	10064320	for everyone, hmm.
10064320	10065600	It's going to be a lot of work though.
10065600	10067680	I should get Marcy to help me.
10069320	10070160	Marcy?
10071400	10073040	Help, a fish quiz.
10074040	10079040	I have no, I don't have no recollection.
10080760	10082960	Whoa, there's a new guy in town.
10084880	10086280	We've got so much fusing.
10088200	10089640	Hey, did you talk to your mage?
10091520	10093880	Oh, is a Wind Waker reference?
10093880	10095560	I don't know.
10095560	10096720	Another chess, okay.
10100600	10101440	Delicious.
10102440	10103680	I'm nutritious.
10105480	10108040	Hey, they fit perfectly, this will be good.
10108040	10109800	Hello, what do you sell?
10111240	10112640	Why, hello there, thanks for coming by.
10112640	10115320	I sell all kinds of pickle, like,
10115320	10117120	I just put in your bottle and get some patterns
10117120	10118040	when you drink it.
10118040	10121120	Hmm, I only drink stuff that reeflings give me,
10121120	10123160	if I'm gonna be honest.
10123160	10125120	Oh no, I don't have it, ugh.
10126880	10128880	Um, no, there was.
10129720	10130560	Oh man.
10133560	10136880	Ah, I don't have it, it's not that red piece, draught.
10138160	10139480	Ah, not you.
10140360	10143120	There was someone here that wanted to,
10143120	10145160	oh, I just put a bomb down in front of this guy's house.
10145160	10146640	Sorry mate, it didn't mean that.
10146640	10149280	Ah, do apologize, don't have it either.
10150680	10152480	It's not a change of heart.
10153480	10155960	I'm just committing war crimes, okay, geez.
10159040	10160640	Oh, can I fuse you?
10160640	10161640	No.
10161640	10163320	Oh wait, did I go back to the sword master?
10163320	10164520	Can I, was it you?
10165680	10167680	Well, I can fuse with them, so I'll take it.
10169520	10172400	Oh, the money bag, yes, sorry, I already forgot, geez.
10173720	10175600	Hmm, I'll grab that now.
10177440	10178960	Ooh, what's this, quite nice.
10181600	10182440	A chest.
10189000	10192240	Oh, oh, move on, move on, move on, move on.
10192240	10193680	They fit perfectly, time to celebrate.
10193680	10196040	I don't think these guys can do anything for me.
10196040	10198640	Right, we'll go get the,
10198640	10200280	sorry, I'm playing one handed right now,
10200280	10201960	I would go faster if I'm eating.
10205160	10207760	I'm trying to eat and progress the story at the same time.
10208600	10212240	Um, right, first get the rupee bag,
10213320	10216000	because then we can hold more rupees in general.
10216000	10217320	No, not that one.
10217320	10218160	No.
10219640	10223440	Mm, mm, mm, mm, mm, mm, mm, mm, mm.
10223440	10225240	Hello, may I please have this?
10226520	10228320	Only 80 rupees for a wallet,
10228320	10231760	it can hold a king's ransom by, yes.
10233320	10235720	Yo, now you can carry more rupees, perfect.
10235720	10237400	Much obliged, my good lad.
10238520	10241920	Much obliged, I have more, I do have more.
10241920	10245360	Whoa, I didn't realize you could even go and see
10245640	10246760	inside the bag.
10246760	10249960	The reason why I'm asking if I have water is this.
10252240	10254120	Literally, you'd never figure it out on your own,
10254120	10255120	it's impossible.
10257240	10258080	Do you want to trade?
10258080	10260560	My dog's real smart and a little spoiled too.
10260560	10262880	Aw, that's what you're supposed to do.
10262880	10264800	You're supposed to, let's go talk to the dog.
10264800	10268400	Hello, oh, you want to, the dog has a fricking,
10268400	10270520	aw, it's always the one I don't have.
10272840	10274440	Some might even take a swipe at you.
10274440	10276240	Okay, this dog's nice.
10276240	10277800	Oh, God.
10277800	10279920	See, this is why you're supposed to go like that.
10279920	10281200	Wait.
10281200	10282800	Oh, no.
10282800	10284440	Whoa, did you see that cat looking at me?
10284440	10285920	I know it wants a piece of me.
10286920	10289800	This is for a later quest, which we're not on right now
10289800	10292040	because I'm going too far ahead of the plot.
10292880	10293720	Oops.
10294720	10296120	He's a good boy.
10297040	10298360	Just like a replay.
10299800	10302360	You're such a good doggy replay, you're the one.
10303360	10305640	Can I go in now?
10305640	10306680	Finally.
10306680	10310800	Right, I'm to trade someone in the end.
10312400	10313640	Must be upstairs.
10319840	10320840	Is it you?
10322560	10325720	And you asked for the one I don't have.
10325720	10327160	Is it one of the children?
10328240	10330600	Stop asking for the ones I don't have.
10331480	10332320	Right now.
10335560	10336760	What's going to happen?
10336760	10338960	I need to inhale my food, it's getting cold.
10342400	10344160	Okay, that's a later platform.
10349680	10351440	Okay, is that...
10351440	10352280	Oh, you?
10354760	10356120	Okay, can do it, can do it.
10356120	10357320	I'm gonna have to go in the grass
10357320	10359240	and look for more pinstone.
10361600	10362440	Hmm.
10365160	10366280	A chest again?
10366280	10368440	Okay, it looks like green is all chest.
10369520	10370360	Oh, wait.
10372200	10375360	Some sort of monetary gain as I choke on my food.
10376280	10377120	Gah.
10377920	10379800	Okay, can't go out there yet
10379800	10381400	because we don't have a light, which is fine.
10381400	10383120	Is there anyone in here?
10383120	10384360	No, there's not, okay.
10385400	10387480	Right, we need to go get pinstones
10387480	10389400	so we can unlock this next section.
10391600	10393880	Because we can't frickin' progress.
10397480	10399320	I'm even sure what to do.
10399320	10401800	I'm pretty sure there's a tingle man down here.
10404840	10405680	What?
10405680	10406520	Yeah, there he is.
10407960	10409640	Let's go see this tingle man.
10409640	10410880	Hello, tingle man.
10410880	10412880	Yeah, I wanna fuse pinstone.
10412880	10415040	And do you want the one I actually have?
10415040	10416280	I like it here.
10416280	10417480	I'm like maneuver.
10419200	10420040	Oh.
10421440	10422280	Oh.
10423840	10425920	Okay, we'll definitely go investigate that
10425920	10426920	because that's cool.
10428920	10429920	They fit perfectly.
10429920	10430760	Thank you.
10433320	10436120	Right, we're gonna go get this.
10436120	10436960	What is it?
10436960	10438720	200 shells.
10438720	10440800	I better not be full with shells.
10440800	10441640	No, I'm not.
10441640	10442480	That's fine.
10442480	10444280	I don't wanna waste shells.
10444280	10445360	I'd rather go gamble.
10446320	10447640	Yes!
10447640	10448480	Right, okay.
10448480	10450120	I guess I'm just not allowed to have
10450120	10451680	a certain amount on my person
10451680	10453520	or the game is like that's too many
10453520	10455640	and not fun anymore.
10456880	10458800	Grass cutting simulator.
10458800	10461160	Grass cutting simulator.
10461160	10463960	Simulator, grass cutting simulator.
10465920	10469440	I don't wanna go back to the guy with only one.
10469440	10470880	That's so small.
10472840	10473840	That's so little.
10475280	10476440	What's over here?
10478960	10480720	Oh, we don't have access to it yet.
10485040	10487920	Did I go as far as I could back then?
10490520	10493080	Or am I gonna have to go to that area?
10493080	10494360	Just to cut grass.
10494360	10496960	Literally making my way over there just to cut grass.
10501120	10502440	Dingle, dingle, dingle.
10505160	10507920	Am I going extra crazy?
10507960	10509760	Oh my God, I'm going extra crazy.
10510600	10511960	This is where I'm supposed to go.
10511960	10513320	I don't need to do anything.
10516000	10517600	Ah!
10517600	10518440	Strat.
10519320	10520160	This is it.
10521160	10522600	So, this must be, sorry,
10522600	10525120	I'm burning myself with my whole war ball right now.
10525120	10526880	So this must be Caster Wilds.
10526880	10531880	It's a nasty dank place filled with swamp land and mirror.
10532200	10533840	Mirror, mire?
10533840	10536440	But we know there's an element waiting for us.
10536440	10537920	Come on, Link, let's go.
10544720	10547640	I don't think we can walk fast enough to cross the swamp.
10547640	10550400	We're gonna have to find some way to get across safely.
10550400	10553080	Okay, I think now that we've done that,
10553080	10556760	it means we can go to the shoe shop guy again.
10557720	10562480	Kingstone can be grander than RuneScape, honestly?
10562480	10566360	Right, now the shoe shop guy will entertain us.
10566400	10569880	Or the event will occur, like, that's supposed to happen.
10569880	10571200	Oh!
10571200	10573240	They dropped 20!
10573240	10575120	Parish right now, give me more money.
10577560	10578880	So then what was down here?
10582720	10583640	Did I just get to be?
10583640	10586640	I don't think I can go any further when I can.
10593080	10594920	Kingstone, kingstone, kingstone.
10595520	10596360	Is that?
10599080	10600000	Am I losing it?
10600000	10600840	Am I losing it?
10600840	10603960	Did I just think I couldn't go any further when I could?
10603960	10605400	Oh, my guys.
10605400	10607160	I'm not gonna make it.
10607160	10608600	Hello?
10608600	10609800	I planted it being near my house,
10609800	10611280	but it just doesn't seem to grow.
10611280	10614360	No, it won't, because I need to kingstone it.
10615360	10616520	Wow.
10616520	10618280	The mysterious shells are worse.
10620360	10622200	I'm almost there.
10622200	10624680	Doomsday, Dan, thank you for the tip.
10624680	10626400	You didn't put a message though.
10626400	10627400	Find and read out.
10628720	10630920	And delay lover, I don't think I said your name again.
10630920	10632360	Delay lover, be a lure.
10632360	10633920	I'll figure you identify yourself.
10637320	10638320	I'm almost there now.
10639400	10642160	You're gonna have to put up with my tune, okay?
10642160	10643000	I can't.
10644480	10645960	I can't do everything.
10645960	10646800	I don't know.
10650600	10651920	I just don't know.
10655320	10656320	You didn't go any further.
10656320	10657480	Just assumed you couldn't.
10657480	10659320	Oh, my God.
10659320	10660960	Talk about giving up, Mentale.
10663840	10664680	Wow.
10666400	10667600	Oh, it's like choke.
10668600	10671160	I'm swallowing, I'm swallowing, I'm choking, I'm choking.
10674160	10675000	You want a bite too?
10675000	10676080	You most certainly can have a bite.
10676080	10677640	Go, ah.
10677640	10679360	Here comes the airplane.
10684960	10687120	I've always done any itch, my eyelash.
10687120	10689680	It's always on my left eye, my first eyelash.
10695760	10696600	That's four.
10698400	10699560	All the food is gone.
10702280	10704640	We will now go back to the shoemaker
10704640	10708920	because we need the shoemaker in order to progress.
10708920	10710280	Oh, ow.
10710280	10712160	My butt, I was looking at chat
10712160	10714760	and that gammy sniped my butt.
10717720	10719280	Delicious, delicious, delicious.
10719280	10720680	Goodbye.
10720680	10721520	No.
10723960	10726920	Chewing the mic and you shall be forgiven.
10726920	10728520	No, people hate that.
10728520	10732120	It's like, there's something called like misophobia
10732120	10732960	or something.
10735800	10737360	Oh, here it is, this is the event.
10737360	10739080	Okay, we're doing it, we're doing it.
10743160	10746880	Oh, sleepy little, oh, yeah, I worked in too hard.
10748200	10749360	There we go.
10751000	10752240	Hello, hi.
10753600	10755280	Hey, hey, you're Link, right?
