start	end	text
4368000	4370000	We can give you more generations,
4370000	4371000	but my pie!
4371000	4373000	I'm not money enough.
4373000	4374000	I don't have enough money.
4374000	4375000	What do you think?
4375000	4376000	Speak.
4376000	4377000	Well, if it isn't Link,
4377000	4379000	it is good to see you again.
4379000	4380000	The school is in session.
4380000	4382000	I'm afraid I can't let you in.
4382000	4383000	Oh my god, that's right.
4383000	4385000	He's like a literal child
4385000	4387000	going about the map health.
4393000	4395000	What are you?
4396000	4398000	Buggy buggy boo.
4398000	4399000	Did I scare you?
4399000	4400000	No.
4400000	4403000	Oh, there's like this silly chicken game.
4403000	4404000	Oh no, this is horrible.
4404000	4406000	My cocoons have gotten out.
4406000	4407000	Can you help me catch them?
4407000	4409000	Try to catch two of them, please.
4410000	4411000	Yoink!
4412000	4414000	Get back in the pen!
4414000	4416000	Okay, we only need two, so that's fine.
4420000	4421000	Is that making a weird noise?
4421000	4423000	It sounds like scratching.
4424000	4425000	Weird.
4425000	4427000	Oh, there's a golden one.
4427000	4428000	I got a golden ch-
4428000	4429000	Ah!
4429000	4430000	Get back here!
4430000	4432000	No, you're going back in your pen.
4432000	4434000	Naughty chicken.
4434000	4436000	Okay, time's up, that's it.
4438000	4439000	Thanks, here's your reward.
4439000	4440000	Ten seers-
4440000	4442000	What did I do with the shells?
4443000	4444000	Oh, she gave me 30 rupees.
4444000	4446000	Maybe I can get your sandwich.
4449000	4452000	A literal child being sent to just kill a wizard.
4453000	4455000	I love those memes that are like,
4455000	4457000	summarise the game in one sentence,
4457000	4459000	like completely out of context.
4460000	4463000	Child sent to kill wizard is pretty accurate.
4463000	4464000	Alright, what do I even need to do?
4464000	4465000	Sorry.
4465000	4468000	I am having a fun time just giving off
4468000	4470000	and enjoying this game for what it's worth.
4473000	4474000	Oh!
4474000	4476000	Sorry, I got a little excited looking at the water there.
4476000	4477000	Oh!
4478000	4479000	Bees!
4480000	4481000	I don't want to take them yet
4481000	4483000	because I don't have anything to put them in.
4485000	4487000	There was an enemy up ahead.
4491000	4494000	Next time we go back to town,
4494000	4496000	I will get your cake.
4496000	4497000	Even though-
4497000	4498000	Oh!
4498000	4499000	Well, we can't go that way.
4499000	4500000	Hold on.
4500000	4501000	We need to go up.
4504000	4506000	Every additional chicken gets you more money
4506000	4507000	even if it's for going on.
4507000	4508000	Ah, okay, okay.
4509000	4510000	So I should get going.
4510000	4511000	Oh!
4511000	4512000	He wants to do that thing.
4512000	4514000	You want to fuse Kinstone?
4514000	4515000	Yeah, but-
4515000	4517000	Ah, I don't have what you need.
4519000	4520000	What about you?
4521000	4523000	I don't have what both of them needs?
4523000	4525000	What are the odds of that?
4528000	4529000	Now we're getting there.
4529000	4530000	You fuse.
4530000	4531000	You fuse.
4531000	4532000	Come.
4532000	4533000	Ah, come.
4533000	4534000	But they aren't open yet.
4534000	4535000	Hmm.
4537000	4538000	Okay.
4538000	4539000	Hello, can I get that?
4539000	4540000	Ho, ho.
4540000	4541000	So you've learned to spin attack.
4541000	4543000	It's still dangerous, but maybe you can handle it.
4544000	4546000	Oh, I didn't even know I needed that to progress.
4546000	4547000	Yeah, that's the one.
4547000	4549000	But there are monsters out there, kid.
4549000	4550000	Please just be careful.
4550000	4553000	I think he blocks you from going anywhere.
4554000	4555000	Okay.
4555000	4556000	It's two hits.
4556000	4557000	That's fine.
4557000	4558000	What are these?
4558000	4559000	Can I break them?
4559000	4560000	I can!
4560000	4563000	Well, I'm not fucking picking them all up manually.
4563000	4564000	Just down here.
4567000	4568000	Oh, Bomba!
4572000	4574000	They have got some timer on them.
4574000	4575000	Hello!
4575000	4577000	Oh, this is a merchant.
4577000	4578000	Hold on.
4579000	4581000	You need a dinkum.
4582000	4583000	Okay, you got me.
4583000	4584000	Let me make it up to you.
4584000	4585000	You can have this.
4585000	4587000	Do you have lots of bottles for 20?
4587000	4588000	Sure.
4588000	4589000	Give me up.
4589000	4590000	You got an empty bowl.
4590000	4591000	Thanks a lot.
4591000	4593000	Yes, we needed the bowl for...
4594000	4595000	Actually, we need...
4595000	4596000	This was...
4596000	4598000	I didn't even remember it was down here.
4598000	4601000	We needed the bowl for...
4602000	4605000	If not, we'll just have to make do with your cake instead.
4605000	4607000	How the frickin...
4607000	4609000	How did you guys do that?
4611000	4613000	That's really coordinated.
4613000	4614000	I'm sorry.
4614000	4616000	That's really coordinated doing that.
4620000	4621000	Here.
4627000	4628000	No, literally.
4628000	4631000	The only time you guys are like mega-coordinated is...
4631000	4632000	What's that?
4632000	4633000	Which is actually really funny.
4633000	4636000	Okay, there's nothing up here that we can do yet.
4636000	4637000	Reefling?
4637000	4638000	Hive?
4638000	4639000	Main?
4639000	4640000	I can't believe it.
4640000	4641000	Main broken?
4641000	4642000	I'm not even spanked at the first one yet,
4642000	4645000	where I get you to rename yourself for an hour or so.
4649000	4651000	Okay, this is why we need water.
4653000	4656000	Because it grows the beanstalk!
4659000	4660000	And then we'll grab more,
4660000	4661000	because I'm like,
4661000	4663000	God, we're really low on bombs.
4663000	4665000	I actually don't know how to get more.
4666000	4667000	Sure, grab.
4667000	4669000	Put this one out for now.
4669000	4672000	We used our single brain cell for the forces to do.
4672000	4674000	Oh, I need it.
4674000	4677000	Sorry, there is a lot of menus, like, speak.
4677000	4678000	Okay, you got me.
4678000	4680000	I'll make it up to you.
4680000	4683000	A friend of mine in the cave just east of here in the Highlands
4683000	4686000	has an item if you're planning to ongoing.
4686000	4688000	It won't let you get to the top,
4688000	4689000	but it might just help you get started.
4689000	4690000	Okay, that's fine.
4691000	4693000	I need more Keith down peep heads.
4693000	4694000	What?
4697000	4698000	Hmm.
4699000	4701000	Right, we're gonna grab this money up here.
4702000	4703000	I guess like 20.
4703000	4704000	Oh, we're at 40.
4704000	4707000	I still don't have enough for your signage though.
4707000	4709000	Look up here, nothing.
4711000	4713000	Luckily, I already did that, literally.
4713000	4716000	I'm doing everything in the right order by accident.
4718000	4721000	Right, we can't grip the walls yet.
4721000	4723000	I might just...
4723000	4725000	Oh, wait, there's something hidden under these.
4727000	4729000	Whoa, they hardly get affected.
4729000	4732000	There's a lot of enemies in this area.
4732000	4734000	Geez, whoa, wait!
4736000	4738000	Is there not a hidden thing around here?
4740000	4741000	Is it this?
4744000	4746000	Wow, there's a lot of enemies.
4747000	4750000	Is this just a secret bomb place?
4750000	4752000	It looks like we should do something here.
4753000	4754000	I'll just stay here.
4755000	4757000	Yeah, I was gonna say, that looks so...
4757000	4760000	Like, there's totally not a hidden thing here.
4764000	4765000	Oh, jelly blobs.
4771000	4773000	There's a question about the mysterious shells.
4773000	4775000	I can't remember what they're for.
4776000	4778000	Geez, I have one bomb left.
4779000	4781000	Why am I going here?
4784000	4787000	I think I might need to put it in the bottle.
4790000	4792000	I hope you're having a good time.
4792000	4795000	I'm in the middle of the hammer, I need to play childing again.
4795000	4799000	Oh, I don't think jumping on a gem would feel that good on your butt, but...
4799000	4801000	I guess the smaller you...
4801000	4803000	So this perfectly normal looking...
4803000	4807000	So this perfectly normal looking stone was another portal of the Minish world.
4807000	4809000	There may be other rock portals.
4809000	4811000	Keep your eyes peeled, boy.
4814000	4816000	Increase your chances when going for a figurine.
4816000	4817000	Oh, okay.
4818000	4819000	Okay, I can't.
4819000	4822000	If the enemies aren't attacking me, there's no point in...
4823000	4826000	Okay, yeah, I definitely need this liquid.
4829000	4830000	Why is it...
4830000	4835000	You've got Mount Serial's mineral water in your bottle.
4835000	4836000	It's piping hot?
4838000	4839000	Hmm.
4842000	4846000	Right, I'm going to detach it because I don't want to accidentally use it
4846000	4849000	because I definitely have to use it for something coming up.
4849000	4850000	Green mineral water.
4850000	4852000	You've got acid, literally.
4855000	4856000	See you, Yibi.
4856000	4857000	I know you can.
4860000	4862000	I only have one bomb left.
4862000	4863000	I don't want to use it on...
4863000	4864000	Oh, I'm sick.
4865000	4867000	There's a lot of merches nearby.
4867000	4868000	Hello.
4868000	4869000	Okay, you got me.
4869000	4871000	I'll make up to you by selling your bombs.
4874000	4876000	Wait, I've only got one bomb left?
4879000	4880000	Right, right.
4880000	4882000	Give me the freaking bombs over.
4882000	4883000	Yeah.
4883000	4884000	Thanks a lot.
4884000	4885000	Yeah, yeah, yeah.
4885000	4886000	Oh, I'm confused.
4886000	4887000	I have it!
4888000	4891000	The two pieces fit perfectly together.
4892000	4893000	Yibi!
4899000	4900000	A chest?
4900000	4901000	Okay, that's fine.
4902000	4904000	We do not have access to that area.
4905000	4906000	Unfortunately.
4906000	4907000	That's okay.
4907000	4910000	I might have to start scraping by and trying to pick up coins
4910000	4911000	because it's not looking good.
4911000	4914000	Okay, I see they purposely put that bomb there
4914000	4915000	because...
4915000	4916000	Hey, that guy.
4917000	4920000	Yeah, literally, they put a nice bomb cellar nearby
4920000	4921000	in case you're out,
4921000	4922000	and I'm like, yes, think of it.
4922000	4923000	It's so smart.
4925000	4927000	Oh, I don't know how far this goes.
4931000	4933000	Either a lot of acid or that's plankton.
4937000	4939000	Oh, I think...
4939000	4941000	Once you've pulled off their iron mask,
4941000	4943000	those guys are no trouble whatsoever.
4944000	4947000	I think we'll just avoid them, to be honest.
4947000	4950000	We don't really need to fight everything.
4954000	4956000	Of course, I'm silly of me.
4957000	4958000	Hey, my boy.
4958000	4960000	Jump into that whirlwind over there for me.
4961000	4964000	I wonder, is this a great idea or a terrible one?
4964000	4966000	I'll beat the crap out of this one.
4969000	4972000	Okay, now this becomes the fun part.
4972000	4973000	We're really...
4974000	4975000	Oh, I can't go up.
4975000	4976000	Oh, there we go.
4976000	4977000	I can't go up.
4978000	4979000	What's...
4979000	4980000	Ow!
4982000	4983000	What's over here?
4984000	4985000	Where's some more?
4985000	4986000	Eh?
4986000	4987000	There's a path.
4987000	4988000	Oh, well.
4988000	4990000	Tell me a bomb doesn't belong there.
4991000	4992000	You can't...
4993000	4994000	What's in here?
4996000	4998000	Okay, I'm gonna bomb for that.
5003000	5004000	Wow!
5007000	5009000	It'll take us down to five bombs.
5009000	5011000	Getting this, but we're gonna do it.
5011000	5012000	We're gonna send it.
5015000	5018000	Oh, a special Kingston piece.
5018000	5020000	It was blue, so I guess...
5020000	5021000	I'm 50!
5021000	5023000	I can buy your sandwich even though it's a cake!
5023000	5024000	But it looks like a sandwich,
5024000	5027000	but it makes sense that it was a cake because it's a bakery.
5028000	5031000	Leave me be, fellow beast.
5035000	5037000	Okay, this one looks like a succumon.
5038000	5040000	Oh, that's where the deco's!
5042000	5043000	That's where the slain...
5043000	5046000	I knew something had to be sucked up over here.
5051000	5052000	Wow!
5054000	5056000	150 rupees for a sanda.
5058000	5059000	Oh, hi!
5059000	5060000	See that?
5060000	5061000	See how we just sucked it up,
5061000	5062000	but it's already spun back in?
5062000	5064000	I wish they didn't do that.
5064000	5065000	Oh, wait!
5065000	5066000	I can't do that yet.
5066000	5068000	I need to move it.
5069000	5070000	Oh!
5072000	5074000	Wait, do I need to go there then?
5075000	5076000	Into the hole!
5077000	5078000	Okay.
5079000	5081000	We're gonna do it!
5082000	5083000	Oh!
5083000	5085000	Sorry, I got a bit excited there.
5086000	5090000	My biggest downfall in video games is just gaps.
5090000	5092000	I can't do it.
5093000	5094000	Who is putting this kind of shit?
5094000	5095000	Wait!
5097000	5098000	Oh, no.
5099000	5101000	Oh, no, this can't be.
5104000	5109000	I think I have missed a very detrimental item question mark.
5111000	5112000	Oh, I'm done again.
5112000	5113000	Sorry, sorry.
5113000	5114000	There was a gap.
5114000	5115000	There was a gap.
5118000	5126000	I am 99.9% sure I need some sort of weight lifting thing here
5126000	5130000	to move the plant over.
5130000	5132000	Oh, sorry, I'm getting caught.
5132000	5135000	And I don't have a...
5137000	5138000	Where is it?
5138000	5139000	Lift!
5139000	5140000	Wait!
5141000	5142000	Link!
5143000	5146000	You can just straight up lift that?
5146000	5149000	I thought there was some sort of item.
5149000	5151000	Is that later in the game?
5151000	5154000	Fuck it now, he's at time!
5154000	5155000	Sorry.
5155000	5157000	Oh, well, I did what I needed to do,
5157000	5160000	even if I sacrificed some of my health for it.
5160000	5162000	I did what needed to be done.
5162000	5165000	I don't even know how he's this strong.
5165000	5166000	I can't believe it.
5166000	5168000	Sorry, I'm wasting all my health.
5168000	5173000	Right, the reason why we need the green is this.
5179000	5182000	And now we are on Mount Creronell,
5182000	5185000	not to be confused with Mount Serials.
5185000	5187000	I used to see as a child.
5187000	5189000	I'm so funny as a child.
5190000	5192000	Okay, this is definitely a bomb.
5193000	5196000	Sorry, my stomach's making funky noises.
5197000	5198000	Let's hear it.
5199000	5201000	Weakest wiefling.
5203000	5205000	Oh, no way that dodged that.
5205000	5207000	That was like really good timing.
5210000	5211000	I wasn't here.
5211000	5213000	Another piece.
5213000	5214000	Curious.
5215000	5216000	Curious?
5216000	5217000	Hmm, curious.
5217000	5218000	Another piece.
5218000	5220000	Is the game telling me I should probably trade?
5220000	5221000	Whoa!
5221000	5223000	New enemy unlocked.
5224000	5227000	Okay, yes, I would like that heart very much, please.
5231000	5233000	I should have done that in the middle.
5233000	5235000	I just realized I wasted that.
5235000	5237000	Bomb bomb!
5237000	5240000	Oh, of course they have it in here.
5245000	5246000	Oh, wait, no!
5246000	5248000	I should have picked up.
5248000	5249000	Silly Billy.
5249000	5250000	Great.
5250000	5252000	I wonder if they always won.
5252000	5253000	I'm curious.
5261000	5266000	Well, I still have nightmares of the snake enemies that suck your money.
5266000	5267000	Give me your...
5267000	5269000	Aren't those just called women?
5269000	5270000	I'm sorry.
5270000	5273000	I tried so hard to make that joke really quickly.
5273000	5274000	It didn't work.
5274000	5276000	I don't need the wool.
5277000	5281000	I tried so hard to do that quickly and it completely started over my words
5281000	5282000	because my brain was like,
5282000	5283000	Yes, yes, the joke's there!
5283000	5284000	Say it, say it!
5284000	5286000	And, yeah.
5286000	5288000	Well, I tried, I tried, okay, I tried.
5289000	5290000	L'Bomba!
5295000	5296000	Wah.
5296000	5298000	Is he gonna give me the ring?
5298000	5300000	Are you kidding me right now?
5301000	5303000	Okay, fine, no, my money's getting sucked.
5303000	5304000	Okay, you got me.
5304000	5306000	I'll give you a fabulous grip ring.
5306000	5308000	It is perfect for a young mountaineer.
5308000	5310000	Climb 48.
5310000	5313000	Okay, lucky we got money on the way.
5313000	5314000	Thanks a lot.
5314000	5316000	Okay, now we can climb the wall.
5316000	5317000	Oh, we got five bombs again.
5317000	5319000	Oh, this is perfect.
5320000	5321000	Thank you.
5322000	5324000	K.F.P. Spidey.
5325000	5326000	Right, what way?
5326000	5327000	Short cut to bomb.
5327000	5328000	No, so what's up here?
5330000	5331000	Oh.
5335000	5336000	Oh.
5337000	5338000	We can't do that.
5340000	5342000	So, this is not the right way to go.
5342000	5344000	Shawnee doesn't need the grip ring.
5344000	5345000	She has that cover!
5345000	5346000	It's the...
5346000	5347000	Lip set.
5347000	5349000	It's the R slash lip set grip.
5350000	5351000	I'm so sorry.
5351000	5352000	Wait, what?
5353000	5355000	So, where am I supposed to go?
5355000	5356000	Okay.
5363000	5364000	Huh?
5364000	5366000	Am I supposed to go to the left?
5367000	5368000	I don't want to go...
5368000	5369000	Okay, there.
5369000	5370000	This is it.
5372000	5374000	You know that subreddit?
5374000	5377000	Yeah, I'm featured on it right now.
5377000	5380000	I'm trolling before anyone fucking goes and knocks me in.
5380000	5381000	Like, oh my god!
5381000	5382000	No, no, really.
5385000	5386000	Right, definitely.
5388000	5389000	Ahoy!
5389000	5390000	It's Emmy!
5390000	5391000	Any embers?
5391000	5392000	Any pen pals?
5392000	5393000	Me.
5399000	5400000	Please talk to me.
5401000	5402000	Talk to me.
5402000	5403000	Why don't you talk to me then?
5404000	5405000	Wait.
5405000	5406000	No!
5406000	5408000	You put water in your bottle,
5408000	5409000	and then you give her water.
5410000	5411000	You take her water,
5411000	5412000	then you give her water.
5415000	5416000	Oh!
5418000	5420000	Welcome to the Adventure Spring.
5420000	5422000	Did you throw the golden bomb
5422000	5424000	into the spring or the silver bomb?
5427000	5428000	Neither?
5430000	5431000	You are honest.
5431000	5433000	I must reward such an honest adventure
5433000	5435000	with some of my power.
5435000	5437000	You got a big bomb bag!
5437000	5439000	Now you can carry more bombah!
5439000	5441000	Thank you, mysterious lady.
5441000	5443000	May light shine on your quest.
5444000	5446000	Oh, she's so ethereal.
5447000	5448000	I love her.
5450000	5452000	This song sounds so familiar.
5452000	5453000	Yes, it is.
5453000	5455000	It's like, pretty much the default, like...
5456000	5457000	Hey, Zelda.
5457000	5459000	Take her water, and give her water.
5459000	5461000	She was just happy to get a bubble.
5461000	5463000	They have a spring cone.
5463000	5465000	She just wanted to do a spring cone.
5465000	5466000	Ah!
5466000	5467000	Ah!
5468000	5469000	I can't believe I suck.
5470000	5471000	Why is this...
5472000	5473000	I got a cavern.
5475000	5476000	I have a cavern.
5477000	5478000	There's a cavern.
5479000	5480000	I have a cavern.
5481000	5482000	I have a cavern.
5483000	5484000	I have a cavern.
5485000	5486000	I have a cavern.
5486000	5500640	I'm the Cranel, I'm the Cranel Hermit! I left the world to pursue a life of quiet reflection.
5500640	5506400	You seem to be but a child and yet you climb this forbidden mountain alone. I must reward
5506400	5512240	your courage with information. I have not seen a s- have you not seen strange patterned walls
5512240	5518160	as you climb this mountain? No? Bombs, bombs are the- oh he's telling me to nuke the fricking walls.
5518160	5523920	Yeah that's fine. The two kinstom pieces fit perfectly together, maybe something good will happen.
5525280	5527360	I didn't know you could take the water from the fairy town.
5528480	5532320	You learn something new every time you replay a childhood game.
5532480	5537200	What? How is that good?
5539920	5543280	How is that good? You've just- you've just created problems for me.
5547760	5550160	Okay, those are aggressive.
5552080	5556640	Ah! I don't know if I'll be able to- no I'm not gonna be able to in time, hold on.
5557280	5559680	Okay, suck them off. Get in my P.O.B.
5561840	5568000	Let's go. We are very high up if the- the fricking mountain top isn't even there.
5569280	5574880	Oh my goodness. All right, we can't do anything, we have to go- man we gotta go small.
5575520	5579440	Gotta take all off. Money? Oh is that what the golden snakes are?
5579440	5583280	They got Mario and Marshmallow doing here.
5588640	5592000	Oh, mushrooms-y owned by Nintendo.
5595200	5598080	These raindrops are like folders of water tails kid.
5598080	5601600	Watch out! If one of them hits us, it'll sting something fierce.
5605280	5609120	I'm getting rolled! Another good kind, I literally need new hearts.
5609120	5614320	I've only got three hearts. I'm drying them- wait can I push these? No I can't, I'm too small.
5615920	5619920	I'm just a baby. I'm gonna do a marshmallow.
5622160	5623760	Right, what do I need to do with this?
5627280	5634240	All right, I definitely need to push it that way. Then up. Then up again. Then a cheeky.
5635120	5644400	Left. Then up again. Then up again. Then a cheeky left. Then a left. Then a left.
5644400	5649120	Then a left. Then a no- then a down. And then a straight ahead.
5651120	5659120	Keep her going, keep her moving. Come on Link, you're so strong! You can do it! Link, you came to turn!
5660080	5663120	You came to save the Princess Zelda!
5671920	5677120	He's so strong. Oh, there's enemies at the bomb. Yeah, I knew it. I knew it.
5682160	5683280	We'll go this way, I think.
5684240	5688320	Uh, right, can I do this? No, let's do that one.
5690800	5697440	Oh my god, I'm literally guessing the freaking designer there lay out before- I've even activated it.
5698480	5705760	SHIT! I messed up. Oh, then he got all the way back because I messed up the last one I did.
5706720	5717760	Unless? No. What? Wait, unless. Hold on, unless we're being misled. Unless we're being misled!
5720240	5726400	It's your maiden smash force. I've never played it before. Should I play it before? Should I play it?
5727440	5732480	Thank you for the five delay lovers. Don't think I don't know your bleeding heart.
5733040	5740800	It's not a club, true name. I just think it's blood. Yes. I've never played it. I think Bayonetta.
5742480	5746320	Hold on a minute. Yeah, I saw that. I saw the pots and I was like, hold on a minute.
5746320	5754880	Is there pots on the other side? I think Bayonetta's in it, so I would probably play her when I play smash.
5755840	5762480	Wait, why are you lip-biting to that? Is that a game? Is that a sexy game? I thought it was Nintendo.
5762480	5769920	I was saying that Nintendo produced Bayonetta, which is like the most bomb shell. Is there something special in here?
5771040	5776080	Why are you hiding these pots from me? Oh, there's like a bomb behind them. Okay, that's fine.
5777040	5779440	I guess we need a bomb up ahead.
5792800	5797120	You can manually throw bombs if you need to. Okay, I don't really want to fight because I'm
5797120	5803520	pretty low health and not new health is spawning. Oh no, not another one of these, right? Okay.
5806720	5810640	Down, two left, and then down.
5814400	5821840	Okay, okay, okay, we're getting there. We're doing it. Then one, then up one, then left,
5822800	5827600	then north, then west, then push! We did it!
5827600	5832400	A scrawny can use her brain? Something.
5841600	5845280	Sugar, I might start up. Hold on, let me try that again. Wait, no.
5846960	5851520	Yeah, I can do it though. Okay, we did it, we did it, we did it, we did it.
5852080	5859440	Anagong, a special console piece. Okay, sorry, sorry, sorry. Easy as connect for my life,
5859440	5865120	honestly. Oh, we did it! Look, look, look, this is a Minish camp. We're going to the Dwarven Minish.
5866240	5870080	The Dwarves of Erebor. I may be a bleeding heart now, but after that carry on,
5873120	5879520	oh, you can be. I'm not like one of those streamers that kind of get uncomfortable. As long as you're
5879520	5883680	happy, I'm happy. You enjoy the content and enjoy the content, you know?
5887680	5892080	But yeah, you guys, guys, did you know you have an infestation out there? Yeah?
5893040	5900960	Thank you for the five again, Delay Lover. Hello! Ting-a-long, tong-a-long, dig-a-long,
5900960	5906960	fer-eye. Wait, they're actually Scottish? Ting-a-long, tong-a-long, dig-a-long, fer-eye,
5907040	5913360	and they're Scottish? Ting-a-long, tong-a-long, dig-a-long, dig-a-long, dig-a-long,
5913360	5920480	dig-a-long, fer-eye, and they're Scottish? In here? Oh my god, they have communal,
5921200	5927520	they have communal bedding. Reflings, this is what I want. Oh my god, they're Scottish!
5928560	5934080	Hi! Hello, everyone! Oh my god, it's the kitchen where I make all the fit for the
5934080	5939760	reflings. What's that? We're having chicken again tonight? That's right, I'll let you use chicken.
5942240	5948320	Are you Scottish? Wait, I think, wait, is it in here? No, this is just a smith's room.
5949280	5952960	Okay, I think it might be down in here. Okay, definitely not there, that's how to progress.
5952960	5955760	Hello! Hello, everyone!
5958240	5967680	Green Clays, and an old hat! Sir, may you be young Link? I am Mellari, Master Smith. I hear you want
5967680	5973840	me to reforge the sacred sword and help break a curse. I'll be needing that old sword, which holds
5973840	5981040	the power of the elements first. Show me that broken PCORI blades. I love all this adventure,
5981600	5991040	with what's with the rescuing of princesses and such. I'd be happy to reforge this thing into a
5991040	6000880	brand new sacred blade for you. It'll take me a while to rework that sword. In the meantime,
6000880	6005920	you should try doing the missing elements. One of them should be in the mind of the human
