start	end	text
14966300	14967300	How do I hurt them?
14967300	14969300	I'll just spam them in the corner.
14969300	14971300	Money compounds, yes, basically.
14971300	14972300	Can you come here?
14973300	14975300	Is that four hits, jeez.
14976300	14979300	Yeah, yeah, of course I get tons of money now.
14979300	14981300	In game.
14981300	14983300	Wah!
14986300	14988300	Nah, Sam's just skipping.
14988300	14990300	If you're not coming towards me, I'm skipping.
14990300	14992300	Ah, piss, left or right.
14993300	14994300	Left or right.
14994300	14996300	Whoever types left or right, I'll do your first-
14996300	14998300	Do your first saying.
14998300	15000300	Don't blow it yourself or not, then eat and come on through.
15000300	15002300	Don't be meanly, literally.
15002300	15004300	Alright, first one said left.
15012300	15014300	Mods, execute that man.
15015300	15017300	Left or right.
15017300	15019300	Left or right.
15022300	15023300	Left or right.
15023300	15025300	No, you know what?
15025300	15026300	You know what?
15026300	15027300	I'll do it myself.
15027300	15028300	I'm gonna time you out,
15028300	15029300	for giving me the wrong say-
15029300	15031300	I'm not even kidding, I'm timing you out,
15031300	15033300	because you gave me the wrong say to go on.
15033300	15036300	You will be timed out for a whole,
15036300	15038300	a whole minute.
15038300	15041300	For your, your dissatisfaction.
15041300	15043300	Where are you?
15043300	15044300	No!
15044300	15046300	Where is it?
15046300	15048300	Wait, I need to time them out.
15048300	15049300	I need to time them out.
15049300	15051300	Put user in time out.
15051300	15052300	Who was it?
15052300	15054300	Right, put user in time out.
15054300	15057300	For ten seconds, confirm.
15057300	15060300	There, you've been timed out for ten seconds.
15060300	15062300	Take that time out.
15062300	15064300	Your insolence towards the cause
15064300	15066300	will not be forgotten.
15067300	15069300	Don't ever cook again.
15069300	15070300	Teasing you.
15070300	15071300	So cruel.
15071300	15072300	One whole minute of no-
15072300	15074300	No, I said ten seconds.
15074300	15075300	I said ten seconds.
15075300	15077300	Is he back?
15077300	15078300	I'm gonna start panicking,
15078300	15080300	if a mod actually did ban you for real though.
15080300	15082300	Mods, whenever I say ban this man,
15082300	15084300	I mean in humorous way.
15084300	15087300	Where the heck is the dungeon thing?
15087300	15088300	Based AF.
15088300	15089300	Oh no, there you are.
15089300	15090300	Guys, it hurts.
15090300	15092300	Yeah, okay, he's back, he's back.
15092300	15095300	Right, where was the dungeon entrance?
15095300	15098300	I actually don't recall seeing the dungeon entrance.
15098300	15101300	Is it back this way?
15101300	15103300	Oh, they're dancing.
15103300	15104300	Oh, it must be this way.
15104300	15106300	Yeah, surely, surely.
15111300	15112300	Check them out.
15112300	15114300	Personal attention.
15114300	15115300	Refling.
15115300	15117300	This should have been me.
15117300	15118300	No, it shouldn't,
15118300	15120300	because you get timed out for doing that.
15120300	15122300	Wait, I'm gonna do it.
15122300	15123300	The chest spawns there,
15123300	15125300	not the statue has to go there.
15125300	15127300	Me making my thingy.
15127300	15128300	Doomsdaydan,
15128300	15129300	what if I wanna pay for it though?
15129300	15131300	I never read out your name.
15131300	15134300	God, it must be really weird
15134300	15136300	when I don't read out your name when you don't know,
15136300	15138300	and then 15 minutes later,
15138300	15140300	I'm like, oh my god,
15141300	15142300	Oh my god, Duly Lover,
15142300	15143300	thank you so much,
15143300	15145300	because I keep forgetting.
15150300	15152300	I wouldn't mind getting a full heal.
15152300	15154300	Do you have hearts?
15154300	15156300	Yeah, that's what I like to see.
15156300	15157300	That's what I like to see,
15157300	15158300	a video game that's stocked up.
15158300	15160300	Right, we're ready.
15161300	15163300	How long are you going today?
15163300	15166300	We have T-minus less than two hours,
15166300	15169300	and then we will continue
15169300	15171300	our Zelda shenanigans tomorrow.
15175300	15176300	I don't feel that.
15176300	15178300	I don't feel everything, honestly.
15192300	15195300	Shoot his hands with an arrow?
15195300	15196300	That looks correct,
15196300	15198300	so let's do that.
15198300	15200300	Oh, okay, let's not do that.
15200300	15203300	Oh, okay, let's just completely miss.
15209300	15211300	Ah, let me go, let me go.
15211300	15213300	I'm just a tiny boy from the pool.
15213300	15215300	Whoa, he took so much health.
15215300	15218300	That is an insane amount of health he just took.
15218300	15220300	Am I supposed to have more health by this?
15220300	15222300	I think I might need to do more side quests
15222300	15223300	than after this.
15223300	15226300	He took so much health in that.
15226300	15228300	Oh my god, oh my god.
15229300	15231300	He's got a little thing on his nose.
15231300	15233300	Oh god, what happens in here?
15238300	15240300	Oh, okay, we did it, we did it.
15240300	15241300	We're being extracted.
15241300	15242300	Any extractors?
15242300	15244300	Me, me, I'm being extracted.
15246300	15249300	Why did you take so much health though?
15250300	15251300	Oh.
15254300	15257300	Can you drop a heart maybe instead of arrows?
15257300	15258300	That'd be great.
15265300	15267300	I'm totally not strawwetting right now.
15267300	15269300	I'm getting a bit nervous.
15269300	15272300	Oh, what, there?
15272300	15274300	It's not that one, it has to be...
15274300	15276300	No, no, no, no, no, no, no, no.
15277300	15278300	I can't do any harder.
15278300	15279300	I can't do any harder.
15279300	15280300	Alright, again, extracted.
15280300	15282300	It's fine, it's fine, it's fine, it's fine, it's fine.
15282300	15284300	We're gonna do it, we're gonna do it.
15284300	15285300	What's that?
15285300	15286300	I'm low health.
15286300	15288300	It's fine though.
15288300	15289300	Ow!
15289300	15291300	Alright, I said we're dropping the fairy.
15291300	15292300	Bring the fairy in.
15292300	15294300	Ring the guards, ring the guards.
15294300	15296300	The guards have been rang.
15299300	15301300	Oh my god, I'm like spamming so hard when I do that.
15301300	15303300	I'm not even kidding.
15304300	15305300	Can we do it?
15305300	15306300	Can we do it?
15306300	15308300	Can we do it in this perfect three or are we gonna have to do it again?
15308300	15310300	Because I don't have any more heals.
15310300	15312300	I don't have any more heals, bro.
15312300	15313300	Wait!
15313300	15314300	What are you doing?
15314300	15316300	Link!
15316300	15318300	Link, you're stressing me out.
15318300	15319300	We're under a timer here.
15319300	15321300	This guy doesn't stay down forever.
15321300	15323300	Sorry, sorry.
15323300	15325300	Ugh.
15325300	15327300	No!
15327300	15329300	Ugh.
15329300	15331300	Oh, we're gonna get extracted before we even...
15331300	15333300	Done a lick of damage!
15333300	15334300	No!
15334300	15336300	This is why I don't gamble!
15337300	15339300	This is why I don't gamble!
15339300	15341300	Oh, we did it.
15341300	15343300	Oh, we did it.
15343300	15345300	Don't gamble, home kids.
15346300	15348300	This is why we don't gamble.
15349300	15352300	Let's go free in a row.
15352300	15354300	And a healthup.
15354300	15356300	I don't know why I just turned Russian there.
15356300	15357300	A healthup.
15357300	15358300	Okay, we got healed up.
15358300	15360300	Now we go upstairs.
15361300	15365300	Oh my god, it's Gami's colourful family.
15365300	15366300	Hello.
15366300	15367300	Check.
15367300	15370300	We are the tribe of the winds.
15370300	15373300	Long have we lived with the winds.
15373300	15374300	We have mastered them.
15374300	15378300	Now we join them together with the great winds at our backs.
15378300	15379300	We head for the skies.
15379300	15384300	Those who come seeking our power must play the note Zafa teachers.
15384300	15386300	Zafa teachers.
15386300	15389300	May they lead you onward to the power that you seek.
15390300	15391300	Aw.
15391300	15394300	You got the ocarina of the winds.
15394300	15398300	North, south, east and west, they're all just a breath away.
15400300	15403300	I do believe this is where the tribe of the winds once lived.
15403300	15404300	Hmm.
15404300	15408300	So they've left for the heavens and taken their element with them.
15408300	15413300	It looks like the wind element is beyond our reach for the time being.
15413300	15415300	We have no choice but to press on.
15415300	15417300	Let's get out of here.
15418300	15422300	So we did all of that for fucking nothing.
15422300	15426300	The element was not here, but at least we now have a clue to its whereabouts.
15426300	15429300	You must use the ocarina of wind to open a new path.
15429300	15432300	Well, there's no point in standing around.
15432300	15434300	Get that last element.
15434300	15436300	Last element.
15436300	15438300	We only have two.
15448300	15450300	Are we?
15453300	15456300	Um, are we supposed to go to the graveyard now?
15459300	15460300	Yes.
15462300	15466300	Ah, so that mysterious mark we've been seeing is the crest wind.
15466300	15470300	If you play the ocarina of wind, Zafa comes to pick you up and fly away.
15470300	15474300	That means we can have Zafa carry us to any other wind crest that we've seen.
15475300	15477300	Are you following me, Link?
15477300	15479300	Don't hurt your brain thinking about it.
15479300	15482300	Just give it a try and you'll see what I'm talking about.
15485300	15486300	That's just the map from...
15486300	15488300	That's just the map from a link to the past.
15488300	15490300	Is that actually?
15490300	15492300	Right, no?
15495300	15497300	Do you wonder what's going on?
15497300	15499300	I wonder what's going on too.
15500300	15503300	Uh, right.
15503300	15505300	We never actually...
15505300	15507300	Hello?
15507300	15508300	Stamp, stamp.
15508300	15510300	Even if we hire more people.
15510300	15511300	Welcome.
15511300	15513300	I'm selling issues of a helpful, adventurous guide.
15513300	15516300	It's called The Swordsman's News, and it's full of device right now.
15516300	15517300	You can buy the latest issue.
15517300	15518300	It's only 200.
15518300	15519300	200?
15519300	15522300	That's extortionate for a piece of paper and a bit of ink, mate.
15522300	15526300	I'm not lying, but that's a bit much, don't you think?
15526300	15528300	I'm going to see if we can get a bigger...
15530300	15533300	A bigger money pouch.
15536300	15538300	Use the Ocarina to fly to the lake.
15540300	15541300	Ice temple.
15541300	15542300	Oh, you're right.
15542300	15543300	Ice temple.
15545300	15546300	Wow.
15547300	15548300	Money, money, money.
15548300	15549300	Oh, wonderful.
15549300	15550300	They fit.
15550300	15551300	I'm so happy.
15557300	15561300	Oh, I can just keep using these guys over and over again.
15563300	15564300	I've got two red.
15564300	15566300	I assume red is like a major math update.
15569300	15571300	Okay, money pouch.
15572300	15573300	Total.
15573300	15575300	It's a golden total.
15575300	15576300	I like totals.
15577300	15579300	Gears, the sh...
15579300	15581300	Oh, the arcade's open.
15581300	15582300	What happened to the arcade?
15586300	15587300	Netto?
15588300	15591300	I can buy a bigger quiver?
15592300	15593300	I don't know.
15594300	15596300	I'll buy the boomerang.
15597300	15601300	That boomerang is not a bargain, but I'll take it since I need it.
15601300	15602300	Yeah, you're...
15603300	15605300	Well, you're a big spender.
15605300	15608300	Wait, does the boomerang get replaced by a money pouch?
15610300	15612300	How much is the money pouch?
15613300	15614300	600?
15615300	15616300	Eh?
15619300	15620300	What about you?
15621300	15623300	I don't have this kind of money.
15623300	15625300	I can't even hold it on my persons.
15626300	15628300	Jeez, you're extortionate, mate.
15628300	15629300	I'm a child.
15630300	15632300	Surely I get some discount.
15633300	15635300	I want to play games too.
15635300	15636300	What's in here?
15637300	15638300	What do you do?
15638300	15639300	Ah, he's finally open.
15639300	15641300	I can't wait to get cracking.
15641300	15642300	I don't know what this is.
15642300	15644300	That's like four languages.
15644300	15645300	What are these inflation rates?
15645300	15647300	Yeah, real child labor.
15647300	15648300	Speak.
15648300	15649300	Oh no, a customer.
15649300	15651300	Why did I even start a treasure game shop anyway?
15651300	15652300	Alright then.
15652300	15655300	Well, welcome to the fascinating world of treasure, blah blah blah.
15655300	15658300	In this wonderland, you can test your luck and win big bucks, maybe.
15658300	15660300	I don't really recommend it myself, however.
15660300	15661300	It's your wallet.
15661300	15663300	It's 10 rupees for a try.
15663300	15665300	I don't even have that money.
15666300	15668300	I fell over because I don't have the money.
15668300	15669300	Oh, good, good.
15669300	15670300	It really is your lucky day.
15670300	15671300	You don't have enough rupees.
15671300	15674300	I'm telling you, this gambling nonsense is no good.
15674300	15676300	You're better off without it.
15676300	15680300	Wait, Nintendo kind of pitching the masses, huh?
15680300	15681300	Right.
15683300	15687300	Can I learn a new move because I can do this?
15688300	15690300	Come again when you can jump further than any other.
15690300	15691300	Okay, my bad.
15691300	15693300	It doesn't have 10 bucks, could you glad?
15693300	15698300	If you aren't playing on a Game Boy, you can scam this game?
15701300	15704300	Now, the implications of that just don't work.
15707300	15708300	I don't...
15708300	15710300	No, this isn't where I'm supposed to go.
15711300	15714300	Even though I'm supposed to technically make my way to the air temple.
15714300	15715300	Oh, goodness.
15715300	15716300	Yay, okay, right.
15716300	15718300	I'm not supposed to be here yet.
15718300	15722300	We will now go top right, but not too top right.
15722300	15723300	Like middle right.
15723300	15724300	How about that?
15724300	15725300	We do middle right.
15725300	15726300	Deal.
15726300	15727300	We now have Pegasus boots.
15727300	15728300	What is that?
15729300	15733300	I don't know what that changes over here if we have access to Pegasus boots though.
15734300	15737300	Oh, I just fucking ruled them.
15738300	15739300	Fucking hell.
15739300	15740300	Fucking hell.
15740300	15742300	There's too much going on here.
15742300	15743300	I can't handle it.
15743300	15744300	I'm getting ruled.
15744300	15745300	I'm getting ruled.
15745300	15747300	Jeez, would you perish already?
15748300	15750300	Gosh, galley.
15752300	15754300	Jeez, I'm getting absolutely obliterated.
15754300	15756300	I think you can use a Steve Star.
15756300	15759300	You can scan the game by saving and checking and loading and clicking right.
15759300	15761300	Wow, I didn't know that.
15763300	15766300	I feel like there's something I must have access to.
15768300	15769300	This?
15769300	15770300	Oh, this looks okay.
15773300	15775300	Reach go a little to the right.
15775300	15776300	Oh.
15777300	15778300	Or not.
15781300	15783300	Oh, a new fairy.
15783300	15784300	Hello.
15784300	15785300	Hello.
15785300	15786300	I'm Link.
15787300	15790300	And I'd like to link up with you, baby girl.
15791300	15792300	Hi.
15793300	15794300	Wow.
15794300	15796300	Welcome to the adventure spring.
15796300	15798300	I have need of many rupees.
15798300	15800300	Please throw all of yours into the spring.
15800300	15801300	Sure.
15801300	15802300	All yours.
15802300	15803300	I don't need it.
15803300	15804300	Really?
15804300	15806300	You know, I don't even have one rupee on my person.
15806300	15807300	You know that.
15807300	15809300	If you do this, you will have absolutely no rupees left, right?
15809300	15811300	Will you really throw them all in?
15811300	15812300	Yes.
15812300	15814300	You are most kind.
15814300	15816300	I do not really need your rupees,
15816300	15819300	but I must reward such a kind adventure with some of my power.
15820300	15821300	You got a big wallet.
15824300	15826300	Complain and you shall receive.
15826300	15828300	May light shine on your quest.
15829300	15831300	May light shine on your quest.
15831300	15833300	Complain and you shall receive.
15833300	15835300	I got exactly what I wanted.
15838300	15840300	Wallet upgrade.
15840300	15842300	Don't mind if I do.
15842300	15844300	Literally exactly what I was needing.
15846300	15847300	Sorry.
15847300	15849300	I'm going to have to get like Gimli in this room.
15849300	15851300	Because she's going to absolutely hate shit.
15853300	15854300	Sorry.
15854300	15856300	I need to get rid of the plastic in the room, girl.
15856300	15858300	Because she'll chew the plastic.
15858300	15860300	Won't you get more?
15865300	15867300	I can chew the room, Gimli.
15868300	15870300	Then I'll put it in.
15871300	15873300	No, there'll be inside by the money.
15874300	15876300	I'll be coming right now.
15876300	15877300	Sorry.
15878300	15879300	Oh, and now I'll open the door
15879300	15880300	all the time.
15880300	15882300	She'll be interested when we're coming in.
15883300	15885300	I'm getting out of here.
15887300	15888300	Why are you here?
15888300	15889300	I need to go.
15891300	15892300	Come on.
15892300	15894300	You need to push through the door.
15895300	15896300	Oh, hold on.
15896300	15898300	I'm going to open the back gate.
15898300	15900300	Garden 4, I'll be back for a sec.
15924300	15925300	Sorry.
15954300	15956300	See these cats, man.
15956300	15958300	See these cats.
15960300	15961300	Oh.
15961300	15962300	She's coming out of me.
15962300	15963300	Oh, do you want out?
15963300	15964300	No, do you want...
15964300	15965300	What do you want?
15965300	15966300	I've already fed you.
15966300	15968300	Obviously she wants treats.
15969300	15972300	So, I'm now reinforcing that behaviour
15972300	15974300	for her to come me out and annoy me.
15974300	15975300	So, she's not looking good.
15975300	15976300	She's not looking good.
15976300	15977300	She's not looking good.
15977300	15979300	So, I'm now reinforcing that behaviour
15979300	15981300	for her to come me out and annoy me.
15981300	15983300	So, she's not looking good.
15983300	15984300	She's not looking good.
15984300	15986300	Do you want to do pin stones?
15986300	15987300	No?
15987300	15988300	Oh, wait a minute.
15988300	15990300	We have the mitts.
15990300	15991300	No, we can do this.
15992300	15993300	Fuck.
15998300	16000300	That's just the money.
16001300	16004300	No, the game knows I'm too scared.
16007300	16008300	Well, there you go.
16008300	16011300	To keep out money for doing a wee bit of exploring.
16012300	16014300	Stranny new.
16014300	16015300	What?
16015300	16016300	What does it do?
16020300	16023300	Oh, she's going to start me on a hell of a lot more now.
16023300	16024300	Oh, well.
16025300	16026300	She...
16026300	16028300	Honestly, you can spoil a cat.
16028300	16029300	What's the worst of him?
16029300	16030300	Is it me?
16030300	16031300	I was a bit more...
16031300	16032300	There's none of them.
16032300	16033300	It's up or down.
16033300	16034300	I think I may actually be up.
16034300	16035300	You know what?
16035300	16036300	This way to the lake.
16036300	16037300	So, what's up?
16038300	16039300	Shhh.
16040300	16042300	Aw, I'm going the wrong way.
16043300	16046300	Mmm, I may have gone the wrong way.
16047300	16049300	I am going the wrong way.
16049300	16051300	I'm going to have to go all the way on.
16053300	16055300	Cats deserve all the treats.
16056300	16058300	I didn't mean to spoil them.
16058300	16059300	Weed gimmels.
16059300	16060300	Or we go.
16061300	16063300	My cat doesn't stop me at one.
16063300	16066300	Literally, I don't know how much you could hear
16066300	16069300	because I was away from the microphone and, like, standing at the door.
16069300	16071300	I was like, right, come in then.
16071300	16072300	Come in then, you win.
16072300	16073300	Come in.
16073300	16075300	And then she's looking at me like...
16076300	16077300	I'm like...
16078300	16079300	Bruv, you've literally won.
16079300	16080300	Wait.
16080300	16081300	No!
16081300	16083300	I thought I unlocked the shortcut there.
16083300	16084300	Oh, there it is.
16084300	16085300	There it is.
16085300	16086300	Okay, we're on the right track.
16087300	16089300	That ace thing, if you noticed it.
16089300	16090300	Whoa, whose house is this?
16091300	16093300	Oh, Tiddly Wings.
16093300	16094300	Let me dug here.
16094300	16096300	Oh, how's it going, wee man?
16096300	16097300	Rough, rough.
16097300	16098300	Oh, great.
16098300	16099300	Can I go talk to it?
16099300	16101300	You're right there, mate.
16101300	16104300	My master, Sokwell, has been coming home far too late to play with me.
16104300	16105300	I'm so lonely.
16105300	16107300	Okay, let's fuse these two.
16109300	16113300	Guys, I'm still recovering from the time that I forgot what duration was left.
16113300	16114300	My cat doesn't...
16118300	16120300	Minish Village?
16122300	16123300	No, not Minish Village.
16125300	16127300	Thanks for that, Tiddly Wings.
16127300	16128300	For that, we just...
16128300	16129300	Let me just find...
16136300	16137300	Can I run on water?
16138300	16139300	I don't think I can.
16140300	16141300	No, I can't.
16149300	16152300	The mayor's secret house, maybe?
16154300	16156300	I can't believe I forgot to freaking do that.
16156300	16157300	You know that?
16157300	16159300	Right, I'll remember this for now.
16162300	16163300	However...
16164300	16165300	Where the heck?
16166300	16168300	I'm a bit confuzzled.
16169300	16171300	No, you need to keep...
16171300	16174300	Left is the one that's not right, I think.
16174300	16175300	Now you go back down.
16175300	16177300	Right, I think maybe...
16177300	16179300	Is this the library quest yet?
16179300	16183300	I think the library quest is what needs to happen next.
16185300	16186300	Oh, sorry.
16186300	16187300	My apologies.
16187300	16189300	Oh, there's a staircase down there.
16192300	16196300	That mustache-y old guy strikes me somewhat unreliable.
16196300	16199300	There's something fishy about this room, too.
16202300	16205300	I hope I don't sound like I'm bragging, but I have a certain cabin in Lake.
16205300	16207300	It's a gorgeous little place where I go to enjoy my hot...
16207300	16209300	Okay, I think that's the hint.
16209300	16210300	You want to fuse?
16210300	16211300	Yes, I want to fuse.
16214300	16215300	Can I run on water?
16215300	16217300	Jesus, girl, confirm Gen 2.
16217300	16222300	Oh, your name's not Stroneys Remove Tornail, bro.
16224300	16227300	No way you called yourself that.
16228300	16229300	Holy sh...
16232300	16234300	Oh, my God.
16234300	16235300	Brutal.
16237300	16238300	Absolutely brutal.
16241300	16242300	The pick?
16242300	16244300	Is that my foot?
16245300	16247300	Is that a picture of my toe?
16249300	16252300	Have you got a picture of my toe as your profile picture?
16255300	16257300	No way.
16257300	16259300	That's funny as fuck.
16261300	16263300	That's amazing.
16265300	16268300	Yeah, I would talk about the experience.
16268300	16271300	This person loving here is the mayor, very important.
16271300	16274300	Doesn't it just sound also official?
16274300	16277300	The mayor, like, strange mask sometimes even makes his own.
16277300	16279300	There's a mayor evil.
16281300	16284300	Just for a week, okay, okay, okay.
16284300	16287300	I would talk about, like, what happened in that,
16287300	16291300	but if I'm going to be honest, it was pretty, like...
16292300	16295300	A rough experience, so I'd rather just...
16295300	16296300	It's TFE.
16296300	16299300	Oh, you about it, because I had a bad time.
16301300	16303300	But I'm okay, so you don't have to worry.
16303300	16307300	No doom, no doom, but it was pretty...
16307300	16308300	Not nice.
16308300	16310300	So I don't really want to talk about it.
16312300	16314300	Right, I think the cabin in the lake was a hint.
16314300	16316300	There's no way it was.
16316300	16319300	Under construction, digging, prohibited.
16319300	16321300	Oh, yeah? What are you going to do if I do this, then?
16321300	16323300	Yeah, you're going to fart and clap.
16327300	16332300	The bandage gets changed, I guess, technically, after this room.
16333300	16335300	There's, like, a chest here.
16336300	16338300	Ah, I'm actually so smart.
16338300	16340300	I'm, like, 10 out of 10 smart.
16341300	16343300	There's a spider there.
16343300	16345300	He humped me!
16346300	16348300	He wasn't even hurting me. It's just...
16348300	16350300	It's a huntsman!
16350300	16353300	They don't hurt, but they just, like, look terrifying and stuff.
16353300	16356300	Where on earth am I going?
16356300	16358300	This is under the town.
16359300	16361300	Oh, we're getting red pieces, though.
16361300	16363300	I'm not complaining.
16364300	16365300	And 100 rupees.
16365300	16366300	Hold on a minute.
16366300	16368300	Hold on a minute.
16369300	16371300	Oh, something's happening.
16371300	16374300	I don't know what the heck all this is, but I'll take it.
16375300	16377300	Looks like it's a team effort.
16377300	16380300	The library quests, by flying to the lake,
16380300	16382300	you can't reach the Minish house otherwise.
16383300	16385300	Let's fly to the lake.
16389300	16391300	Ah, that's really good.
16391300	16393300	This is a lot of digging.
16394300	16397300	I am a dwarf and I'm digging a wood.
16397300	16398300	Diggy, diggy, wood.
16398300	16400300	Diggy, diggy, diggy, diggy.
16402300	16403300	There's a chest.
16404300	16405300	Wow, three red pieces.
16405300	16407300	Don't mind if I do, honestly.
16411300	16413300	Under construction.
16413300	16414300	Yes, that's fine.
