start	end	text
0	26840	Good morning, good evening, good afternoon, what what the heck were these bases wait
26840	31720	Minestrone those are clearly the bases that Mercy used on her stream
31720	40520	uh no what are you talking about these are completely clear base models that we
40520	43640	can utilize for African mystic
43640	53000	erodia gothani san erodia gothani san erodia gothani san erodia gothani san
53560	59960	pretty please with sugar on top make her gothani hop employee of the month thank you
60520	67400	oh you're you're welcome thank you for that hold on i'm just looking at stream elements my stream
67400	75240	elements has disappeared i can't forget here thank you raven for the tip you won erud erudere
75880	79480	hold on erudere i might have actually put the request on you know that
79880	91400	erudere erudere are characters who who pretend to be erotic at first but after falling in love
91400	97720	start to be more pure innocent and romantic isn't that the one where she looks like a fiendish thank
97720	104760	you for becoming a mim i am having schizophrenia i said thank you for becoming a member yesterday
104760	107560	to you
107560	115560	oh are you going to again thank you for becoming a member um isn't that the bimbo
115560	120040	application to wife material thing where she like drops the book and picks it up and then
120040	126120	she's like a wife by the end of it is that what you're asking congrats on a living k i got a living
126120	135400	k stop have i not not you're lying i only sell what i only celebrated 10k yesterday
135400	140040	or was it the day before i haven't slept i'm so sorry i don't know what day we're on
141080	148840	what how am i 11 000 that's insane thank you everyone for subscribing and liking and interacting
148840	159400	oh my gosh that clip we were in reverse bimbo application honestly right we will do pure right
159400	167800	let's see what your suggestion was let me reread it okay goth make her goth i hop employee of the
167800	174760	month right okay but you never said body type so we totally don't have a zura here you can pick
174760	183480	between regular a lollipop this is supposed to be milk but look i'll just i'll clean it up a
183480	187960	little bit okay let me just click this totally isn't she be what do you mean this is her hair
187960	194920	drills stop it what are you talking about yeah the the bases are by mersey i give credit to
194920	201320	mersey shawnee's is so much that honestly the desert look what do you mean this is clearly emmy
201320	209960	no it's not you're teasing me andrew scarlett thank you for the extended membership you deserve it
209960	214920	you're the best moment oh thank you everything are we already kissing at the start of stream
216520	221880	we're not supposed to but i couldn't help myself we just have to grab your little face
223080	229960	uh right okay so we've got goth i hop employee of the month and the term you want me to use is
229960	237560	erudere goth oni san uh you're literally just asking for my alternative outfit uh and i do like
237560	247000	to be seen as a big sister so twin race this is our problem what body type though what what do we
247000	254600	want for the body type on the goth big sister is it my body type or is it shebe's body type
255560	259560	are you squiddin me right now are you oh no i'm still doing the suggestion
259560	266760	strongly oh anon thank you i love anon i love refilling i don't know what variation
266760	275400	you're right now only somebody type mersey or shebe ester and ember also top tier
275400	282760	i like the way brian said in shebe question about shebe okay we're gonna wait wait why can i not
282760	287320	like move this over hold on sorry it's really not liking this right now what do you mean ms
287320	292600	paint is getting a bit old no don't say such things okay as long as you can see it on stream okay
292600	300040	we're gonna do goth i hop employee okay but yes i'm open to suggestions now do you want me to do
300040	306920	all five suggestions first and like we'll pick one for the body types and then we'll start drawing
306920	312920	or do you want me to pick draw pick draw pick draw pick draw how do you want it it's all in your
312920	320360	hands baby yeah i was hanging out in ac stream she's trying to she's trying for the life of her to do
321320	329080	um uh like childhood talk stream she she hasn't done one thing she actually only showed a part of
329080	333640	her childhood at the start of streaming that's it make her look like she eats an i-hop six pack
333640	338920	every hour what's an i-hop i assume that just means six pancakes in the stack actually pick draw
338920	345000	pick draw pick all five first oh god you guys are gonna you guys need to azura's neck no what are you
345000	352360	taught that's not azura what what makes you think this is azura that's bizarre like i honestly have
352360	359800	no clue why you think this would be azura at all like it it's actually kind of i don't know i feel
359800	368840	like you're being stereotypical here what are you talking about ruthlyn see it's not azura at all
368840	382040	see is anyone buying this yet or anyone buying what i'm selling pull you want to pull um i have to go
382040	394280	here to do the pull start pull how do we do this pick draw pick draw pick draw draw draw
395240	402760	eh no sorry pick all then draw start pull i'll just clear up the not azura by the way
403720	410120	oh my god clearly i can't color in between the lines of the child
413240	419480	we did it this is no longer azura and we have undeniable proof it's not azura
423320	427480	whoa you guys are getting kind of close to being a split okay pick draw pick draw pick draw i look
427480	434680	like okay i'm gonna sip my tea but good morning hope you guys are having fun i've tried to upload
434680	439960	all of my streams for this week youtube is having a hissy fit so they're all at the wrong time and
439960	448200	stuff but i have picked my um little i have picked what i'm gonna do this week how long does it take
448200	454360	to draw well considering i have absolutely no um hours behind drawing i don't know how long this
454360	458920	is gonna take i have no idea what i'm doing i'm just here for a good time but i've got goth eye hop
458920	468200	right here right what have you decided pick draw pick draw pick draw all right okay you guys have
468200	475560	decided guys have decided right let me slurp my tea okay so the first things first you need to pick
475560	483720	the three colors that go behind the design okay so you guys have said goth eye hop is eye hop's
483720	490760	logo red yeah is eye hop's logo red my brain wants to say it's red yes or no be be honest
494200	499240	good afternoon hope your day's going great my day hasn't even ended yet i have not slept
501640	506520	there's a new development behind the scenes and i can't even leak it i of course the eye hop is
507000	512200	it's like blue and white it's blue and white a blue and white goth so blue
513480	519240	white and black for the goth okay so this is our little color palette that we get to pull from
520040	524760	it's blue with red accents okay and then obviously because it's goth we have to do black
524760	534440	so this is our color scheme developed now for a cheeky goth um okay there's a little red uh
534440	539240	maybe maybe i'll do a red god i'm returning into france over here steady on
542280	550280	okay so for our totally not she be design um for our pupil let's start with the pupil
551160	559480	she is a goth goths are known for how dark they are what's a dark pupil that we could make i have
559560	564440	no idea so first let's do the pupil that's the most important part of a veal or design because
564440	570920	we do not have like a default pupil oh god that's so squiggly let's give her eyelashes oh you're
570920	582040	so kawaii ooh lovely oh my god you're such a beautiful girl uh an american god did you at least
582040	588680	get a good nap no i got like 30 minutes why no slime girls i think we're probably going to be
588680	596840	designing a slime girl i think we're probably going to be designing a slime girl red red white
596840	605240	and blue goths are known for their love of kenny from south park vampire bat shape i think a goth
605240	616840	would be cross an upside down cross maybe now your pupils really cannot be black well actually
616840	623640	no that's exactly what color the pupils are they are normally black but for a vtuber it's not like
623640	630200	how you're supposed to do it oh strani what do you know about development fuck all i don't draw i just
630200	636520	like you just can what looks good so we're just gonna do a darker hue on the outer side of her
636520	644360	eyes like that and then for the cross should we do it black i mean we could get away with it being
644360	650840	black a little upside down cross like this for the oh that's that looks like a plus sign try again
651560	656520	he won't strong it there we go upside down cross for the pupils and then it would have like the
656520	667320	accent of um oh maybe no that looks too silly okay it would just have like a little white
667320	673400	highlight around it i'm covering up the black note you know what i'm trying to do right you guys can
674120	680760	do this right yes for the slime girl you have to pick what body type you can have milk you can
680760	684840	have regular or you can have a lollipop on the slime but you guys can we'll do that after we've
684840	692840	designed our little une san okay so we've got our pupil type already fantastic um if she is her big
692840	702120	sister i don't normally see um how the fuck do i zoom in oh hold on hold on i'll pause this
702120	709160	stuff there we go boom zoom in like this um oh that looks even worse zoomed in who thought of
709160	715720	this stream i mean it was me but it's even worse than i imagined okay so now we need to transplant
715720	722520	her eyes on right so when it comes to anime the eyes are like down here okay so don't be
722520	732360	fooled the eyes need to start like all the way down here it looks weird right okay why did it wiggle
733080	739800	don't wiggle please don't wiggle no right don't do it that way don't do the actual circle so this
739880	747640	is une san is she a smoker if she's a goth she would smoke right we'll do a little ciggy hanging
747640	753560	out of her mouth at least cigarette cigarette was it is it brown at the bottom yeah brown at the
753560	759160	bottom where the filter is and then she's got like a little a little smoke thing you want red lipstick
759160	765960	oh i guess for the accent yeah oh maybe she has like she always has like little kissed cigarettes
765960	775720	around her this looks awful now you see why i literally do not design these girls
777320	782600	this is awful okay so that's sorry i'm completely like messing this up as well
783480	790680	you never saw a cigarette before i don't i have seen them but i don't smoke so it makes it harder
790680	797480	to imagine what i'm supposed to do at this stage okay then upside down cross oh my god she's gonna
797480	804120	look like a muppet do i look like a muppet to you i mean a little bit oh god i need to zoom in even
804120	809320	more oh my god this is like i don't want to zoom i'm getting scared to zoom in it looks scarier
810200	813880	she's oh she's looking like a clown you know that oh this is
814840	820840	are you squinting me right now oh his idea was this black lipstick also requesting to redest
820840	826440	her and ender on the dare types fandom wiki really wish we could have both at the same time or if
826440	832360	she could alternate between the two so you want her to have multiple personality disorder coming
832360	837880	right up i'm sure i can find a feature over that no problem okay we're gonna give her a little wee
837880	848120	white eyeliner thing okay and then for the hair now if you are emo real one of being emo or anything
848120	856040	you you require bangs of some kind it doesn't matter what they are you require bangs of some kind
856040	863560	so we have four points to her eyes so i'm going to give her so i've got three bangs like if you if
863560	869080	you count above my eyeballs there's three oh thank you for this strong if you want to find the person
869080	874760	who keeps making you do all these bad ideas just look in the mirror tell us how the fight went
874760	881800	afterwards oh my god that's just thank you thank you raven for the tip again and then thank you tiny
881800	888600	spiny for insulting me to my face rude you know i'll actually say one thing i submitted for
888600	894840	something like this i didn't get it back but i submitted so she needs four say that's three that
894840	904120	i'm just drawing myself god damn it wait hold on four how'd i get four that's five what but that's
904120	913080	three so how did i get four five one two three four oh that's four hold on a minute hold on a
913080	920200	minute i can't can't right she would have bangs no it can't go over her eyes because that's like
920200	929480	real number one of each of her so one bang two three four god i am special okay well right if she's
929480	937880	emo i hop so she would serve so she would have a cap on right like one of them those caps how do
937880	946040	you draw a cap i don't know i don't know how to draw a cap okay we take off her top of their head
947080	952520	i'm so sorry bowl haircut no hold on let it develop right so she'd be wearing a cap right
952520	961560	those like those hats that like come like this right and it would say i hop but because it's
961560	972680	your inappropriate onesans she was i hop on yo don't worry the algorithm can't read that okay and
972680	980840	then for the back of her hair what would we do some kind of i don't know let's get rid of the
980840	987320	cigarette smoke mr. cigarette you're in her way i will remove you at once thank you okay but for
987320	993720	her hair if she's got she needs like intricate like multiple things like coming out but what maybe
994520	1001640	first do like the little no tell you what tell you what no hold on this went from chat giving strong
1001640	1008120	ideas to roasting the process give her twin tails but i'm biased towards twin tails i love i love
1008120	1016280	symmetrical hair like that i'm gonna make her asymmetrical on purpose okay so one side is gonna
1016280	1022920	be a bunch that come oh my god this is awful that comes out right and it's super duper long
1022920	1032360	because she's so edgy like that yeah she's just such an edgy onesan okay and then it's gonna be black
1032360	1039560	i'm so sorry she'd be here it's gonna be black but she's gonna have like the classic like oh this is
1039560	1045640	an asian in a in a video game let's give her a random purple streak and then for her bangs
1047000	1060200	she's gonna have purple blue on the outside only yeah yeah okay but then on the other side this is
1060200	1067080	the hideous most disgusting ugliest character design i've ever seen okay so one side is that
1067080	1074440	and then the other side oh no please see jim leader sabrina from pokemon find inspiration
1074440	1079960	jam leader sabrina okay i'm unironically looking the operate now i don't know how to do here
1079960	1087080	is she got asymmetrical here no that's not eight well it's kind of well no it's just long
1087880	1095560	so what should wait so if one side is a pom pom what the others
1098280	1105240	how did people design stuff oh my god i'm not being funny but how do you design stuff
1105880	1108120	this is hit this is awful
1108600	1113800	no wonder this shit costs like hundreds of thousands
1115320	1122120	how do you come out how do you envision what the freaking process is well hang it on the fridge
1122120	1126840	i like to think that these are references that stony said no i absolutely did not send us
1127880	1136040	normally with the research right let me finish my tea the hands right you know what
1136040	1140120	she's just gonna have one ponytail because i can't even figure it out i'll give her like
1141240	1148040	i don't know that like those bangs that come at the side though i don't know do we give her
1148040	1155240	like a little wing right no no we'll just give her bangs at the side so every artist can skip
1155240	1162040	drawn the ears because if you have ears the artist doesn't like it right and then we'll just connect
1162440	1168200	her neck again so she can breathe but she is smoking okay right and then for the outfit so
1168200	1176600	goth i hop so actually we want to fully shirt her up so we'll give her a collar right let's give
1176600	1183160	you that yeah that's right put that shirt on oh you're so beautiful with the shirt and then
1183160	1188600	but it will be a tight fit and form shirt okay so hear me out but
1190520	1194280	but she's purposefully tight wait i'm just drawn sheebie again fuck
1196760	1201480	i'm just drawn sheebie no right and then we'll show off her lovely arms because i like when
1201480	1207480	the uniform shows off the arms like mm-hmm your arms are so pretty onee-san oh my god onee-san
1207480	1212200	i can't control it that hurts would i do onee-san i've never had this problem before
1212200	1218200	please look after it why no slime girls i'm drawing one relax if i freaking read slime girl
1218200	1224920	one more time i'm gonna fart in your mouth please i will draw one i will draw one for the meme but
1224920	1234360	please don't expect a freaking slime girl i'm so serious right and then then she needs her logo
1234360	1239640	on her booba and it says i hop oh wait no it would have her name on it what would do oh sugar
1239640	1246840	what's your name a goth i hop a goth i hop what would you be called something emo
1247960	1254360	what's an emo name you guys got an emo name so supposed to be a threat to it you won't
1254360	1261000	what about exposed shoulder um
1261000	1271480	um where's slime girl up my arse it's i've no drawn it yet relax karen karen's not a goth name
1275320	1280360	what's the name of that goth from pokemon that everyone faps the sorry i shouldn't see
1280360	1290360	things so directly was it goth from pokemon hot hey hex maniac yeah okay let's just call her hex
1290360	1299880	because she's such a poser she's called hex and she says please have with me right kelly no marina
1299880	1307160	her name is dark right her name's hex okay we've got a name hex i don't know what her surname would be
1307560	1316040	hex hex flex oh my god wait no dark ross are you squid me right now
1317720	1323560	marnie please for the love of all that is holy and good in this world do not forget about the
1323560	1330520	brown piercing are you on it you're fissioness and black bdsm collar and cuffs oh well like
1330520	1336360	maybe just on top of her uniform she has like one of those collars that are infinite collars like this
1337720	1343640	and it hangs above her uniform and she doesn't take it off because you secretly gave her it
1343640	1348280	that's would you do a slime girl for gen 2 if i sent you three cans of Pringles
1350200	1355960	no you couldn't even pay me for a slime girl i'm not even kidding someone could like
1355960	1363400	fucking wallop their cock on the desk right now with like a fat 1000 us dollars you will not convince
1363400	1369960	me to have a slime girl i am not debuffing someone so harshly okay it is paramount that
1369960	1379240	her left eyebrow has a piercing it must be visually it her right but visually our left okay
1380680	1387480	visually our left but it's her right because she's always right we kneel for our big sister
1388360	1394760	it's can of Pringles thank you anonymous can of fucking Pringles fucking shovel can of Pringles
1394760	1404360	up your arse right Raven thank you for your tip and what you want to call her Hicks marina
1405960	1415400	what about four cans of Pringles anonymous stop it young man so the price is how much no there's
1415400	1422440	no i i'm not giving someone a slime girl debuff at least if i like someone wants an alternative
1422440	1429640	sure but i'm not giving someone a slime debuff the the gimmick of a slime disappears after about
1429640	1434040	20 seconds okay i don't care what you say we're about to draw a slime girl together and i'm going
1434040	1442280	to prove to you that the debuff is like so quick right i want it to be like really like this is
1442280	1446840	this button is ready to pop i don't know if you guys have seen sin sister's very unique toggle
1447480	1458040	but this shirt is ready to pop okay do i make myself clear okay and then we just need to connect
1458040	1468840	the shirt because that's how shirts work okay beautiful stunning now now what okay pan i mean
1468920	1477320	it's really rare for v-tubers to have a shorts in general so honestly i am down for shorts like
1477320	1486520	emmy has we shorts i don't know i actually wouldn't mind the kind of like covered up thingy and then
1487480	1495000	we do the fishnets what's that i'm going to manually draw fishnets oh you bet your you
1495000	1502040	bet your ass i am that's right because we're using ms paint that if you think this stream is painful
1502040	1508440	now you just wait until we start drawing the slime girl i am drawing directly on top of these bases
1508440	1517000	and there's nothing you can do about it manually pop that like behind me hi mommy sorry i'm late
1517000	1527000	ah i don't be silly not late right oh wait hold on no we're doing full body fishnets like i um sorry
1527000	1535320	we're doing full bottom fishnets so the fishnets are viewable up here above her thing hold on let me
1535320	1542760	just let me just swing my cock around because the fishnets would go above the shorts as well
1542760	1550040	just to really solidify that she's emo and it's not it's not it's not a phase mom okay
1552120	1559320	and then we do it this way and just like that we have created new fishnets
1560200	1565880	what's that this is the cringiest design you've ever seen and it's the most basic one yeah what
1566040	1572280	you're gonna do for it yeah you're gonna love it aren't you and then when gen two does actually get
1572280	1577320	revealed you guys are gonna laugh even harder looking at these because i already know what gen
1577320	1588440	two look like and you do not there we go and then if you didn't know at the end of a taste there's
1588440	1595640	like a woman is racist you she hates slime girls oh i didn't know where you were going with that and
1595640	1605080	i was like excuse me refling i thought you were actually calling i was like excuse me right okay
1605080	1613000	it's fine thank you for the tip anonymous i'm drawing i'm drawing a slime okay you you have
1613000	1620760	bullied me into submission i am drawing a slime after this one so the slime accusations can disappear
1621720	1630520	okay and then no one can call me slay mist again okay i believe in non osmosis supremacy okay if
1630520	1635960	you didn't know osmosis is a high concentration gradient to a low low concentration gradient
1637000	1642520	high concentration there concentration i can't remember what was mean yours okay and then we
1642520	1645320	did a little tool thing there's a little tool thing at the end of the fishnet
1646280	1655080	okay fishnets are almost done we're almost there
1656600	1660840	um we need to do the buttons on the shorts i love when the shorts have the buttons
1661400	1665480	i know she sits on her shorts funny because that button hits her button real good
1666680	1672520	stop it it's like first thing in the morning i have not slept so i'm extra delirious honestly
1672520	1679480	right i love when the shorts do that thing where it's like this and then it has a button here and
1679480	1685960	then it goes along and then like that oh well i guess that's the top of the shorts
1688600	1694920	no okay are you squiddin me right now are you squiddin me right now suggestions black thong strings
1694920	1702680	on her hips fishnet cell book gloves black handcuffs and ankle restraints black lipstick
1702680	1709320	one tiny black heart under just one eye black heart shaped pupils no i'm sticking with my
1709320	1718120	shitty pupils i've already decided right i'll take the heart piercing heart it's very clear
1718120	1724360	that she's also pierced in a few other regions for no particular reason i'm just making sure i've
1724440	1731800	got the shirt detail correct yep um how the fuck are belly piercings how do belly buttons
1731800	1736840	piercings work i actually don't know like is that a line no it's not a line it goes in the skin
1737480	1744440	okay she's also pierced in another region because you know she kind of freaky like that but uh you
1744440	1753480	can't get a toe piercing so that doesn't count um i actually controversially like the short
1753480	1760600	fishnet gloves i think because of the contrast that would play with the long leg fishnets
1760600	1766360	and then the glove very it's very short glove variation almost as if she's
1768040	1775080	like willing to touch you and you crave what you can get through the fishnet because if it was like
1775080	1783480	full length it's like oh the touch isn't as you know deep but it's deep uh i think maybe we'll
1783480	1788840	give her long black nails as well like classic long black nails i think that would do quite well
1792600	1797560	because like i mean come on be honest oh look at that come on don't you oh wait no hold on we'll
1797560	1804040	make her nails the same colors her eyeballs oh my god this is we're doing it i love piercings
1804040	1811720	because they taste like coins and i'm all about the money why why that's hilarious okay but she has
