start	end	text
1811720	1816680	like longer fingernails like coffin shape if any of you guys know what coffin shape nails are you're
1816680	1824360	a real one she got oh who i keep disappearing off to someone else what do you mean drawing on ms
1824360	1830200	paint isn't a valid way to create an entire feature remote what are you talking about honestly right
1830200	1840680	for the the shorts there's not really much detail to it beyond what meets the eye should they be
1840680	1847640	short or um maybe they should be shorter in the fishnet raised up
1847640	1855160	uh okay okay i think they should be raised up let's raise them up
1868600	1873400	what what do you mean i'm delirious because i've not had enough sleep i have no idea what you're
1873400	1880120	talking about you are crazy whoa that's not how to erase something i guess we have to color in her
1880120	1888200	legs honestly i mean i'll take it it's fine i was gonna suggest that but i don't know coffin nails
1888200	1898360	are the best oh yeah we shadow wizard money game we love coffin okay our little and then
1899240	1907880	and then her model oh my god then her catchphrase is gonna be um her catchphrase if i can get it out
1907880	1921880	is gonna be why does it her catchphrase is gonna be let me serve you okay but obviously it's like
1921880	1928760	the winky face kind like excellent excellent let me serve you yeah like that kind of thing
1930040	1936760	what country do you come from a country called scotland forever okay this is the
1936760	1943560	shitest design ever okay well there she is so oh god is that really it is that oh i've got to offer
1943560	1950040	this world oh it's awful right her name's hex could you get any more stereotypical
1952040	1957720	there's nothing to the design i'll take it though i'll i think that's okay i would give this design
1957720	1968200	i would rate it great out of basic did you know ms paint has layers oh does it actually
1968200	1973080	that probably would have anyway uh i'm just gonna bring her to life because you know wait can i
1973080	1980520	can i oh i don't know how i did it but i managed to close the gap on the eyeballs okay right
1982600	1985640	yes i mean that's all we can do
1987480	1993080	because i don't have anything else to add to her we have done goth i hop employee of the month
1993800	2001880	ero dere goth nisan and then uh her name's hex her pupil is an upside down cross with
2001880	2009080	white outlines to it um she wears an infinity collar but it's actually secretly your infinity
2009080	2014680	collar that you gave her and then she says let me serve you winky face xoxo and she has a smoke
2014680	2024600	and addiction and she's got piercings out the wazo um aren't we being a little extra she can't be
2024600	2034360	barefoot i mean uh in the house she can because you know you share a house i mean i wouldn't put
2034360	2040360	her in heels servers don't wear heel heels servers wear trainers because it's too sore
2041720	2046120	literally i have formed this dick what you want me to put in james i'll put in james right now don't
2046120	2052360	think i want shorter nails because she works in the food industry and only son needs to be able
2052360	2060440	to properly take care of her darling brother's prostate health daily you said you said that part
2060440	2067640	i'll load again raven you said that part thank you for the tip now i'll let you in on a little
2067640	2075320	secret about the service industry if you are just a waitress and all you have to do is hold the little
2075320	2084760	tree of food and drinks i have fantastic news you can have long nails if however you prepare things
2084760	2094680	as a waitress you cannot have long nails because you're preparing food but if you're only doing
2094680	2105480	the serving and the gathering like that and dempo is a genia can you make a really sexy
2105480	2113640	sweaty mean chubby mum i mean i think that's all i can do with our beloved hex so we'll move on to
2113640	2120360	the next right you guys pick a body type for the slime you have three body types pick and it's totally
2120360	2128200	not between azura strongy or a super body type we'd long here nails mix up no depends if you're
2128200	2136600	using a server tree they could just be press-ons real real and true wrist and ankle cuffs like a
2136600	2147160	bracelet as you can tell i'm not very good at imagining and she's got one shoe because i gave
2147160	2152520	up halfway through making this shoe azura strongy do a poll oh yes of course we can do a poll don't
2152520	2164200	be so silly hold on let me do a poll start poll slain is what body type azuras strong wild card
2164200	2171640	sorry i see let's go leave azura alone we can think of something better you don't want slime
2173320	2173960	azura
2177320	2183240	um right i'm getting the slime out of the way and then after that anymore slain mentions oh my god
2183240	2192760	that's awful that's awful yeah this is why i literally do not create uh virtual models
2193560	2200200	oh wow you want a milf slime what the heck i didn't expect that i thought you would want a lollipop
2200200	2209400	slime oh i forgot god make the slain girl as close to strongy's but what just to upset me even more
2210120	2216360	you want to upset me reeflings how dare you can we get a methodic did body type got you covered
2216360	2227080	already and add that's exactly for azura's body type for the architect southern cow pork
2227080	2230840	chubby pig girl oh no i wouldn't put a pig on a big body type that's not nice
2233240	2239800	slain girl you can drown in i mean i guess uh it looks like azura is still winning so yeah
2239800	2251160	slain girl being thick to drown in her yeah a urethra slice if wait right i'll tell you what
2251160	2259480	if i ever develop a slain girl the first audio i'll make her a record is a slain girl claims
2259480	2266120	into your urethra and tickles your pickle from the inside out that'll be my deal you asked for
2266120	2277080	slain girl she's she's crawling inside upset slain mummy well slain mummy is i'm satisfied
2277880	2282600	stop the count i'm satisfied right what claw is the slain
2282600	2290440	and okay what color is the slime is the question
2292760	2301160	no deal promise slain girl digest you she has a deal that sounds very uncomfortable is there a
2301160	2308200	downside to stop uh you don't have to sell her anymore jokes on you i'm into that
2308200	2313720	have her climb into me and pilot my meat so i would be down for that i like the main control
2313720	2326280	thing you want a brown slime no okay so here we go uh done okay there's your slime girl right can we
2326280	2335080	move on teasing i'll actually put some effort okay so we've got we've got milf oh hold on the
2335960	2341640	well milf slime why wait i told it to make the text black oh it doesn't matter
2343080	2347720	okay first pick the color scheme oh wait hold on that's like gonna be in her hair right milf
2347720	2354200	slime one two and three we need to pick a color scheme green white a brown slime just sounds like
2354200	2360680	diarrhea jello okay that's kind of mildly true red would be a unique slime claw
2360680	2371640	base i'm a sucker for blue i mean she you yeah hex was originally supposed to be blue but kind of
2371640	2381400	messed up between what so like blue for one claw of the slime and then the accent color will be like
2381400	2390120	a neon pink i think this is the accent claw have like little hints of it in between maybe
2390200	2397480	maybe like green as well like just make her like really just off of rgb slightly and make her like
2397480	2403720	a jelly thing polka dot slime would be cute two tone white green or white purple
2407160	2411320	okay maybe not green then i don't think you guys are fuss for the green right how about accent
2411880	2420680	white and blue main and then accent is pink okay let's see what we can come up with now so
2422920	2434120	i can do right oh and just just for now imagine so that's the body okay now you can put clothes on
2434120	2439400	a slime girl it looks terrible i know it looks terrible but you can put clothes on a slime girl
2440360	2446280	see it oh no she's she's she's on hello sherbert's slime
2447640	2453560	paint bucket artis what can i say i really i do myself now i like when the slime girl
2453560	2460200	is dripping i and because you guys wanted the milk i wouldn't mind some sort of
2460200	2467560	like implications of dripping here oh that's awful that's like nothing like a drip holy crap
2469400	2476760	Oh my god, that's- how the frick do you make a drip? Like dripping from the belly button and stuff. How do you do that?
2478920	2480920	Why is this so much harder?
2483160	2484600	Oh my god.
2484600	2488040	Haven't you found respect for concept artists? I can't believe it.
2488040	2495040	All that took was one attempt at doing something and then I understand why it's not as- she got that drip rain jacket body
2495040	2502240	So white droplets. Oh, it probably should actually be white. Very oopsies. Let me just add a little white onto it real quick. Oh
2503520	2505280	little
2505280	2507280	Whiteness in there
2508960	2510960	I'm dripping from the belly button
2511360	2513840	You can't really drip from a toe. So we'll drip from that ankle
2514320	2519120	Is your drip? You just need to draw sweat honestly. Okay. Now you can draw an outfit
2519920	2526960	So sue is currently the most popular slime, and I will not be taking any aligunkies that she's not
2531520	2540080	If she's blue like if she's actually blue, I think I might have to give her what yellow jacket like actual rain jacket style
2541600	2544960	Oh god, she looks like a genie. You know that? Oh my god
2545600	2550880	I don't think this is working the way I wanted it to. She's like princess leah like add some red in there
2550880	2553120	And then you've just got princess leah going on
2556640	2560400	She's blue. How buddy? How would I you want a swimsuit?
2561760	2565920	I like that. Keep cooking a swimsuit milk
2568880	2570880	That I do not mind
2571120	2577040	Healy is what profile picture. Thank you for coming to member. I appreciate it membership streams start up next week
2577920	2579920	Not this week next week
2579920	2583040	There's going to be ton of membership streams bombed right at the end of this month
2583520	2588880	Do I make myself clear? Yes, sir. Yes, sir. Right. I want a swimsuit. How do you draw a swimsuit? Hold on
2590160	2592720	I'm going to look up women's wet and
2594160	2600720	Because I don't know what it looks like because I wear a very funny swimsuit that covers me up completely
2600880	2602880	Mm-hmm
2603200	2610320	Um, I guess it would honestly just what we'll go for like the classic like the it would be like up here
2610480	2613120	It oh my god, that's quite a high. It's a hard to be
2616080	2620960	Oh, sorry, I've got that freaking spot. Well, I her thing went sideways
2623440	2625440	And then
2625760	2627760	I
2629360	2633120	Can you do hold on a minute. Can you do a swimsuit that looks like this?
2633680	2637280	Whoa, hold on. Hold on. Hold on. Let me cook. Let me cook. Let me cook. This is awful
2637280	2641280	Don't let me cook by the way, but can I do a swimsuit
2642080	2646560	That's held up by straps. I'm just drawing a zero then if it's held up by straps
2647280	2649040	gosh darn it
2649040	2652800	Azura get out of my head. Oh, I'm like the kitten
2656160	2659120	Come here. Okay, so it's like this
2661040	2664240	Let's get rid of that. He's just getting a bit confused and that's in the way
2665040	2671760	Uh, and then what uh, what was the slimes name be slime mix slime McGee?
2672960	2674960	I don't know
2675440	2680880	She can't have a naked model in each of the slime needs clothes jeweler the fake delete you
2681840	2689440	Uh, she has a skeleton. I don't know. Slimes are like osmosis. I feel like she'd accidentally pick stuff up though
2690160	2694640	So I wouldn't mind putting some jewelry on her. Fuck it. You can get like a wee anklet thing going on
2694800	2699280	This is just Azura. God damn. Why is it so hard right? What would be inside a slime?
2699600	2703600	What a slime would accidentally pick up juice. Whoa, where's my thing?
2704160	2706880	Right, let's let's put some juice
2707440	2712480	Slimes love juice. So we're going to give her a can of cola in her thigh. Okay. This is cola
2716240	2719360	There we go, so she actually got cola in her
2720800	2722240	Um
2722240	2730000	White button down dress through she be office. Maybe there is no she be. This is gen two. We've got hex
2730720	2736800	We've got milf slime that doesn't even have a name yet. I'm unironically ever just going to call her slime McGee right now
2737840	2739840	Slimey
2741600	2743600	Slimey
2744560	2746560	Slime McGee
2747120	2749120	Here we go
2749120	2755600	Beautiful stunning gorgeous for her eyeball. You'll never guess what's going to be in her eyeball
2757920	2763280	So she's gonna have that and then her eyeball is going to be a droplet. Okay
2764000	2766000	But the actual
2766960	2772400	pupil hold on let me let me close this off so I can do the old copy and paste method
2774560	2776560	A chris diet
2776560	2783120	Diet cook, diet cook. Don't let strongy pick names again. Still I'm so sad that I'm not allowed to name after admit
2783120	2787840	The names up and picked her way better than anything I could have come up with. Oh, hey
2788480	2790480	Um, right drop
2790960	2795680	A little droplet like would be her pupil and it like wiggles around
2797600	2800880	And then we're gonna do that boom just like that
2802720	2806240	And then obviously we'll just add like a bit of weight to do the
2807040	2810960	Um, like highly saying that I anime eyes always have
2811920	2819280	So now we will draw on the slimes. Oh, you have lovely anime at big anime eyes gorgeous stunning, right do the half
2819520	2820560	Whoa
2820560	2824800	I made this oh, I actually made it bigger. Okay. Do the half face. It's like down here
2825520	2832240	Okay, do the eye do the eye do the eye do the eye and then she's like looking at you with her gliby eyes
2832320	2834320	Oh god, she's gonna be alien
2834640	2836640	She's got very big eyes
2837200	2839200	Very big anime eyes
2840240	2842240	Anime anime give them an anime
2843760	2847040	And then we do the accent color which is this
2847600	2851200	Pink which I've literally not put anywhere else on the design
2852000	2854800	I don't know who designed her but you've done a terrible job
2855600	2857840	Because you've not done any of that accent color. Okay
2862800	2866480	I'm like jewelry, but I'm like Azura has jewelry. I'm just recreating Azura
2867680	2870000	Pondela Buzum. No
2870000	2873040	Fondela slime are you slimy curls?
2873840	2875840	Jelsica
2876640	2878480	Jelsica
2878480	2885360	Like the silicone gel pot, you know someone said she has a pet fish in there her mascot could be swimming around inside her
2886000	2888720	Maybe she got like a little fishy in her tummy
2889600	2895520	And then she then whenever she cancels stream and she's like I've got a sore tummy is because there's a fish in her
2896240	2897440	Yeah
2897440	2899440	Come on. That's like so smart
2900320	2907440	There and then she I was so her her shtick is like she cancels streams and she go she go tummy hurt
2909040	2911040	Tummy hurt
2911440	2913440	Stream cancelled
2914720	2917360	Stream can't sit a little
2919040	2921040	Cuz fish
2921360	2923360	Yeah, there we go
2924320	2928320	Boom right there a little arrow pointing to the fish come on me
2928960	2932320	That's beautiful. Of course the first thing I see is my oh
2932800	2936000	Because everyone would shut the fuck up about a goddamn slime girl
2936480	2940160	So I give I give him so whenever someone was in the slime girl
2940160	2945520	I can be like there there she is looking all ugly and shittly designed in the corner
2945600	2952240	At least like hex had something going for her, but slimy slime magie. It just looks awful
2954320	2957760	Jella pronounced Jella. Why is it got a
2958640	2963440	Good in front of it then because that's a good. That's a good letter. Okay, you see good
2964560	2971200	Slime girls were it should be a baby shark. Oh should we give her a slime tail while we're at it might as well
2971440	2974960	Just just fucking farmer out the wazoo there
2974960	2980640	She's got a big slimy tail and she sucks you in with it and everything gets stuck to there
2981360	2986240	Can you make her more drippy and wet she's like a round wavetail
2988720	2991200	What if each item inside is related to the members of the
2994080	2996560	Wait, am I gonna do that? I am an idiot
2997200	2999600	But I'm a happy idiot. That's the main thing there
2999600	3005760	She's got a big ugly tail as well just to really emphasize. She's a slime right now. We need to deal with her freaking hair
3006080	3012640	Right slimes are always droplet shaped. So what she's got like droplet bangs
3013120	3018480	No, that's awful. Right. No bangs. You are getting big ugly forehead because I hate you so much
3020080	3022640	Right. No do what
3023840	3029920	Right, so the side bangs have to be a tear shape like that. That's that's unavoidable
3030480	3032480	Oh
3032800	3034800	Can she have
3034800	3040720	A droplet ahayio or whatever the it's not ahayio. That's the uh thing
3041360	3045200	Most of the deeper it comes in the shine of the drops looks more shiny
3045920	3049280	So you admit it dempa you two understand that I hate sleep
3050160	3052720	Just adding shine to the skin and the shadows will do a lot
3053200	3056080	If she has the soccer mom personality, you can call her ghillie
3056640	3060160	Cuz screaming jello huge drops on the side of her head
3061520	3062640	Like I
3062640	3066720	This is oh my god. Just give her a bowl cut. That's how much I hate her. Go away
3068000	3073040	I don't like you don't ever cook again. Right. What does she have though?
3074320	3076880	Would you have like a spout hair style? No
3077680	3083200	A fucking shower head look right and then what her hair would just be long and flowing. I think
3084080	3090480	There's no way it wouldn't be. Oh my god. This is she looks like jar jar bangs. No
3091920	3097360	This is even worse. How about this? Oh, right just just
3098080	3100080	Ah
3102160	3108160	This looks like jar jar fucking bangs misa slime girl misa gonna hug you
3109760	3113440	Ah, this is awful awful awful
3115680	3123600	At least hexa has something going for her like seriously look at hexa compared to slimy slime McGee. This is awful
3124560	3126560	Hair would be ocean frost
3128160	3132720	Yeah, it's not just coffee a cat a slime girl from monster misumi
3141120	3143120	I like
3143920	3145920	I got on dvd
3146000	3148800	Misa joining the via sucky. No
3149440	3155280	Right, that'll be our catchphrase and then it's over with I never have to think of a slime girl again
3156000	3158000	Was it me me?
3159520	3161520	Join
3161760	3163760	Did you say misa joiner?
3164720	3166720	V sucky
3166960	3173840	That's the catchphrase. Well, that's not catchphrase. I don't give a shit. I do not I couldn't give less of a shite
3174160	3176960	Hold on. This is a bit too close to the head of the next one
3177040	3179040	Oh
3181840	3187280	Her slime covers half of her face hiding the fact that she has a single eye swimming in her head
3188720	3192560	How does this happen? How do you create jar jar banks by accident? I don't know
3194880	3198720	Okay, so she's got cola in her thigh absolutely no detail
3198800	3204720	What's so ever going on other than a cola in the thigh a few droplets a tail that I don't it makes no sense
3205120	3210080	And for some reason when she's got fish in her stomach. So when she cancels streams
3210800	3212800	Her tummy hurts because of the fish
3213520	3219040	Another slime girl. No, you're done. And then she's fucking jar jar banks. Okay
3219680	3221680	Now that we've got that out of our system
3222480	3224160	We have
3224160	3230320	three body types remaining. We've got two lollipops and a regular schmigular joe
3230960	3233760	Why do you hate them so much? I don't hate them
3235280	3237280	I cannot
3237760	3240960	I cannot in good consciousness give a slime girl
3241600	3246160	to someone if we were to expand the team at velour
3247040	3248160	because
3248160	3249680	It's such
3249680	3254640	It's the gimmick is funny for five seconds and then no one's laughing
3256800	3261280	Give her to me all yours all yours, baby take jar jar banks
3261840	3269200	Slime slime McGee me so join a visa key. Shawnee hate manifested and the only creature she hates enough to depict that
3270880	3275280	Shawnee aren't we missing one? There's not there is no totally not mercy present
3275680	3279120	We need six girls for Jen. No, no, we just need the five because
3283440	3289120	So we've got two lollipops a regular to go so what do you need a butterfly girl
3289920	3291920	A butterfly girl
3294400	3296560	I'm indifferent to slimes and v-tubers
3296880	3303520	The only thing if an indie become slime on their own another and need to cast someone in another role jar jar gips
3303680	3305680	Oh, that's actually such a good name
3306160	3308160	jar jar
3309040	3311040	get
3313360	3317760	There's a big niche for it, but it's very specific. I just think they're cute by gay
3318480	3321760	I say here is my most goofy suggestion that I could think of
3322160	3328080	Claudia scientists that perform ethically questionable research on chat involving electrical devices
3328720	3331040	lowly white slash green slash
3334800	3336800	Wait in green
3337280	3342320	Oh, you didn't see what kind of green be you said I'm mad scientist. So I kind of feel like neon
3343520	3345360	green
3345360	3346800	what's
3346880	3348880	Kuderi, I think I know what kuderi is
3349440	3352160	But I'm just gonna look up just in case look we're in the information age
3352160	3355760	You're allowed to look up a Japanese time for a character appears to not have emotions
3356720	3360240	Oh, she's gonna have very creepy eyes if that's the case
3360720	3367120	Wait, what was it? I think I'll thank you math for the kuderi scientists
3368240	3370400	A science I'm with the science team
3371200	3372960	Okay, let's do her eye
3372960	3374960	if she's a scientist
3375920	3382720	Oh god, what's that? Oh god science symbols. I don't want the radiation one. I want like the poison one
3385760	3390400	Mmm, I'm looking online and we could do a proton technically
3392080	3397040	We could do DNA if she what can if you're saying she does unethical testing
3397600	3402800	I it's giving DNA and if you didn't know deoxyribonucleic acid
3405040	3409360	Based off the blue ghost firefly which is smaller than a grain of rice
3410240	3412880	I'll show you my grain of rice. What does that mean?
3413440	3417360	You didn't give me any iPhone. I would give the DNA sequence
3419520	3421280	Um
3421280	3424800	We could what would her accent color be red?
3426160	3428160	Like minish style
3428480	3432080	I turned myself into an animated tube a girl morty
3432640	3434640	No, don't don't
3435520	3440080	Miss morgan four armed firefly lollipop based off of the blue ghost firefly, which is small
3443360	3446080	A firefly like a red angry thing
3447040	3449040	I mean, we don't really have red
3449760	3452160	Maybe possibly plausible. Thank you for
3452720	3459520	Eating it Raven I turn myself into an anime girl. Yeah. Yeah. Yeah. Yeah. No, no, no, no, right accent color
3461520	3463520	Green and purple
3464880	3467760	Question mark green and purple and white
3470080	3472080	Yeah, yeah
3472800	3480720	Big lab coat should we do like when the arms go over I like when that when it's a lollipop and the arms like completely go over
3482320	3483520	I've not
3483520	3487600	Hmm might hold on hold on if purple is going to be the other color. We're going to connect the
3488480	3495360	DNA via the lines like that now it would probably be a bit smaller in her eyeball, but I mean, we've got it
3496160	3498160	We've got it right. Okay
3498240	3501520	Now ignoring hexa right there. Um
3505120	3507840	Lab coat that's too big
3508320	3516960	She's 19 bus 10 PhDs because she's so smart honestly, she was setting calculus at nine. What were you doing at nine years old?
3516960	3518960	That's right playing Beyblades
3519920	3523040	That's right. Green purple white familiar colors game
3524720	3526720	Strangling
3526720	3529760	I'm not purple if you were asking the new purple
3530720	3534320	Green and purple. Yes. Okay. Uh a lab coat
3534640	3535840	Oh
3535840	3540480	How the heck is it? Yeah, okay, and it's too big for her
3542000	3544800	So she'd have like sleeves that come all the way out like
3550160	3555840	Scientists oh wait, why didn't Brian you didn't read that out. How the frick do you draw a lab coat? Oh my god
3556560	3561920	I don't uh, so do you know that thing where you can imagine stuff in your head? I can't see stuff in my head
3561920	3565600	I have to like look at stuff. Thank you lorda storms for the extended membership
3565680	3571280	Scientist girl must glow like neon from experimenting on herself. She's actually a government
3571920	3573200	well
3573200	3578000	Right, so a lab coat can be open. I am tempted to do an open lab coat
3578960	3580480	and
3580480	3583840	Um, she's like really inappropriate in her conduct
3584720	3586880	I think I quite like that
3588000	3590000	So that's what you're getting
3590400	3592400	and then
3593440	3599200	She doesn't wear anything in this area, but she will wear like purple panty loons
3600560	3606000	Okay, let's let's extend that there and then we'll just go up the body
3607200	3608960	and then
3608960	3614080	You will copy this say yeah, that's right. We're getting there. Yeah, that's right. Mm-hmm. You're gonna do a bit of
