start	end	text
300000	323680	It's like oh you want to stream you're allowed to pick your stream but when you hit go live
323680	334240	you have to wait oh hi y'all everyone welcome to the stream it's me and my favorite scots
336640	340400	there are many scottish people in the world i'm her favorite thank you very much
341600	345920	morning good evening good afternoon you know how the drill you know the drill boys you know the
345920	352720	drill i wrote reeflings behave reeflings and snippet snippets we we exchanged little hands today
352720	358720	a tentacle and a hand has been exchanged for mersey and strawney are together so hello snippets
358720	368720	and hello reeflings today we're gonna play untitled goose game yeah um we are obviously
368720	373440	expo we're mlg xbox players so we're playing on controller have no idea if that makes a difference
373440	382800	to this game but that's not going to stop us at all like so um we can jump right into it
384800	391840	thank you barrels for the five i'm a barrel thank you for the five for mersey that's going
391840	399120	in or moving out fun thank you for fun we were trolling i was like you do not have to mute
399120	403280	whenever you want to say like thank you to someone who like tips you on stream or anything like that
403280	407440	you don't have to mute if anything i'll join in and say thanks because it's funny like that i find
407440	416000	it entertaining yeah i'll thank you for the 10 10 gifted members as well thank you 10 gifted members
416000	426960	thank you you did it okay okay are we jumping in are you ready yeah i'm ready i'm ready i'm ready
427760	436880	okay let's make sure which one's me which one's you i am i'm the orange one you're the red one
437840	444080	wait oh thank you why you thought automatically is that lag wait we're moving together i think
444080	451040	we're moving together whoa we are i'm not doing that wait but i am doing 360s on the spot thank you
451680	459680	eternity for the for the 20 super chat on moving out fun say less less at 30
462160	467280	wait left trigger is this because of is this because we're so mersey
468480	474640	a beautiful uh did they know you're canadian yeah yeah they know okay mersey's canadian
475600	482480	connecting to the internet but left trigger left trigger oh my god this game is lagging out
482480	487680	this game is lagging out it's not working user peaks
490480	497440	oh my god wrinkle bell jingle bell give me the boot i will take this way
498080	505040	okay oh my god wait i see you're controlling me right now when you do that oh my gosh bend down
505040	510400	to pick things up off the ground hold bend down to toes and just slide to the rhythm of the dance
510400	517520	go wow i got a can oh you're picking up later can i jump oh my god hold a it makes you zoom
518400	527840	oh my god the lag is so bad but that's not gonna stop me we are we are monsters
528640	538720	oh my god i can't get it oh my god i'm so smart right drop it oh my god oh we're so smart
540320	544000	i don't think the farmer's gonna appreciate that to be honest i'm glad oh we can oh my god
544240	550800	wings press right trigger to spread oh my god we're like little babies
553920	557840	oh my god do you hear that music too i do not hear the music what the heck
558560	565760	you don't have any game sound wait why don't i have any game sound oh no is it because i'm
566080	577040	um no no no is it give me a second okay i think you should hear ambience i can stream it to you
577040	583200	via discord so you have any game sound i think my volume for the game is just low because i can hear
583200	594720	it but it's very shiny someone's asking a goose for goose girl for gen two absolutely no no um i
594720	602560	will reject your suggestions for gen two live don't think i won't i why don't i have sounds
603440	612560	i don't i i can share on this guild if you want and then i think i'll be like behind them possibly
612560	618560	i mean we can try and see what happens this is a terrible idea if i share no goose girl no slime
618560	625600	girl wow they're so sad i don't everyone wants slain girl am i missing some also share application
625600	632480	audio yes go live right check out discord and see if you can hear okay okay okay
637360	644240	oh on mouse is actually a lot easier oh i can't believe it i won't use mouse i'm an xbox gamer
645200	653440	you know hold on let me hear me honking why can't i hear it is it my is it me
654400	662400	that's come by the problem hold on hold on i got this i got this maybe my god there's
662400	667040	i'm good it's a scottish game can't believe we're in scotland there's tartan down in the bottom corner
668400	673840	okay i think mercy's controller is registering as both players if you're using remote play
673920	680000	that's hilarious because i can still control me but mercy can control both of us how in
680000	686880	lore friendly is that yes mercy you can control me at any time oh my gosh oh wait no i'm siren
686880	691040	wait a minute yeah apparently your controller input is changing into mine i'm the one that's
691040	697120	supposed to be hypnotizing you here what the heck the lore the lore i've been i have no idea why it's
697120	706560	not what is the shade on dish cold stream paused swap your application to continue strumming
712000	716560	oh hold on i need to go into my steam settings
716560	724400	oh no it's me mercy it's me sniff snifflings snifflings
726320	732080	the snifflings must wait as we are we are we are doing make it double prepare for
732080	735680	trouble someone says prepare everyone says prepare for trouble and make it double
736480	741280	strongy thank you iron reaper for the 25 dollar tippy with
741280	749200	did you see that yeah 25 as well yeah like a oh my god protect the wearer from devastation
754800	761200	i'm so sorry right hold on it's me it's me it's me i'm fucking up the game
761200	772880	i'm done it's okay enable advanced host options i play audio okay and if i wait how about now
774000	780960	you hear something now or don't you isn't going through my freaking i'm worried it's going through my
780960	789840	my um my your headset my my controller your controller can talk
791600	799280	bye strongy thank you for the super chat 20 super chat moving out fun towel but i
799280	808000	move these funds over to my darling kohai thank you wow i think oh my gosh i'm so i'm so
808880	817440	what's what's the words they used to say in the day pega oh pega yes i don't know where you're
817440	821360	going with that right okay i can close that because that doesn't look right okay it says i
821360	827120	am streaming the remote play audio to you now whether or not that's true or not maybe a fib or
827120	837920	you know that you're senpai senpai i'm a little goosling short thank you peonish for the i don't
837920	848400	know what this currency is id r id r id r i don't know what the dominican republic
850400	856240	wait what i don't know don't forget that's when you move to kibak at tabernac
856960	861760	oh tabernac kubacos kubacos kubac
862480	867920	mersey and emi were making fun of me for the way i say kubac and i'm like i say kubac kubac
867920	874240	sweet yeah when i say how it spell i say kubac okay for some reason the volume's just not working
874240	885600	on my end it's kind of weird okay and the and the stream i mean i was going to say we can play
885600	891760	power washer but mersey gets first person motion sick so we actually can't quite play power washer
891760	903840	the way others might this danie reset reset are we lobby i have no idea i have streamed the game
903840	908400	audio to you so i don't know why your discord discord can't hear the audio as well my discord
908400	917600	can't hear the audio and oh i the monitor sound is as high as it can and if it if i make it any higher
917600	925440	you're going to you're going to sound a lot i'm going to be a bit too much now don't get me wrong
927200	934640	i do appreciate stop streaming simply turn turn on webcam i said turn on webcam i don't think mersey
934640	941280	wants to see that first thing in the morning i'm going to be honest um if i can move this up maybe
941280	947440	you know i wish there was a way to like separate audio between like this i actually like the voice
947440	953440	caller you totally didn't notice that oh i totally didn't notice that's actually because i fucked up
954160	961520	right untill this game also share application audio yes at mersey right go live and then go on
961520	965680	discord and open up that stream that i've just given you if that does not give you the audio i
965680	978560	am stumped for what we're supposed to do okay oh i can hear it can senpai's hear that it might be a
978560	992720	little low i heard it it's such a quiet honk oh boy you can hear moe quonk okay hold on let me
993680	997360	wait if it's too quiet i wonder why it's too quiet
1001040	1005840	how about that how about that it's still quiet but it's here they said it's a little low
1009520	1017440	the tiniest honk oh no i can't move my volume any any higher either that's the problem
1017440	1019760	um maybe if i can move the monitor sound up
1022400	1030640	i mean i could do it one more time one more time needs to celebrate i can
1031280	1042000	okay do you hear that bell i heard a bell the tolling bell is coming for us
1045200	1052320	okay yeah input for some reason mersey can also control me in the game i don't i don't know how
1052400	1054400	you've managed that but we have
1056480	1062800	bike i took control i can literally i can retake control of myself if i want but every
1062800	1070240	time you move i'm fighting against you in your pool yandere like holy crap you've literally
1070240	1075600	main broken me to do thy bidding and i'm not supposed to be the hypnosis here everywhere
1075600	1081520	we're supposed to play under these conditions quick let's make a heart with our with our beats i
1081520	1084240	don't know uh i can face you like this
1090880	1094560	i forgot about the honk again x oh wait
1099840	1105040	right we've completely forgotten wait there is a picnic down here it looked like uh scotland
1105680	1111520	look it's scotland oh oh wait our wings are up because the things were going to war but we're not
1112320	1118560	oh i don't know what your your your anthem is oh my god let's give it a huggy little hug huggy
1120720	1124080	i can't really hug you because every time you move towards me it pushes me away from you
1125120	1131280	because of the controls her powers of attraction with our wings out we literally look like wait
1131280	1139440	you control my wings as well my i copy everything how have we done this i have no idea i don't
1139440	1143840	think i've ever seen this girl work it is this what is supposed to happen
1145920	1151280	i'm playing with an extra challenge oh this i have no idea what this game is about by the way
1152000	1160880	so this will be interesting b is to open stuff so oh my gosh nate thank you for the gift of 10
1160880	1166240	holy crap thank you oh mercy is discovering i appreciate that ned but you're supposed to
1166240	1170560	give it to mercy because she's moving out stuff stuff oh my god we're doing gardening
1171440	1180640	gardening hold left one for as amount oh there's a man across the wall do you see him yeah yeah yeah
1180640	1188960	can i can i jump can we are you gonna you want to put the water on yeah wait why is he coming out
1188960	1198000	to us we're getting jumped we're getting jumped right can we open up this fence ah shit no is logged
1198000	1208560	from the other side wait can geese no fly what's going on here oh i keep mo you push me into the
1208560	1215360	secret you push me into the hedge secret i don't know how you did that but i'm so good i didn't know
1215360	1221200	i could do it i'm literally i'm not good control this is amazing
1224080	1227760	i'm i'm gonna jump them i'm jumping them
1230080	1236000	why no no no no leave leave mercy alone she's discovering a box she's not
1236160	1238640	playable
1249680	1254480	okay okay but where are we supposed to put the keys i don't know oh i guess we just run with the keys
1255600	1259600	i mean wait how do we know what that checklist is i saw stuff oh my god i'm fighting against
1259600	1265920	mercy so much right now trying to control myself again oh this is a problem on purpose
1267360	1271120	be be be oh i'm getting jumped he's jumping me he's jumping us
1271920	1277040	we got it we got it you got it okay let's run i'm going i'm going i don't know i'm gonna go back to
1277040	1285520	the fence yeah get through the fence right is this oh get to the fence oh okay success
1286400	1291520	how or what do we do with the is my question oh we cause problems on purpose
1294640	1303360	okay now we take it uh where oh make the groundskeeper wear his sun hat okay
1304240	1310960	right where did i say rake in the lake all right have a picnic okay we can do that rake in a lake
1310960	1316480	yeah okay we can do that right uh i is there a rake in the garden yeah there is
1317360	1325040	oh wait is maybe the key is for the fence that was over here don't you dare use that to trap me you fool
1326400	1330800	he wouldn't do that is he a mean i don't think he's me oh the gate's already open where the heck is
1330800	1340800	a rake oh there's the rake you've got it how did i pick up again a b b b b if we're going
1340800	1352640	for a pic yeah b like press left trigger b left trigger b trigger b yeah i'm stealing the goods
1352640	1360720	i got the i got the goods for the picnic don't worry get the foods on me no no no leave mercy alone
1360720	1366000	she's almost gone give me the color give me this no leave
1367120	1375280	i'm totally fighting against i'm fighting against i mean just have things that it's still i leave my
1375280	1381280	mercy alone wait no no there's the i don't think you can get it i think you have to push it through
1381520	1386000	the oh i'm now just following you out this what i'm stuck
1390400	1398240	okay the game is there's a there's a there's a gate here that you can pull it from
1398240	1403440	i don't think we can do it through the fence we must be wise we must be oh so smart now i'm stuck
1403440	1410640	in there i'm stuck in there oh thank you he saw tall for the 50 super didn't catch the bit about
1410640	1415520	moving out at the start i was afk but this should be good for moving out money right thank you so much
1415520	1424560	yeah give me this give me the right wait is that actually stuck wait wait can he pick it up
1424560	1430480	oh can you pick up the ring can you pick up okay thank goodness whoa whoa he pushed you through
1430480	1436240	right okay that's good there's a gate down here i assume we grab the i like how he's just watching
1436240	1442000	this cause me he made him but he's like happy to just let us go by he's like what if these kids
1442960	1448320	how do we can we open that yeah i was gonna say can you reach up and open that or is it no open it
1448320	1458880	for us open for us oops this there's a hammer on top of the wall that seems dangerous actually
1458880	1466160	wait maybe we can go on this chair yeah let me move this chair over if i if i fight the tide
1466720	1472720	i'm fighting the i'm so strong no the chair doesn't move okay okay maybe you can go on the chair
1474320	1480560	i don't think we have the ability to jump we can open our wings but it's the best i can do
1480560	1486080	i can open my wings you get through the gate by doing the tasks on the list oh my god okay so
1486160	1497440	we're region locked right now okay okay okay we got it i am hey cannot believe i somehow managed
1497440	1502960	to get your controller input oh okay we pull it out here got it got it you gotta get yes we gotta
1502960	1508240	get the the rake where is it i don't see him right we're grabbing it let's go let's get the heck out
1508240	1514720	here okay come come come this way this way this way uh you can pull me you can like pull us both
1515440	1521920	yeah yeah remember you can pull me oh no oh no he's like right there no no no no it's not
1521920	1527280	what it looks like it's not what it looks like give me that rake it's not it's not what it looks
1527280	1533280	like sir stop stop but i demand by the in the name of the okay guys here get the rake get the rake
1533280	1540400	get the rake get the rake you can do it left trigger b left trigger b push me down push me down
1540400	1547920	nice no give me that let's leave it no don't you close that gate we need to open give me that
1549600	1554400	give me it oh there's lots about his own garden right drop the gate you don't need it
1554400	1561840	give me this you don't need it and you don't have keys now what like let go i will let me go
1562480	1568480	yeah yeah yeah yes right oh yes yes yes you want it so badly don't you yes you do yes you want it
1568480	1578560	so badly no okay wait wait wait wait no give me the rake take that fertilizer mercy pick up pick up
1578560	1587440	i'm trying i'm trying right yeah yeah oh sugar i'm so gonna get out the way get out the way
1588960	1597040	why are we so coordinated okay we made progress we made progress i'll take it okay let me pick up
1597040	1603040	this fertilizer oh my god it's because of the input wait if i disconnect if i disconnect my controller
1603040	1609920	is it gonna oh i don't want to reset i i don't want to actually reset us no don't go in
1611360	1616400	oh i'm gonna drop the sandwich how do i drop it oh there you go yeah yeah we need to do a picnic
1616400	1621680	right yes right drop the rake yes you care so much about this that's good i don't care about it leave
1621680	1629840	me alone okay if you get the rake i'll pick up the fertilizer if i can fight against it wait let me
1629920	1635920	put the fertilizer in my mouth okay i'm holding the fertilizer he should come to me now you pick
1635920	1641360	up the rake you pick up the rake you can do it you can do it yeah shove in the lake get that rake
1641360	1651360	in the lake get that rake in the lake he takes it off me so quickly oh okay we're doing it we're
1651360	1667840	doing it we're doing it oh hello yes yes yes yes yes yes yeah easy easy if you make the other
1667840	1674480	player player one that should fix it um i actually it took us quite a miracle to get into this game
1674480	1681360	not gonna lie uh i might just let mercy control me and open my wings i will take where the wind
1681360	1691920	glides me the wind is gliding me to this gate i hopefully i'll be fixed um in the next round is
1691920	1699920	it rounds i don't even know how many maps there are okay let's see if i can help out here uh our
1700000	1707360	foods how much do we need for the game to oh i missed it's okay take it in
1709920	1716240	that wasn't it bring to the picnic a pumpkin a carrot jam tomato radio
1718800	1722240	oh there i was gonna say i was like nah that doesn't look like a tomato to me
1723120	1727440	right do we need to go through the fence we do we'll probably have to go through the
1727520	1733920	the tiny little thing again there's only one map this game was so expensive and you're telling me
1733920	1741280	there was one map we love causing problems on purpose all right all right i'm in a better
1741280	1748400	hunker i said it uh these are the cabbages right was that a pumpkin i thought it was a pumpkin
1749840	1753120	do we need pumpkins or cabbages i'm gonna grab this one
1753440	1762080	okay i got it no i don't want to let the farmer back in
1764400	1765760	see if you can go through the thing
1768400	1772880	so the gate himself oh he just opened the gate okay
1775520	1777920	wait can we not be off screen at the same time
1778880	1785280	oh wow we can oh i didn't realize i'm pushing you off the screen and you're it's okay i'm
1785280	1790720	following you there you go okay yes we need pumpkin i don't know if there's like jam in the
1790720	1797440	garden somewhere i need probably but you got the pumpkin uh yes we can mark pumpkin off the
1797440	1802560	what is this a monument i'm at oh it is a monument it's like a little shrine oh wow okay the gate
1802560	1807040	was open i did not have to go all of that way but uh do you want to pick up a carrot while you're
1807040	1813120	there we needed a carrot for the the i want to kill it yeah are we kill it i want to kill it let
1814080	1817040	hello let's trigger me yeah that's it let's trigger me
1819120	1824160	it's probably i'm not gonna lie we're probably ice skating as well on top because of the lag
1824160	1830240	wait he took the carrot off of you he took the carrot off me what a bastard share your garden with me
1830560	1834240	i literally there's always enough for both the
1836560	1840000	i'm not gonna have to distract him i think i am hold on let me get this one
1848880	1854080	give us the carrot give us the carrot give it back it's not yours
1855040	1858880	oh i got it i got it i got it i'm stuck in the lawnmower wait
1861200	1866880	grab the carrot no no pick it up oh my god no i'm getting manually over read by the freaking input
1870720	1877680	i'm stuck i'm stuck i'm stuck no no give it back give it back you smell give it back that's mine
1878640	1881440	look if it goes on the picnic thing then it's mine
1886480	1891280	literally oh i see the jam gosh can we even reach that
1895280	1896960	i will flood your garden now
1899520	1903600	and i would oh no he's going for the pumpkin leave the pumpkin out of this
1903600	1906640	you have goose in your garden oh no no no you're not alone
1907680	1910080	right well if you're gonna do that at least give me the
1912560	1913760	need the carrot
1915760	1916800	i took his head
1916800	1920080	oh no i have terrible news i think we're actually gonna have to reset
1920080	1922640	i don't think i can play with these controls
1924480	1926960	okay it's okay i'm willing to reset
1928080	1932160	yes okay we can probably speedrun this to be honest i have no idea
1932240	1935920	so hold on i'm gonna hide my game just in case i show anything that shit i'm not
1935920	1938720	i need to hide my game input uh
1940240	1944400	if i quit and then invite you on local co-op that should work right sure
1944960	1953600	i'm gonna hide my game too just in case my game capture now sometimes can't can't you can't see
1955120	1959040	do funny things oh you've done mouse and keyboard did you mean to do that
1959120	1963120	wait no that was me that did that was you it was yes it was me i was like
1963120	1965920	hmm you did that so fast mercy i don't remember inviting you hmm
1967120	1970800	i think it's because we're still there are you still in this instance
1970800	1972240	or did i need to send you a new instance
1974880	1982160	no that was you that was that was you okay i think it should be fine now
1983040	1985360	okay hold on all right you move around
1986320	1991760	and let's get out of this bush first oh yeah they are blind hold on what
1992720	1998400	dream capture gooski i will wow how bizarre
2001040	2002800	wait is this like is this a bug
2005760	2009840	how strange right i'm just going to do mouse and keyboard give me one more shot mercy one more
2009840	2016400	shot okay one more shot give me one more chance i will do mouse and keyboard and because i think
2016400	2022400	that's what's clashing for some random reason take that out i don't need that in my pc
2023600	2029280	okay begin two player i would like to use mouse and keyboard and i will use i may use controller
2031440	2038160	okay we did it you need to probably swap who player one is i was player one last time i think
2040320	2044880	okay space bar is honk i mean you need to quickly relearn all of the
2047680	2054240	maybe are we the only one's an experience to ever have this bug before
2054240	2058960	this is crazy oh my god game literally unplayable do you think i can get a refund
2061840	2068480	how right how did i make you am i am i one more powerful give me literally give me one more chance
2068480	2075200	i'm on my knees give me one more chance is all i ask can you okay another suggestion was to start
2075200	2081360	you go first controller off and then join in okay we're trying we're trying okay
2084720	2091760	controller off join in this is the most bizarre there's only two of us and you want to get them
2091760	2099600	get them boys take that man's carrots right now okay i mean okay your game controller
2099600	2105680	i will do mouse and keyboard i will play it safe i am on mouse and keyboard mercy is player one
2105680	2119840	as evidence by oh i'm the red one now okay use the mouse wait to click are we are we
2119840	2126800	separate people now i think we are i'm separate okay we can actually cause some mayhem let's go
2126800	2131120	press control yeah okay i've played college before you don't have to tell me to us
2137360	2139440	okay we can actually play now
2141520	2149600	only took us 30 minutes to be able to play but now we are unstoppable literally
2149840	2164240	uh head uh oh wait it's not like wasd i keep accidentally like zooming in and out like really
2164240	2164960	dramatically
2167840	2174320	kiss time kiss time we love troubles and oh you guys are blind sorry i forgot you guys are
2174320	2180000	blind sorry sorry it was just straight up playing the game without you guys seeing sorry
2180720	2190240	i love scrawny cuddles i feel like they're so clumsy who's the porno stuff them all
2190800	2198400	mirror mirror on the wall who is the one of them all he will sell the picnic for a
2198720	2202880	that i actually i'm inclined to believe that's true that mercy is the point is that it was all
2202880	2209680	but i think that's adorable i mean come on a dorky and dairy this pond how are you supposed to
2209680	2215440	how are you supposed to resist yeah how are you supposed to resist senpai exactly
