start	end	text
2217680	2226080	what kind of signage is it's got green on it please serve my venus sandwich yeah okay there we go
2226080	2232240	i hope there's no mayonnaise in this i'm allergic well yeah you can't have eggs like any kind of egg
2233440	2241360	primarily how do you have none of the cloth here too wait come back come back no not you i mean me
2245040	2252400	oops i made him wet okay so we have to make them wet okay this must be the radio so i'm
2252400	2265120	gonna grab that we need it yeah at the picnic thing oh may i yes oh if i had aim bought i oh i keep
2265120	2271920	doing wasd it's not w i'm having a stroke it's not wasd i need to take my fingers off the keys
2272640	2282160	right uh crouch yes we got it wait it distracts him wow yeah unlock that gate
2284000	2288240	oh that range honk stop making noise little thing
2290640	2297440	stop making noise it's gonna give it away i don't oh no why did i pick the heart well maybe we
2297440	2302080	can grab the jam or something while we're at it hold on let's grab the jam let's grab the jam
2302080	2306560	or key or carrots or anything right jam jam jam jam it was like up here right here
2307920	2317760	give me a can you reach i'm tiny when y'all i can grab this i feel like he's gonna notice me
2317760	2325760	grabbing such a lot yeah he's gonna see me grab the carrot first though hey well let's get the carrot
2325760	2329360	first any progress is good progress you take the carrot i'll see if i can grab a pumpkin
2333440	2338960	where am i where am i oh i lost myself there we go come on come on i've got the pumpkin
2340720	2343520	this is freaking much more than the hell
2346240	2347840	we didn't need any back
2347840	2355520	okay this game is not easy it's really not easy this is kind of hard to control
2356160	2362160	i'm literally having a stroke right now i'm like keep using wasd but it's for freaking
2362160	2369040	zooming in and out for some reason right you got the carrot i need his keys give me them keys
2369440	2375840	oh no you took it off wait how did you take it off me i just grabbed them
2378240	2384320	this is so hard to control me oh hold on let me see what's going on over here
2385280	2390960	i'm trying to get the thermals there we go oh you want to look at me no no no you want to
2390960	2396880	look at me no no no leave leave me alone i'm so freaking slow at this game leave her alone leave
2396880	2402080	her alone leave her alone leave her alone give me your leave me your own nope you don't want the
2402080	2408640	thermals oh sorry i'm i'm going to not something else yeah wait he let me join the keys yeah
2409360	2414080	get out get out get out get out oh this is so hard hold on hold on i can't move
2416160	2421760	i'm missing the door door the impossible door's done door's done
2422480	2429920	uh where'd i put the keys i don't even know i'll put them by the gate why not put them like
2429920	2437600	way over here so if he does come out he goes like right here yeah what do you mean what
2438720	2444960	what do you mean sam pie you're like mercy come on oh no he noticed it quick grab something else
2445840	2451840	wait he's gonna go all the way to it wait do we need to fill up the water can for him no give
2451840	2457520	me the water can't look i can fill up the water can for you look it's like teamwork come on we love
2457520	2469520	after we love after culture oh oh wait whoa i got the job i got the job picking up picking up picking
2470240	2476560	oh and i'm completely messing it up oh my god i forgot about the ring oh
2481120	2488560	i got the job no no i got it oh god he's coming he's coming no i'm locked out because of the
2488560	2496400	freaking render distance no no sir sir give me the jam you want me no no sir i'll grab something
2496400	2503760	else we'll grab something else hold on hi yeah you know we need it for a picnic you don't understand
2504640	2510560	i can't i can't speak human language i can only hold violently just give me the job honestly if a
2510560	2513920	bird you're here oh no oh no i'm trying
2525760	2533840	leave me to the job right we'll do the rake maybe the rake in the lake yeah we've
2533840	2542560	been the rake in the lake why that's my radio pick up pick up the jam why is the jam not
2544160	2553120	why is the rum always gone why is it was a mistake it's not really thievery if you don't
2553120	2559520	need it you wouldn't know is it gone you can always get a new one honk violently does it just
2559520	2566560	stun lock them if you honk grab the jam i got it i got it i got it i'm out i'm out i'm out i'm out
2566560	2576240	we're freedom yeah freedom okay uh i can't go you getting pushed off of it while he's holding it
2576960	2585280	oh my god we did it we actually got the jam we got the jam like a billion other things to do
2585840	2596400	so one was like it's one map apparently but there's five sections i have no idea if i'm smart
2596400	2603040	enough to do all five sections um but we could try what smartness do we need we have like
2604080	2610560	brains the size of i don't know like a peanut what do we oh sorry what does it say have a picnic
2610560	2616880	rake in the lake we just need our radio okay if we need to rake in the lake then don't mind me
2616880	2620240	i'm grabbing this excuse me uh you'd come over me
2622720	2627680	uh excuse me sir sorry excuse me uh have you thought about maybe not
2632960	2638080	i love the honk feature sir please have you considered the radio no
2641120	2647760	okay can i escape like this no stop standing leave
2650160	2655600	this is impossible sure i'm sure there's like a speed run strategy and someone's like done it in
2655600	2661360	like 18 minutes flat nothing else i think we're it's because we're having problems with the controls
2663280	2667440	oh i mean progress progress the rake is getting closer to the lake nope stop it
2667520	2673920	stop it i want the rake give me the rake don't you shoot me away give me the rake here here i
2673920	2682480	distract him oh i got it i got it no my radio ah this definitely should be a split screen game
2682480	2688320	because i literally cannot progress until you come right game devs that's a point down game devs
2688880	2695520	for not letting me uh co-op player progress we got we got it we got it and then okay he's not
2695520	2704240	chasing after us so we're safe there we go and last but oh can i release yes please uh last but
2704240	2711680	certainly not least the radio now if i just honk at him and distract him
2714080	2721600	all right now uh hello i am mr goose i would like to teach you all those things about geese
2721600	2728800	did you know that geese are very good people and we are not stealing your large container at all
2728800	2736000	behind me please do not look behind me um i don't need your radio or you got the radio no no no no
2736640	2740800	there's no no there's no radio please listen to me thank you for listening to my so conversations
2740800	2745840	about geese did you know that we're actually very good avian birds and that um our feet our feet
2745840	2750240	actually transformed into flippers to help with us glading when it comes to the war um
2750400	2759120	you know we have we have we have we have we have we have we have corkscrews corkscrews please
2759120	2764000	let me teach you about the corkscrews sir oh please it's really important
2765920	2770640	okay okay yes yes look at me look at me look at me look at me yes yes yes yes right come on
2771760	2778320	left trigger b to pick up the radio i'm out i'm picking up the door please listen to my corkscrew
2778320	2785600	rent so did you know that uh female ducks unfortunately um in when it comes to nature when
2785600	2789680	it comes to nature sir please just a moment of your time when it comes to nature when it comes to
2789680	2795840	nature um female ducks actually can't um you know reject unfortunately because of the dog eat dog
2796560	2801120	okay thank you for your time goodbye we did it we did it we did it
2804000	2811120	we can enjoy your picnic together oh we can do what you have in first to eat
2812400	2819200	i think i'm gonna have uh the pumpkin your pumpkin uh i'm gonna have good jam and bread
2819200	2828080	is that actually bagpipes
2830160	2835360	kind of sounds like a big oh wait i can hear the snare drum and the drone which makes me
2835360	2845040	think this is genuinely bagpipe music oh no oh no this can't be it is oh well we completed our
2845040	2851280	objective whoa sorry sorry that was me make the ground keeper hammer his thumb
2852560	2861280	what oh um well well we had our little picnic yeah um i'm not sure how we do that
2862320	2869360	and we waddled away waddle waddle till the very next part of the mission bomb bomb bomb
2870320	2874720	the geese walked up to the gardener's garden and they said to the man
2874720	2880720	want to learn about cork screws hey bum bum bum let us steal your well no geese sign
2882160	2889280	hey you said no geese this is geesist yeah this is geesist how do i make him hammer his thumb
2890480	2896240	i'm not sure anyways i'm gonna do some guiding now it's my garden it's our garden
2896240	2901920	oh are you starting a farm yeah what would you grow what would you grow i must
2902640	2904560	grow strawberries because they're easy
2906560	2910400	how do we get him he's not hammering did we just watch him do what he wants to do
2914320	2921440	he's not hammering anything oh maybe he's gonna hammer the sign where would i if i was a mean
2921440	2924960	farmer where would i put the sign yeah where are you gonna put it show me
2927040	2935760	yeah where are you gonna put it man are you gonna put it you got shows oh oh okay he's getting the
2935760	2940240	hammer next so i need to get out of the way excuse me sorry i'll get out of the way i guess when
2940240	2946720	we have her's just honk get ready steady
2951040	2955360	oh no no okay okay we wait ready
2958800	2966480	yes okay okay that makes sense that makes sense yeah whoa we made a pass out are you okay
2967440	2976640	okay we're free we're free we're the now now we're we're we're in other territory
2978320	2982320	the tutorial is finished we are now actually exploring the game
2983120	2987280	wow this must this must be when we become menaces to society
2989200	2995680	we have to smart every every project starts small scale we have terrorized a per grandpa and
2995680	3000480	is retirement and brought close to a heart attack by raising his blood pressure significantly
3000480	3004880	and now we will do it to the masses oh hello football
3006080	3014640	oh my gosh tv let me in come on england honk honk please let's we have we have human
3014640	3019920	monies come to the door there is a person inside there we would like to spend our human
3020480	3025600	wealth on you are totally human money here yes it's sort of not leave something together
3028480	3033920	i found a weapon oh hello lady oh you don't seem very nice with that hey
3036400	3043920	why wow some people aren't nice to nature oh my gosh why are we why are we why are we
3043920	3051040	disliked so much wait what's on the list oh whoa break the room that's a lot
3052240	3059600	break the broom trap a boy in a phone booth what the i mean make the boy wear the wrong
3059600	3067200	glasses make someone buy back their own item get on tv get on tv and go shopping put in the basket
3067200	3076960	a toothbrush loo roll her um airbrush food cleaner fruits and veggies wow that's so much
3078160	3083680	they are i'm walking here hey i'm walking here i can hear uh how do i make
3085040	3092800	ah she like okay she completely throws you out of the area so uh there's something over here
3092800	3101760	oh no not again oh my god there's like a cute look whoa what you got there a garbage are you littering
3102480	3108480	yeah you can get oh there's apple cores there's the toothbrush right
3110000	3118160	wait you're right ooh we have to buy a new toothbrush oh i guess well i guess it's recycled
3118160	3126560	at this point then it's not used we we love environment uh i guess back at her shop if we're
3126560	3130480	supposed to buy it i don't want to put it too close to her shop in case she puts it somewhere
3131440	3139600	oh she's so nasty up there this basket no that ain't it i must be where you are
3140480	3145920	lady i get it you don't want oh that's the that's definitely a basket i don't know what they look
3146640	3156000	right oh no yeah okay this is an airplane what with an air is an airplane on the list sorry hold on
3156880	3162880	yeah sorry sorry me bad me bad airplane uh loo roll her brush tin food cleaner fruit and veg
3162880	3168800	no okay that's definitely not it is that the boy are we uh excuse me we're here to lock you inside
3168800	3178320	a phone booth oh no he's scared of us get in the phone booth get in the phone booth get in the phone
3178320	3185920	booth get in the phone booth yes there we go now we trap him inside there uh how do we trap him
3186960	3190800	oh that was it oh my god he's calling for help for his parents oh i feel really bad
3191760	3197440	oh wait his dad is right there oh wait right running when he comes out i guess
3198480	3211440	oh i love tv let me in let me in oh we both got chased out right oh what's going on in here
3211440	3219200	get on tv i'm honking i'm honking oh wait there's a button there's a button to the left of the
3219200	3228160	window do you see it okay i'll push it oh i'm trying i'm trying oh my goodness camera he's killing me
3228160	3240480	it's killing me get it get it get it get it get it oh you're going oh we're on tv oh it's us there's
3240960	3248080	oh my god we're featuring in the game my name is oh my god your face is right up to the camera
3248880	3255680	oh my god no okay we got chased out it's fine but we did what we needed to do we did it to to enemy girl
3255680	3264160	bully per child honestly oh he's bullying poor poor british child why do you see british because
3264160	3269920	it looks like a wimp oh i guess i don't know i think british are the only people that say lu paper
3270000	3276640	right oh oh yeah you're right this is a british game all right someone's to buy the wrong glasses
3276640	3286240	or something i don't know i'm gonna have to wear the wrong glasses let me take your stuff oh okay okay
3288880	3295200	yeah yeah yeah leave me alone mersey's cooking okay i got it let me see
3295920	3302480	oh no is she gonna see it oh i don't want i don't want her to see it give me those
3305280	3311920	i don't know what to do i think she's gonna see it oh wait if you put the glasses where his toy is
3312560	3319760	wait why do i want him to chase me that's his toy i don't yeah he's got a toy on the bench i want
3319760	3321600	do you put glasses on the bench
3324960	3331360	what a confusing game i have to admit i'm i'm a rather confused i don't know i like chaos
3332800	3335680	how do i how do i take glasses off of a child
3338560	3345280	you put it where the toy is oh no oh no she's not no you're not supposed to see that she took it
3345280	3351680	oh she took my glasses wait so she doesn't see the wait she needs her broom how do i make her
3351680	3361920	break her broom i don't know thank you anonymous i probably should have showed you that i was panicking
3361920	3366400	oh i've just crossed off the game oh right let's not do that again that was a bad choice
3367360	3371280	right release thank you lord yeah yeah rick i wonder what happens to the cage when some
3371600	3378400	move out of their cage when mercy moves out uh we gotta make some room right cage and have a leak
3379520	3384080	okay this is literal i guess they put it in this basket or is she gonna like be region
3386080	3392320	it's fine oh there's plants here this is so cute what else do we need the hairbrush
3393280	3404720	oh i i can't remember i can't remember oh oh i see i see why am i you can grab her broom like
3404720	3412800	the back of it wait can we rip it apart i think we can hold on let me get behind her all right
3413760	3418640	give me that broom give me that i think you'll fight you for it
3419600	3423440	like i know you ain't that strong you've been you in retail i know how
3425040	3428480	yes give me that broom that's what i think about your broom you lady
3431120	3437280	getting so good this game is an australian game in melbourne but you terrorize an english
3437280	3441840	village oh sugar we need the hairbrush and i just completely forgot and i had the perfect
3441840	3446160	opportunity to grab it because i was reading chat oopsies honest mistake honest mistake
3446160	3451200	don't poke us with a stick like what's going on here uh sorry i don't know do we
3451760	3456960	buy oh she's fixing the broom wait he just put his glasses back on
3459840	3464880	how do you put it back on why is she she's pushing me away by her aura alone
3468400	3476000	uh right so she's gonna fix the broom that's fine how do i make the child where the wrong
3476000	3481200	glasses i mean the glasses are there actually she never took the glasses back
3483280	3488560	so child do you drop the glasses if we scare you enough
3490480	3498400	no what are you doing young child i tried to which we demand you wear new glasses right now
3498720	3508240	you were giving the gift of sight oh literally it was i'm i think we're missing some sort of
3508240	3515040	timed event on him oops oh i remember how to put the glasses on him you gotta go for his shoe laces
3516080	3523440	hold on a minute enemy spotted target spotted we need to go for his shoe laces oh no those are
3523440	3528640	glicks oops sorry i just picked up the glicks i did it wait and then what we push and then we
3528640	3535600	take his glasses and give them and give them the new ones okay i comprehend all right okay the
3535600	3542320	glasses are now in the way he should look for yes yes can you give him those glasses
3542880	3554720	and then drop it in front of him yes oh we did it thank you refling we love getting our hands
3559760	3567280	okay you look better in that one anyways yeah this is red uh we need to make someone buy back
3567280	3574960	their own stuff wait did i not put loo paper in that basket airbrush in the basket loo paper
3574960	3582160	we did put in wait so red just she took it man i was trying to buy that what
3584400	3590400	she took it that's why give us give us it back what's this here i'll distract her
3591280	3596080	how did she see that she got eyes on the back of her head
3597200	3599840	like i'm just trying to support your small but local business
3600720	3603440	so then who it says we're supposed to sell someone it
3607840	3613760	oh maybe we take his plane and we put it back and you'll buy it yeah and he'll buy it maybe
3614720	3621440	hey i like that theory oh everyone everyone calm down
3624480	3631120	uh oh yeah yeah yeah you're right you're right you're right oh ah sugar ah no no no no no no no
3631120	3633040	she's not done yet she's not placed it done
3633040	3644320	wait is she gonna serve him she is i think you did it oh my god you did it right well
3644320	3651280	sir having a conversation uh i'm gonna go yank a leak because we need some veggies uh don't mind
3651280	3660560	me just waddling off yeah oh no the carcass he actually did fire i feel so bad i feel bad but
3660560	3666560	also not honk yeah i knew to do this has been added
3673200	3681120	why is the music so intense oh my god honk honk honk honk honk yonk yonk i'm stuck on the edge
3682000	3687840	i can't fit it all in the
3691120	3696400	i'm running laps around no how can you even notice she's picked something up i'm trying
3696400	3700640	to explain to you i need this tomato and you're being so rude about it you are you honestly are
3702080	3707360	all right what do we actually need go shopping tinned food a cleaner and a hair brush
3708320	3711840	trap the shopkeeper in the garage where's the garage
3714640	3719440	oh yeah you said garage don't you wait why what happens if wait she's going in the garage now
3719440	3727760	how do i trap her in honker oh oh we pull it down we pull it down oh no i was oh no
3728000	3728560	oh no
3731440	3735520	help me lady i'm stuck in your game i'm in the garage mate
3738720	3744880	uh lady question mark are you gonna come save me have i just soft locked us because of my
3747840	3752960	i'm just trying to i communicate sir that i'm stuck in here there's no way i did that
3753600	3758000	the the the objective get her stuck in it me instantly get stuck in it
3759120	3762800	is she gonna hear me can she hear me maybe oh is that the
3766240	3771200	is there something in here it's a zoom to get the camera's attention um
3773360	3775200	oh she does come and save me okay
3777840	3780400	thank goodness because please help me
3783680	3793120	okay wait until she gets inside hello come in come in come in into my secret layer hello
3793120	3797440	i am goosey my goose face i'm no no no no come in come in come in come in come in
3798880	3801200	wait unless i steal an item and run in with it
3804080	3806560	hold on hold on wait you're not coming
3806960	3813760	no i never picked it up no give it back right give me the leak
3819040	3823520	come into the garage lady come into the garage
3825360	3829200	chase me into the garage no i dropped it no i dropped the freaking thing
3836560	3846560	hard okay oh right i don't think i can get her stuck inside um what do you want
3847680	3856240	if i get her stuck inside does she reverse kidnapping hoisted hoisted by yours okay how
3858800	3862640	what hairbrush tin food cleaner hold on i'll chop her in the garage
3862640	3868320	right i can see the hairbrush i'm going for it i said i'm going for the hairbrush no i'm getting
3868320	3880400	shoved out uh okay i got a hairbrush but she's fucking gunning for me i think we need to lock
3880400	3888800	her in or we can't progress you know that hold on oh maybe if i can grab her broom she always
3888800	3898720	wants her broom and then we lock her in yeah okay i'm on standby you must chase her in oh wait
3898720	3910320	i need a honk she's so violent with me she's so fast women give me we're both fighting over
3910320	3916000	for the freaking broom okay okay i'll stop fighting no no no i don't mean like that i just
3916080	3921760	mean she's so strong too geese can't be it best or oh wait i figured out oh my god oh my god i figured
3921760	3927120	it out pick it up and run no pick it up i need to pick up that piece give me the piece or put the
3927120	3934720	piece in the garage yeah oh my god she's pushing me away she's got like a five meter radius aura
3934720	3939920	or something about her honestly oh right i've got it i've got it are you ready are you ready are you
3940640	3944080	let me run out let me run out she'll take a second to fucking
3953760	3961920	i mean oh no wait wait wait she'll open it she's doing she's doing something she's opening
3962640	3968560	he's opening his side quick oh oh there's cleaner i found the cleaner
3969520	3974640	another there we go there we go i want to clean our progress progress we're gonna be trapped it's
3974640	3984960	it's fine it's fine tempai um well this is kiosk no oh my god our peri wait why are you i just
3984960	3990960	picked this uh the trash i literally just picked this out of the trash lady leave me alone i picked
3991040	3995680	it myself thank you jake for becoming a membo i appreciate it
3998880	4006800	is there right so does it only one hair brush hair brush intend food okay okay hair brush i can
4006800	4014560	do hair brush i'm pretty sure it's like over here okay her bro her broom is in tatters so maybe she
4014560	4020640	doesn't care that much hmm she cares a little bit you're here grab it grab it grab it grab it
4020640	4027360	oh my god please game please cooperate with me a little bit oh do you want to lock her in yeah
4027360	4034960	do you want to lock her in lock her in and get ready oh shit oh no women you're only supposed
4034960	4044640	to be a looking maybe a learning literally can no give me that back give me a book her aura's too
4044640	4053040	strong she like won't she doesn't listen like other npc she's so strong and hey hey give me that
4053040	4055040	Check this over here. Look at me
4061140	4068320	Yes, that'll do at least it's progress you are a nightmare lady you really are I need something W
4068320	4074520	Aste. I'm sorry. It keeps making the camera late. Oh, please just work. Oh, thank god. We did it Jesus. We're done
4075520	4077520	We're done, okay
4077520	4082400	Oh no! Look! She drew knee ducts on this. That's really rude. I didn't even appreciate that.
4082400	4085040	No, let's get one thing straight.
4085040	4088400	Oh. Oh! Ow! Ow! Ow!
4088400	4089400	Give me that.
4089400	4090400	Oh, lady!
4090400	4092680	Oh, Azara! Thank you for the raid!
4092680	4095320	She opened up a gate. Did we go through the gate?
4096920	4098120	I think we did it.
4098120	4100760	Granny got new knees. No wonder she's so fat. Yeah.
4100760	4102680	Man, screw this place. I'm going home.
4102680	4106280	We're gonna screw this place. We need trouble anywhere else.
4106720	4109840	Mmm. You're so rude.
4109840	4115400	Azara, welcome! Welcome, Raiders! Welcome to the stream of chaos!
4115400	4117400	Why?
4117400	4119400	Uh, left or right?
4119400	4120760	Oh, you're all right?
4120760	4123760	Oh, there's a pond!
4123760	4125360	Mmm, water.
4125360	4126160	Water.
4126160	4126840	Uh...
4126840	4127560	Daily clave.
4127560	4130360	Whoa! I saw that.
4130360	4132840	I saw that.
4132920	4136520	Is there a complete Little Nightmare confirmation?
4136520	4138520	Confirmation time.
4138520	4142200	Confirmation any Little Nightmare-ers?
4142200	4144440	We love dino-nuggies.
4144440	4146160	Hello, mister.
4146160	4147800	I'm playing with your lacrosse.
