start	end	text
60000	62000	Ah
180000	189000	Oh my god, my hands are there! Hi! Can you hear me good? I feel like the audio might be a little bad.
189000	193000	I don't want it to be cutting me out at all.
197000	205000	Hello, hello, hello! You sound great. Am I getting cut off? Should I make it even louder?
205000	209000	Testing, testing, testing, testing, testing, testing.
216000	218000	I know I'm not muted this time.
220000	221000	Okay.
223000	225000	I can't find the scuff. I know!
225000	231000	Last hand cam stream, it was so scuffed. The ASMR was so bad. I'm so sorry.
231000	236000	I figured out how to fix my camera so now you can actually see in good quality.
236000	241000	Also, my tracking isn't going to be as good because it was harder to set up.
242000	246000	It's not as simple as it looks. Okay, there's a lot of wires around me.
247000	251000	And there's a lot of technology around me, okay?
251000	254000	So sorry if the tracking isn't as good.
255000	261000	Hello, welcome. What happened to your pink setup? What do you mean by pink?
261000	264000	Oh, you mean like my mousepad? I'm on the floor today.
268000	273000	This is the two that I got. They're pop and cook and so basically they're just candy.
275000	280000	They're just candy. They're just candy and they look like food.
280000	286000	So this one's like the American one and then this one's like the Japanese one.
288000	289000	It's just the Japanese one.
289000	293000	So we're going to make, I don't know if we'll make both of these, but we're going to make at least one of them.
295000	299000	But yeah, we're on the floor. Floor gang. Floor wire at random? No.
300000	302000	The whole thing's going to come tumbling down.
303000	316000	Yeah, floor shim. I'm on a blanket today. Should I move my, I know you can see like my iPhone over there.
316000	319000	Sorry, sorry if it's annoying.
322000	326000	Which one do you want to, oh wait, first before we do anything.
332000	338000	The long awaited introduction. I have to introduce you to my rats now, don't I?
342000	346000	Right? Yep. It's time for you to meet the family.
347000	351000	We're getting really serious now. Oh no.
353000	358000	Is my camera getting fucked up? What are those? What are those?
362000	364000	Do you see that?
367000	370000	Bro, I thought there was going to be no scuff. This is a new camera. What the hell?
378000	383000	You do see that? Radiation?
384000	385000	Cough.
389000	390000	Hmm.
393000	394000	Hmm.
397000	398000	Dammit.
401000	402000	Sigh.
402000	403000	Sigh.
412000	423000	Okay, I'm going to switch cameras to my, um, to my phone. I'm going to use my phone as a camera.
424000	425000	Okay?
426000	427000	So I'll be right back.
432000	440000	I'll be right back. I'm going to try using my phone. I'm so pissed this is a new camera. What the fuck?
462000	463000	Okay.
492000	493000	Okay.
522000	523000	Okay.
552000	553000	Okay.
582000	583000	Okay.
612000	613000	Okay.
642000	643000	Okay.
672000	673000	Okay.
702000	703000	Okay.
732000	733000	Okay.
762000	763000	Okay.
792000	794000	Okay.
822000	823000	Okay.
852000	854000	Okay.
882000	884000	Okay.
912000	914000	Okay.
942000	944000	Okay.
972000	974000	Okay.
1002000	1004000	Okay.
1032000	1034000	Okay.
1062000	1064000	Okay.
1092000	1094000	Okay.
1122000	1124000	Okay.
1153000	1163000	Okay.
1171000	1172000	Okay.
1172000	1173000	Let me try something.
1182000	1208800	are you gay? oh my god! why are you acting so gay?
1208800	1213600	i'm sorry immy but i think the glitch wasn't the camera this and screen was glitching too
1214960	1221360	huh sorry oh my god it played on my freaking speakers i'm sorry let me change that too
1224000	1225120	it wasn't the camera
1225120	1227120	huh
1233520	1238480	this and screen was glitching too what isn't my whole isn't my whole bs
1243440	1246720	it was only glitching in the one spot bro you guys are confusing me
1247120	1259680	hey okay i used a different here's my vtube studio okay i used a different um
1263600	1268320	i use i have to change my blanket because i fucking got water all over it um
1268320	1270320	um
1273120	1274880	you can't donate you should be able to
1278480	1281920	yeah i had to change my blanket because i got water all over it um
1284080	1286640	i don't want you to see my feet though oh my god
1287360	1298240	okay well here's our new setup if you see my feet tell me so i can move move them away
1299440	1307440	okay are we safe are we safe can you see good is it glitching
1309680	1315280	this is a different camera i know my i know my tracking is bad but other than that
1317360	1324960	okay nails thank you thank you thank you no glitch no free feet looks good looks good looks good
1328160	1335040	okay okay tracking is fine it keeps uh breaking because i'm looking away from
1336000	1337920	i'm looking away from the um
1338240	1347440	from the fucking i can't i can't i can't think from the iphone looks good your
1347440	1351440	blankets don't thank you you sound like lividy i wonder why
1356000	1363440	okay okay fucking hell i'm so sorry for all this stuff let me situate i need to use
1364160	1371760	i need to use the boxes to like situate okay oh wow we have a lot more space now here okay
1372320	1380480	i'm gonna go get let me i'm gonna go get more water because i spilled all of it on my blanket
1383760	1390800	and then i'm going to show you my fucking rats and then we're gonna start cooking okay okay
1393920	1397200	lividy who's that sounds new i don't know who that is i've never heard of her
1399840	1410800	um all right i'll be right back i gotta get more water
1423440	1425600	don't
1453440	1468920	oh my god hello oh okay okay we're ready it's your birthday today cake and ice cream
1468920	1476120	is on the way what what do you mean it's my birthday are you ready to read the to meet
1476120	1495800	the rats are you ready to meet the rats yes okay okay okay let me show you the
1495800	1521280	first one well whoever I can get in my freaking hands first okay okay our first
1521280	1531880	contender is Luna all right no pixie sorry oh she's so scared this is pixie
1531880	1538560	there you go oh she's really scared oh she's scared of the light I think it's
1538560	1549520	okay pookie oh she's she's she wants underneath my legs I'm trying to like
1549520	1560920	get my my knees in shot so she'll come out come oh you can't see her she's scared
1560920	1572720	should I just turn off my model cuz it's so laggy come on there you go there you
1572720	1579040	go come on out okay I'm gonna turn off my model completely it's like really laggy
1579040	1595280	cool let's get the next one out
1609040	1630680	okay this one this one is Luna oh she's not as scared and then let me see if I
1630680	1642080	can get I can honestly say that I never expected to like your streams as much as
1642080	1647440	I do you are honestly the best and I hope to be able to enjoy your streams for years to
1647440	1674160	come hey this one's in her pod that one's Esteban okay I think the last one already
1674160	1689920	left the cage so she'll be walking around um how many rats you have I have four stop
1689920	1703840	don't look at my feet stop stop stop don't look at them okay now we can actually start
1703840	1708720	on the cooking cooking in the nook and which one do you want to do first I'll let you choose
1708720	1714360	do you want to do the the American one do you want to do McDonald's or do you want to
1714360	1725960	do um what is this what would this be called like should I do a poll wait I can't do a
1725960	1737440	poll can I how do I make a poll is there a mod here that can make a poll for me can a
1737440	1744040	mod please please make a poll for which one you can do like the colors um green or blue
1744040	1764440	this one's green and this one's blue mod check any mods in chat hello am I alone in here damn
1764440	1774240	we can't you can't make polls oh I'm the only one that can make a poll shit all right well I
1774240	1780280	want to choose this one because I want to if the mods can't do it I'll just choose let me wipe off
1780280	1787920	all the freaking lube from my camera make sure it's nice and clear there's chat yep okay great
1788480	1802800	hmm I'll move that further away we're doing work here first what's that what I didn't use it for
1802800	1809160	anything I don't know what you're talking about what I'll fucking eat scissors right right let me
1809160	1813920	go get scissors and then I have a fun update to give you guys I have a really fun update to give
1813920	1823920	you let me move my freaking phone too
1843920	1866400	okay brave to leave food and rat distance they will they will be they will be going for it trust
1866400	1876040	me they'll be going for it okay let me cut it open so my update where are rats they're walking
1876040	1882000	around I can't just force them to cook with me they're walking around let them walk around
1882000	1890760	they're not actually sitting on my head and cooking with me why are you acting so gay finally
1890760	1896080	caught an amibe zoo stream she spent three hours trying to make food from a box and then
1896080	1905040	accidentally showed her feet live on stream great to tuber she is shut up shut up I didn't spend
1905040	1917320	three hours but thank you for the tip geez it was more like it I actually spent like I actually
1917320	1922880	spent like an entire hour setting up the hand cam only for it to not work and then I have to go
1922880	1937720	back to my old shitty webcam that I used before well anyways here's your update so did I choose
1937720	1944040	the American one oh I did I forgot him I think it looks okay that's good that's good as long as you
1944040	1950720	like it oh my god I'm sorry I'm coughing so much it's not really helping that I am streaming
1950720	1962320	and talking loudly maybe I should talk quieter we can do like a little key ASMR I'm not okay I'm
1962320	1987200	sick as the buns looking at me right here's my story yesterday it's not really story it's just
1987200	1997680	something I want to tell you yesterday I was posted a picture on Twitter dot com of two are you gay
1997680	2004160	well why are you acting so gay can't always catch streams live but I'm happy to watch when I can
2004160	2012200	and sometimes even see toes keep up the great work sis thank you thank you for the tip
2012200	2020560	it's okay you don't have to watch them live you don't have to be here I have I'm really
2020560	2025640	thankful that you are here in the first place though so yesterday I posted a picture on Twitter of
2025640	2035720	some toys wink wink and I tried them out yesterday you heard me you heard me try it yesterday the
2035720	2041920	one I use well my hands are shaking the one I used for the audio that I posted yesterday was the
2041920	2048120	pink one and I'm sorry to disappoint you for actually both toys I'm sorry to disappoint you
2048800	2055520	pink one I couldn't figure out how to get it to work well because like from the shape of it it's
2055520	2064360	supposed to like how am I supposed to describe this on YouTube so from this okay from the shape of
2064360	2082040	it looks like it's supposed to like like like like it's like this shaped right so it looks like
2082040	2091200	it's supposed to go like that right like inside but like it was just kind of like like I couldn't
2091200	2097720	get it deep enough so it was kind of just like hanging out like like this instead of going like
2097720	2105200	I need to rip this off to really give you a good visualization here alright
2105200	2122520	alright so imagine this box is me right this is this is this is me and that's my underside so the
2122520	2127640	toy is like this shaped right so I thought it would go in like that but I couldn't get it in to go
2127640	2132080	like that it was kind of just hanging out like this it wasn't even like it's supposed to be like it
2132080	2141120	was frustrating it still felt good but it was frustrating that's all I have to say any um any
2141120	2151120	advice is appreciated please are the rats albino um Luna has red eyes but I don't think she's
2151120	2164040	considered albino we getting more feet did I show you more feet by accident oh shit I'm really
2164040	2172960	late on chat can we do this with shadow puppets what do you mean shadow puppets
2172960	2184520	no it wasn't double it wasn't a double toy was it wait was it did I use it wrong
2184520	2196760	please don't tell me I use the toy wrong that would suck I don't think so oh yeah right the
2196760	2202920	wand so the black one was a wand I think I just received a faulty product because even though
2202920	2212040	I charged it it still doesn't turn on good I'm such a fucking failure I charged it a lot and it
2212040	2219400	still doesn't turn on I don't know what to do like I've I even looked at the instructions
2219400	2223800	which I never do me instructions I mean okay I'll be looking at the instructions for this
2223800	2229360	but I usually never look at the instructions so I think I just received a faulty product I know
2229360	2234880	it's so disappointing does it require it does require an app and I did get the app and I did
2234880	2244480	use the app and the app is really fun hey the app is so fun but um it wouldn't it just wouldn't
2244480	2259960	turn on and it wouldn't connect so yeah that's a shame thank you for the burp readings
2259960	2269640	maybe if you give us a demonstration we can help you figure it out I'm not giving you a
2269640	2279960	demonstration wow dirty minded I think this is supposed to be a cutting board for me to use so
2279960	2285920	I'm gonna cut it out should I use this like I feel like I need a flatter surface for this
2285920	2297000	hello Esteban do you want to say hi come say hi to the viewers come here come on
2297000	2308520	I'm say hi oh she's too shy okay fine
2308520	2337560	no stop looking stop looking oh there she is also I saw some comments cuz I be looking at you
2337560	2342000	guys I know I'm every single one of you doesn't matter where you're from I'd be looking at what
2342000	2347560	you're saying and I saw some comments saying oh what she Esteban do you want me to cut you
2347560	2357080	because you're playing a really dangerous game right now um I saw some comments saying what she
2357080	2368240	she farted in her microphone that's gross I'm not watching streams anymore I don't want to play
2368240	2379400	with you anymore good leave I don't want you in my stream anyways if you can't appreciate my
2379400	2384520	forts I don't want you you're here for the girlfriend experience you think girls don't
2384520	2393640	fart get out of here you think girls don't poop you're in for a real surprise you're in
2393640	2403000	for a really Esteban look how cute she is I love her I love her so much I'm surprised Esteban is
2403000	2420920	the most explorative yeah girls poop and girls fart and you gotta kind of just learn to deal with
2420920	2429040	it and if you want to be my boyfriend you got to learn all about my pooping and farting she's
2429040	2436000	on my shoulder right now unfortunately I will not be able to show you that oh you want to hear her
2438000	2440640	sniff the camera I mean not the camera sniff the microphone
2445360	2450080	that's right if it's in me I'm down for anything that's right that's what I want to hear
2450480	2467680	isn't Esteban a male name dude it's a rat it's a fucking rat what do you even mean a male name
2467680	2474800	it's a rat do you think she knows she's a girl do you think she hears me call her name do you
2474800	2480080	think she hears me say the word Esteban and she thinks oh fuck that bitch she called me she named
2480080	2494000	me after a man no it's just a rat who cares I don't care she's not gonna get bullied by the other rats
2496240	2501680	who is gonna bully her the babies because they're the only ones with female names
2505600	2511040	rats are very smart they're not they're not that smart they're not that smart
2513280	2518720	she's not sensitive oh my god no absolutely not the sensitive ones are the babies
2521360	2528640	Esteban is one of the least sensitive ones and I think you're I think you might need me another one
2529360	2536480	Dennis is very shy that's why I didn't pick her up and show her to you but she's near me right now
2537760	2545440	fish who you call an Esteban I am Princess Buttercup no her name is not Princess Buttercup
2545440	2553440	her name is Esteban deal with it how'd you get your rats um
2554080	2558240	oh my god
2563200	2571120	it all started when I wanted a hamster and I looked up on google hamster videos
2571120	2575120	or not on google but on youtube hamster videos and um
2575440	2585120	well I was looking at videos of hamsters I learned that hamsters don't really care about their owners
2585120	2588880	that much are these instructions
2594000	2597360	I will keep this for instructions okay
2605280	2608560	so I learned that hamsters don't really care about their owners that much
2609120	2615200	and in my head I was like if I'm gonna get a pet and if it's gonna look this cute it's gotta care
2615200	2623840	about me I'm sorry it's gotta care about me because if I'm gonna care about some cute little
2623840	2630160	creature I wanted to care about me in return you know I was a little lonely yeah I was a little
2630240	2635840	lonely and I needed a pet to love me back I wanted a pet that loved me so yeah
2639120	2647120	so um I think I don't know how I just found out that some people kept rats as pets too
2647680	2651520	when I was um when I was looking like
2655200	2659760	you know looking through pet videos of small animals I debated on getting mice
2659840	2664240	maybe but then I found out that mice also don't really are you stealing your shit
2666480	2673920	I found out that mice also don't really like you back either so finally I landed on rats
2681680	2683440	hamsters die in some weird ways
2684000	2688160	oh my god
2697840	2703200	they don't it's not that they die in weird ways they're just really neglected animals
2703200	2705760	it's kind of depressing how neglected poor hamsters are
2705760	2712720	are they gay why are you acting so gay
2726160	2731040	thank you unlucky genius for the three dollars why do you keep why do you guys keep giving
2731120	2739520	three dollars and 33 cents I keep seeing 333 is there a reason can you like not are you
2739520	2752560	guys like in on it somehow you didn't see my shadow well yeah angel numbers oh it's one of the
2752560	2759920	default options oh okay I was just wondering why that specific number I was like why is everyone
2759920	2764240	giving three dollars and 33 cents thank you though thank you I appreciate you
2769600	2770560	all right um
2772960	2773680	anyways so
2777040	2786480	fuck me oh my god I'm losing my voice holy shit hello hello wait
2787280	2797040	hello okay I should probably talk quieter sorry it's gonna be an asmr stream it's an asmr stream
2797040	2802720	now so um anyways um
2802720	2808960	um
2810720	2819040	as the one just fucking turned over my cup of water okay so um I landed on rats and I was like
2819040	2820320	okay let me get a rat
2824160	2827280	wait I can't speak Japanese I don't know which one to use
2828160	2830000	shit wait
2837440	2841360	do I use the yellow one but these are fries oh yeah these are fries okay
2844640	2848240	um what was I talking about right I landed on rats
2850080	2854960	and at first I was like okay let me go to the pet store and buy a rat
2855520	2861680	well buy two rats because they need to be in pairs um but then I saw the prices at the pet store
2861680	2868480	and I was like holy shit yeah no it's like $20 per rat are you shitting me
2869920	2877040	am I willing to spend like thousands of dollars in vet in vet um fees of course of course of course
2877040	2884560	am I willing to spend $20 on a rat no I'm not spending $20 on a rat so I went on Kijiji
2884560	2895360	which is the Canadian version of um Craigslist um and I just happened to um
2897520	2903920	what are you making I'm making candy I happened to be really lucky and I found
2905280	2909840	um some random teenager that was giving away her two rats
2910640	2916160	how much do I put is there a line
2921440	2925680	just pick one up from the subway no how much do I put
2929760	2936880	oh I use this to measure okay are you gay why are you acting so gay
2937520	2942400	a couple of years ago I threatened my family with the purchase of five guinea pigs if we
2942400	2948400	didn't finally get a dog after years of breaking promises long story story we got a dog
2950880	2956160	how is getting a guinea pig a threat that's not a threat what do you mean
2956160	2960080	threat oh you know what I can do what do you mean threaten my family thank you for the
2960160	2962800	$420 though I think it was $420
2965200	2970240	that's not a threat I want guinea pigs guinea pigs was one of my options if I wasn't gonna
2970240	2975040	get rats I was gonna get guinea pigs let me use this straw one
2979760	2983840	right fuck oh fuck it won't come out god damn it okay
2984720	2992160	oh this is a bad idea should I just dip maybe I'll just dip
2995920	3001840	but five of them five guinea pigs sounds fine are you kidding me I love five guinea pigs I already
3001840	3012880	have four rats so yeah I found a random teenager um who was giving away their rats on could Gigi
3013840	3018960	and that started my journey of rats and ever since then I've gotten more an estaban and
3018960	3028560	deniser from a rat rescue they're not they're not from kijiji yeah and pixie and luna are
3028560	3037680	from kijiji though I'm actually allergic to guinea pigs oh no that's a sad that's a sad sad depressing
3038400	3047600	life yes they do need rat friends rats do get lonely is denison menace absolutely why did why do
3047600	3056720	you think I called her den is yeah I tried to do that but um this straw is like stuck in there
3057360	3064320	it has like um a stopper so I can't take it out yeah
3070960	3074000	no it's not a stanley cup it's just a random cup
3080400	3084640	the upkeep for five is never ending they also fight constantly wait guinea pigs fight oh
3084720	3089920	fuck I'm not even paying attention to what I'm doing here I don't I don't think this is enough water
3091600	3098240	this is nowhere near enough water damn it what if I just
3101120	3102160	or I guess I can do it
3103040	3116080	I thought guinea pigs liked each other that's why you get multiple because they want to be together
3117360	3121200	stop making imie excuse her canadianness what do you mean
3124720	3130160	so get the rats and pairs if you get them okay perfect for needing them catch on in deku
3130160	3133520	and then that way you can make them kiss and roleplay as kachan and dick
3137920	3138960	that would be so funny
3149920	3157200	it's already gonna be botched what why this it's not botched I still feel like it's not enough
3157280	3162160	um I still feel like it's not enough though and not enough water
3165280	3170960	kachan you have some cheese on your lips is that lips kachan you have some cheese on your lips
3172560	3176960	leave me alone deku kachan let me lick it off of you
3176960	3191200	it's gonna become too liquidy shut up shut up nerd I can do what I want
3191440	3204800	okay now what do I do does it put in the oven
3207200	3209200	oh I was supposed to microwave it
3211840	3217440	is that a microwave oh you can't see is that a microwave that looks like a microwave
3221200	3230080	oh I'm supposed to microwave this shit multiple times oh you bitch
3232640	3233600	microwave
3239120	3241120	this one doesn't have a microwave
3244000	3246960	man man
3251840	3262160	okay I'm gonna go microwave it I really don't want to I don't want to leave the bedroom I don't
3262160	3268400	want to leave you alone don't go sniffing in my underwear okay you stay right here while I'm gone
3268400	3273680	I don't want you snooping around my bedroom okay okay how long do I microwave it for
3276160	3278320	I can't read Japanese what does it say
3278480	3280480	uh
3287280	3288480	I'm trying to read it um
3292080	3300240	you guys know no promises about tree fitty one hour okay you're not helping
3300720	3308960	I'm gonna assume it's 40 to 30 seconds I'm guessing that's what that means you
3308960	3314160	can't even see that probably um but yeah I'm gonna assume it's 40 to 30 seconds
3315200	3320320	so I'm gonna put it for 40 seconds because I have a small microwave you stay right here okay
3321360	3326000	don't do anything sus I'll know if you do okay okay
3330240	3332000	so
3420240	3440360	guys she stole one of my ingredients are you shitting me right now
3450240	3461400	oh my god what do I do what do I do okay let me turn off my camera so I can chase her
3461400	3491080	okay well I'm an idiot she stole the empty package so it's okay
3491080	3501000	she just stole the empty package I should have put it in here all right I thought
3501000	3506920	she stole one of the ingredients that I would need but she didn't she got me yep
3506920	3514120	she got me false alarm first false alarm so I brought cheese for the rats and
3514120	3518360	also for me cuz I'm I like cheese
3522040	3529640	oh my god don't eat that here have some cheese take it take the cheese there you
3529640	3535040	go good girl here you can have some cheese Venice
3535760	3547160	okay she left me I missed you I missed you too I'm gonna be eating Havarti
3547160	3551560	cheese cuz it's my favorite type of cheese there she is hello this is Dennis
3551560	3558480	you can't really see her she's very shy and she also likes to bite there you go
3559160	3579720	right right back to cooking I'm so I'm so not not organized here I'm so sorry we
3579720	3590760	gotta get ourselves organized okay there now I'm organized okay wait where's my
