start	end	text
3590760	3599960	cup of water oh there okay so this is how it turned out um it smells like it
3599960	3606960	smells like cake kind of like a cookie and I guess I'm supposed to cut it now
3606960	3618680	into the shapes I guess this is my knife it's not working it's really hard
3620680	3631560	should I just snap it what do I do does it actually look good by the way I'm not
3631560	3634920	gonna be eating these afterwards so I don't care if my my rats put their face
3635080	3647600	in it I'm not gonna be eating them I can't cut it okay okay well she's still she's
3647600	3656920	still half of my fries um okay there we go I can break it I'm just gonna break
3656920	3666000	them do you want the other give it back give it back give it back give it back please
3666000	3677160	please I need fries for my burger I need fries for my big triple I need fries for
3677160	3689800	my big triple burger combo leave me alone go wait um oh maybe maybe I shouldn't
3689800	3696920	maybe I shouldn't have put it in for 40 seconds that's our fries I'm sorry they're
3696920	3714800	not good I tried my hardest I'm so sorry oh well I'm gonna put the fries somewhere
3714800	3718680	where they can't get it okay here you guys can have cheese don't don't steal my
3718680	3723160	fries but you can have cheese you too Dennis here okay she's running away from
3723160	3728740	me yeah they're just boiled potatoes they're just boiled potatoes
3728740	3741120	yeah I like boiled potatoes too don't eat my potatoes take the cheese
3741120	3759240	sorry let me finish my cheese here don't take my potatoes don't take my
3759240	3763400	potatoes don't take my potatoes take the cheese take the cheese take the cheese take
3763400	3773200	the cheese okay okay where do I put this where they can't get it I'm gonna put
3773200	3781400	in one of the bags actually do I have a bag to put this in but I was not very
3781400	3795120	prepared for this dream as you can tell where do I put where should I put where
3795120	3804440	should I put my fries um I'm Marcy's here hi Marcy um okay I'm gonna be right
3804440	3809720	back I'm gonna go get like a like a Tupperware cuz I'm gonna need to I mean
3809720	3813640	I'm gonna need a place to put all the finished food and I don't want them to
3813640	3821520	be stealing it it's my fries I've been giving you guys cheese okay I'll be
3821520	3826920	right back oh you you hate me she hates being pet
3827920	3832720	don't steal my don't steal my knife don't steal my knife give me my knife
3833040	3844680	Jesus Christ okay don't steal it go away I need my cooking utensils go away
3849800	3853160	go away okay I'll be right back
3892720	3904560	okay I'm gonna be storing all food inside of this Tupperware where no rats
3904560	3913400	can steal it from me okay good good job good job good job Amy you're so smart I
3913440	3923240	know I know I am thank you Amy okay I lost chat
3926160	3937480	is she be here too no she be not here is she good girl I know thank you okay
3937480	3946000	what's the next step the next step is to make the burger patty okay so here's the
3946000	3948240	patty
3951520	3957120	she be being a lamb oh is she be playing cult of the lamb see the way to
3957120	3961240	get her to go away from you is to try to pet her cuz she hates getting pet I
3961240	3966040	love this rat I love her too she's very explorative and also keeps trying to
3966040	3977800	steal everything don't steal that don't steal it don't steal my shit you can
3977800	3984640	smell but you can't steal there you go that's right you can smell it but you
3984640	3991720	can't steal it all right okay that's enough that's enough go away go away go
3991720	4001560	away come on go away okay maybe I should put her back in the cage she's the
4001560	4005080	only one that's really causing me issues
4006080	4013120	all right put the patty is this the right thing oh shit these are the
4013120	4021200	burger buns wait no these are the patties no these are the patties what all
4021200	4027240	the patties supposed to go in here she's trying to steal my cheese package
4027840	4041720	oops the patty is supposed to go in here isn't it okay um how am I gonna put the
4041720	4047480	patty in there get your freaking nose out of my candy get your nose out of my
4047480	4059720	candy go away she's like snorting it please please five seconds apiece thank
4059720	4066560	you okay I'm gonna I'm gonna cut it cuz I put it it's this was supposed to go in
4066560	4074400	here yeah so I'm gonna cut it and and flip it over okay come on I gotta cut it
4074400	4093440	away from her she stole it okay well I guess we're not having cola she's
4093440	4097640	messing with it now okay I'm hoping that's gonna distract her so I can
4097640	4101480	actually cook I need a cook
4101480	4130000	oh my god I'm gonna cry this is the scuffiest dream ever my burger
4131800	4142000	come away you're making it work
4142000	4155440	what do I do what do I do I'm gonna cry I can't make a burger without the
4155440	4174480	patty it's not salvageable no it's not what do I do I just got a pile of crack
4174480	4187600	cocaine on my blanket let us wrap go vegan okay how do I clean this um okay
4187600	4193760	I'm just gonna go get some napkins this wasn't supposed to be so difficult if
4193920	4205400	the pun wasn't being a little shit you hear that don't steal the box she's just
4205400	4212160	licking it off we're making crack now so let's just snort it off of the blanket
4212320	4225440	you know put in a line just for you there you go there sniff it up go on
4225760	4238520	sniff it up we're truly cooking here this has devolved into into real cooking
4238520	4251880	okay I'm gonna go get some napkins I have no way of I don't I don't really want to pull out the
4251880	4258240	vacuum because I feel like that's gonna be really annoying so I'm gonna go get
4258240	4264560	napkins and see if I can try to pick up all this dust
4311880	4327320	crack pile get out of the crack pile okay I want to see if I can try wedding this
4327320	4335040	napkin a little bit and seeing if it'll like pump up wow I shouldn't have wet it
4335040	4342160	should I have what am I doing wrong here bro my beautiful blanket my beautiful
4342160	4360160	beautiful blanket oh fuck it smells delicious though I don't want a vacuum
4360160	4368200	it's too much work right now I'm trying to wait I'm trying to I'm trying to cook
4368200	4390080	right now okay so I've decided to bring a cutting board
4391000	4402800	okay there we go and now you have somewhere to focus on the on the carpet here because
4402800	4413760	it's a very busy we got a very busy stream going on here don't leave okay
4414760	4425280	I see chessboard more like my chessboard it's really dirty I don't like I'm not don't worry
4425280	4433600	about it don't even look at it don't even look at it right um so we're gonna I'm gonna try making
4433600	4448400	a patty anyways um we're gonna try making a patty with the very little amount of she's
4448400	4456440	trying to lick it from the side with the very little amount of patty um patty powder we have
4456440	4462360	left okay I love your nails thank you thank you sir I haven't been able to read chat much
4462360	4467320	just because my fucking rats they stole my knife didn't they they stole my knife didn't
4467320	4484240	they it's not here all right I'm trying to get stop it stop it I've had it up to here with you
4484240	4497760	okay that probably is more than enough water this is gonna be the patty I think it should be
4497760	4513000	enough it smells really good oh fuck it smells so good it kind of looks like cacao
4513000	4532200	oh did I I think I spilled more um okay come on um maybe it's not enough for a patty
4532200	4542920	do you think it's enough should I try to microwave this like literal shit pile should I try to
4542920	4551280	microwave this little literal shit pile I have in front of me here what do I do with this should
4551280	4559760	I eat it I'm not gonna eat it I don't want to see any comments being like ill Amy did Amy ate
4559920	4572840	blank Amy ate a thing that her rat sniffed shut up me and my rats are one okay um I'm gonna try to
4572840	4584360	microwave this little piece of shit here I don't know if it'll end up good but I'll try okay um let me
4584360	4594240	should should I try to shape it into a patty shape first in there shape into a patty this is um
4594240	4600400	we're on a budget okay this is a budget burger we don't really have a lot of money for meat meat is
4600400	4611240	really expensive nowadays so you know it's gonna be really thin I'm sorry all right I'm gonna go
4611240	4620840	microwave this I'm gonna microwave it for like how does it say oh I have to make everything I have
4620840	4628760	to make the buns to first oh okay all right let's make the buns where do I put the buns oh the
4628760	4641640	buns go in the same thing okay okay that's because you shop at Loblaw's stores hmm where do you shop
4641640	4648400	doesn't Loblaw's like literally own everything oh fuck it smells really good
4648400	4663040	we'd still eat it oh really you would really eat my cooking after my rats sniffed on it and
4663040	4682400	licked it I don't shop I steal like a rat yes you would eat my cooking oh thank you thank you
4682400	4694440	I'm happy you would do that we must show you how much we love you you're too nice maybe I'll give
4694440	4702200	you a little toe slip just for that okay there you go there's a little reward for being so nice
4703160	4715680	um right so she stole my little container for water so um how much to okay well I need I okay I'll
4715680	4728120	just eyeball it we love Amy toes yes you're welcome you're very welcome the grippers were out for
4728120	4746640	point two seconds okay um that's one I feel like I'm using a syringe right now I'm back in
4746640	4754640	lab class using a syringe training chat with toes now I was I didn't think of it as a strategy I
4754640	4760280	was truly just rewarding you for good behavior that's all it's not I'm not training you
4768120	4778800	I missed it can you do it again nope nope nope only once you just get is it supposed to look like
4778800	4787880	this this looks kind of gross you can only get it once okay no don't look at her standing try to
4787880	4807080	get it out your nails hurt be careful when causing me trouble all stream did you know
4807080	4814280	she was one of my freaking wet best-behaved rats before this did you know that because it
4814280	4825520	doesn't you can't really tell about it anymore can you you act like you you act like I never
4825520	4847360	feed you that's how you're acting right now maybe she is acting up for the camera I can
4847360	4853360	hear the other ones chewing on the cup that she stole from me too I feel like I need to add more
4853360	4864040	water this is not working out you're so fat what happened to you why'd you gain so much weight
4864040	4875160	yeah she wants to be a streamer get out of my get out of my bogear
4875160	4892080	why is that dog so small I don't know I think she kind of just came like that she was just born
4892080	4911240	like that what's archetype architect posting what does that mean I keep seeing people say
4911240	4919320	architect architect architect this architect that what's architect mean what does that mean what
4919320	4934560	is an architect can someone tell me like is it just is it just like um like you know the job of
4934560	4943160	making buildings they like building they design buildings I feel like you're lying I feel like
4943160	4951840	it's a fetish a feeder wait is it actually a feeder fetish is that what architect architect means
4951840	4963120	like big it means you like I'm thick oh you like I'm thick oh I got some of my finger
4963440	4972560	wait I have napkins what am I doing that wasn't a fart that was me ripping the napkin
4972560	4979960	it's a reference to a movie you don't want to go down the rabbit hole in me why not I like
4979960	4990240	them thick too I like thick girls it was not a fart it was not I would be very honest with you if
4990240	5008560	it was a fart I literally farted in my microphone yesterday why is my holy shit wait I'm trying
5008560	5015040	to see how far behind my stream is it's not that far behind I missed the fart yesterday it's still
5015040	5022000	up you can go look at it it's still up don't you worry pookie it don't you worry your little head
5022000	5031200	I think I added too much water it's like disgustingly slimy god it looks like I'm just playing with
5031200	5038440	caca I don't have okay I don't have a poop kink I just like pee pee poo poo jokes I just like
5038440	5041600	poo poo jokes okay I don't actually have a poop kink
5051600	5061960	motto motto I I am motto motto I like them big I like them chunky I like them big something
5061960	5075760	look out I think motto motto likes you alright I'm gonna go microwave this disgusting piece of shit
5091960	5106040	I shouldn't have tasted it it tastes really disgusting oh my god that some people sent me a
5106040	5110200	marshmallow saying they wanted to hear me gagging on their dick so there you go that's exactly what
5110200	5116280	it would sound like okay I'm gonna go microwave this I'm gonna put it in for 30 seconds and then
5116280	5120600	I'm also gonna clean up my freaking straw because these bitches be licking on it
5176280	5202120	I'm back I'm back
5207240	5216760	okay so this is what it looks like after being um as someone's going to be the new member feeler
5216760	5223240	at this point she's gonna be the sixth member no don't don't don't lose my rat absolutely not
5225000	5230680	I missed you oh I missed you too hey I swear I had oh wait I think I put it in here
5230680	5246920	maybe not whatever so this is our uh burger it seems like
5246920	5253960	wait so this is half of our burger
5259880	5263560	I didn't think she would be able to actually take it out of the freaking
5265400	5273320	it's okay we can make do we can make do we can make it work um this is kind of gross
5274120	5276520	right there's our burger
5279400	5286360	there's our burger stop I'm gonna put this burger into the container of food
5289400	5296280	yeah country girls make do okay so this burger is gonna go with the rest of the food that I've
5296840	5299000	made that I've created
5313000	5313880	oh what's next
5319880	5322040	next is the cheese okay
5322760	5332680	wait did you steal my cheese did you I'm supposed to have cheese
5337080	5344360	ah shit yeah this is your bento blocks for tomorrow at school yep I'm making your I'm
5344360	5351720	making your lunch for tomorrow um is this the cheese this is the cheese right this looks like cheese
5352040	5354040	okay
5355560	5356600	say this is the cheese
5368760	5374840	I think it's the cheese where does the cheese go I'm supposed to mix it in here okay
5375160	5375660	okay
5377400	5384280	what breed is that turtle it's a golden retriever let me clean this out say jeezu
5385240	5388760	blue cheese I think it's just in a blue container for some reason I don't know why
5389320	5396760	and there goes my spoon there goes my spoon okay great there goes my spoon
5398120	5403400	and now they're fighting probably for the spoon um
5405080	5413800	I'm losing my god damn sanity okay I guess I'll just use the freaking scissors to mix it
5421240	5424920	we should do a part two to this where I make the other one all right
5427640	5431720	I guess I just put it in here and then I only put
5432680	5439080	one container of the water apparently excuse me
5443560	5447000	that's full of trash get your head out of the trash now you have
5447960	5455480	particles all over your face what happened what happened why is your face covered what happened
5456360	5463000	by the way I don't I don't abuse my rats I know she's flinching a lot she just hates being touched
5463000	5470440	and um she hates being touched and pet and picked up um she's not flinching because I hit her
5470440	5479720	he hits you does okay she just stole my freaking she just he hits you doesn't he I don't hit my poor
5479800	5487720	rats she just hates being touched that's all right
5489480	5494840	guys they're fighting over the shit that they stole from me right now I can hear them squeaking
5496200	5501480	right this is truly a crack house we make do with what we can
5505800	5509400	yeah she just thinks it's a game this is a game of how much can she steal from Amy
5510680	5514520	the more items you get the more points you get we collect more points
5519400	5523000	it's this is not a crack house it's a crack home
5527880	5531320	let me put a little more water more okay there
5531480	5538760	all right look this cheese actually looks pretty good aren't you excited to eat the
5538760	5549320	to eat the the lunch I made for you for tomorrow it's gonna be so yummy you're gonna love it
5552360	5555800	I definitely didn't trim my pubes with these scissors
5556040	5562200	actually I feel like you would like that wouldn't you you creep your freaky little creep
5565000	5567480	I mean pubes what pubes I don't have pubes
5574120	5579480	okay now I have to shave this on on the cutting they gave us a little cutting board
5581080	5583880	this is a cutting board now I have to shape it into a squishy
5584680	5587720	okay there
5595080	5597560	um oh god wait it kind of smells cheesy
5599240	5603720	uh kind of very very minimally very minimally cheesy
5606600	5608680	pubes I call that garnish
5608760	5615320	oh my god you're disgusting garnish
5617960	5623400	deliciously cheesy or no how does it go dangerously cheesy is that the Doritos
5624360	5631560	I'm trying to like line it up somehow there I do have real cheese I can put in your burger if
5631560	5636360	you want real cheese it's right next to me I might have to just put real cheese
5639000	5642120	because I'm having a lot of trouble making it square shaped
5643640	5650920	okay should I flatten it maybe no it's just not gonna stick to itself I thought this was candy it
5650920	5656840	is candy it's candy that I'm putting in your lunch tomorrow all right there's your cheese
5657880	5662200	you're welcome I tried really hard for this okay so you better eat it all
5662520	5669160	would you do a toe stamp what's a toe stamp what's a toe stamp
5673960	5682760	Amy it looks amazing oh thank you so much candy's nuts I think guess the button is
5682760	5686440	finally full she finally left me alone um
5686440	5693640	um what is this is this a ketchup
5697080	5697480	all right
5701800	5704440	finally the last thing we're making is ketchup
5708280	5713640	do you like ketchup I like ketchup and I like mustard and I also like mayonnaise mayonnaise is
5713640	5721480	my favorite um condiment yep I know controversial I know controversial but mayonnaise is my favorite
5721480	5727800	condiment I dip me I dip my fries in mayonnaise I dip my burgers in mayonnaise I dip my chicken nuggets
5727800	5739160	and I dip my chip chip chip chicken nuggets I dip my chicken nuggets in mayonnaise I dip what else
5739160	5743240	do I dip in mayonnaise what else can you dip in mayonnaise
5746920	5748760	wait how am I supposed to put this on the
5752920	5754680	how am I supposed to put this on the burger
5757960	5763640	I dip my finger in mayonnaise is mayonnaise an instrument
5763960	5771400	yeah right the thoughts on mayo and pizza
5773720	5776760	you're going a little too far now oh wait how am I supposed to mix this
5778920	5785160	I'm just gonna use this to mix it oh wait didn't I use this to mix it last time I can use this
5785160	5785880	I'll just use this
5785880	5794680	hollandaise I've never tried hollandaise sauce from from my memory I don't think
5795400	5798840	I think I don't know I'm not sure if I tried hollandaise sauce before
5804120	5807480	ranch on pizza is delicious that sounds great I like ranch
5813160	5814440	hollandaise is god tier
5816040	5820440	I think I've tried hollandaise on like
5822760	5824280	breakfast oh this is really
5836120	5837720	oh my god it smells so bad
5838600	5845320	I've never wanted to lick a pair of scissors more than now
5849640	5856040	I'm okay I'm okay it's just really gross okay well I can't actually um
5858200	5862920	I can't make the coke it's supposed to come with coke but Esteban stole my coke cup so
5863000	5871960	yeah oh here's the cola but Esteban stole my cup for my cola so um that's not happening
5875320	5876760	all right let's put this stuff away
5883640	5887960	and um let's put this stuff away because that's for the cola
5893480	5902840	this is for the fries this is for the cola that we don't have
5904760	5914360	just eat the powder I don't I can't even handle smelling um I can't even handle smelling the
5914360	5920120	freaking ketchup get your nose out of the ketchup so I'm not gonna be eating the powder okay
5923800	5927000	wait oh wait
5931320	5931880	stop it
5941560	5947640	right some people have had some questions about whether or not I will post on my um previous
5947640	5953560	channel I got some mayonnaise some mayonnaise I got some marshmallows about that no I'm not
5953560	5960600	gonna be posting on my previous channel when I'm um during oh wait I'm not gonna be posting on my
5960600	5967480	previous channel while I'm um Amy um and also I will not be updating the my previous patreon while
5967480	5974440	I'm Amy because I just don't have don't have the time strongy on the other hand holy shit I don't
5974440	5981240	know how she does everything she does but I just can't so yeah I'm sorry apologies for that
5981800	5987000	should I I need tape oh I don't want to get the tape um
5990680	5997640	and also um I will not be opening reopening the the previous patreon subscriptions because
5997640	6001960	then that's gonna charge people and I don't I'm not gonna be making new content so why would I
6002040	6010120	charge people however comma not that I encourage it but if you really really want to listen to the
6010120	6017080	old content it's out there for you unfortunately unfortunately it's out there if you really want
6017080	6030280	to find it okay I need tape um okay let me go get tape and then I'm gonna put it all together
6030920	6034440	our wick here's all here's our wick donald's tray
6036680	6044040	what is strani's other channel I don't know other channel what did I say that no I didn't say that
6044600	6046600	I don't know I don't know what you're talking about
6049080	6050600	hey brb
6060280	6070600	so
6079800	6080600	okay
6084440	6088280	um yeah strani other channel what you want to but I don't know I don't know
6088920	6093400	hello hello hello welcome is our new people suddenly joining what do you mean every artist
6093400	6099640	hates their work what no that's not what I mean I don't mean unfortunately as in I hate the previous
6099640	6105080	content I'm just saying the previous patreon content is is out there if you want to find it
6105080	6113880	unfortunately that's what I mean and also I don't know if I if I should like post it like on
6114680	6118360	this account because I know people want to listen to it it's kind of locked behind a paywall
6118360	6123320	right now a paywall that you can't even pay so you it's not even locked behind a paywall it's just
6123320	6133080	locked but um it would feel weird because it's not even my name like um it's my other name so it's
6133080	6139960	like you're not I don't know I feel like I don't know people are really scared that I'm gonna leave
6139960	6149240	don't worry I love you don't leave um um is this is this it do I just close this
6155400	6163400	can I you still keep in contact with pointless any others um
6163720	6169720	who I don't know who you're talking about
6173560	6179880	I'm kidding I have internet friends of course I keep in contact with my internet friends
6180600	6184840	that'd be mean to just leave them I have a lot of internet friends that I kept in contact with
6184840	6190040	from before that'd be so mean to just leave you think you think I just leave all of my friends
6190040	6197960	no no I love the friends that I met through ASMR because sorry um I kind of had to but the people
6197960	6204360	that I've met through other ways like through streaming um or through like fellow ASMR artists
6204360	6207960	of course I would keep in contact with fellow oh wait that's not the trash can of course I would
6207960	6212600	keep in contact with those people they're my friends and you're my friends too don't worry you're my
6212600	6222040	friends too strawney's home for sad girls what are you trying to say what are you trying to say
6223560	6224040	huh
6232280	6237320	I'm searching amybzu on patreon it doesn't pop up yeah because my account does um nsfw content
6237320	6244040	you have to just find it through the link I'm pretty sure you have to click on the link
6244040	6247240	lunch is ready for school should I eat it
6256440	6257480	it tastes like nothing
6257720	6268280	okay I'm gonna try to there we go so this is the bottom patty and this is the top patty
6272760	6280920	and then there's your um there's your burger patty oh sorry this is the top bun this is the
6280920	6286920	top bun and this is the no this is the bottom bun and this is the top bun and then this is
6286920	6294760	your patty and then that's your cheese oh shit um your cheese fell a little bit and then here's your
6294760	6305400	fries are we on a diet no what do you mean this is so much food this is literally so much food
6305400	6310760	like just looking at this I'm I'm getting full just even thinking about all this food
6310840	6314600	so there's your fries
6322120	6329160	there you go fuck go in okay there's your fries there's this is your top bun oh wait right of
6329160	6344200	course your um your ketchup your ketchup there you go my god ew your ketchup
6349720	6353880	ew so yummy in my tummy
